RAC1,P63000,Ras-related C3 botulinum toxin substrate 1 (EC 3.6.5.2) (Cell migration-inducing gene 5 protein) (Ras-like protein TC25) (p21-Rac1),TC25,"FUNCTION: Plasma membrane-associated small GTPase which cycles between active GTP-bound and inactive GDP-bound states. In its active state, binds to a variety of effector proteins to regulate cellular responses such as secretory processes, phagocytosis of apoptotic cells, epithelial cell polarization, neurons adhesion, migration and differentiation, and growth-factor induced formation of membrane ruffles (PubMed:1643658, PubMed:22843693, PubMed:23512198, PubMed:28886345). Rac1 p21/rho GDI heterodimer is the active component of the cytosolic factor sigma 1, which is involved in stimulation of the NADPH oxidase activity in macrophages. Essential for the SPATA13-mediated regulation of cell migration and adhesion assembly and disassembly. Stimulates PKN2 kinase activity (PubMed:9121475). In concert with RAB7A, plays a role in regulating the formation of RBs (ruffled borders) in osteoclasts (PubMed:1643658). In podocytes, promotes nuclear shuttling of NR3C2; this modulation is required for a proper kidney functioning. Required for atypical chemokine receptor ACKR2-induced LIMK1-PAK1-dependent phosphorylation of cofilin (CFL1) and for up-regulation of ACKR2 from endosomal compartment to cell membrane, increasing its efficiency in chemokine uptake and degradation. In neurons, is involved in dendritic spine formation and synaptic plasticity (By similarity). In hippocampal neurons, involved in spine morphogenesis and synapse formation, through local activation at synapses by guanine nucleotide exchange factors (GEFs), such as ARHGEF6/ARHGEF7/PIX (PubMed:12695502). In synapses, seems to mediate the regulation of F-actin cluster formation performed by SHANK3. In neurons, plays a crucial role in regulating GABA(A) receptor synaptic stability and hence GABAergic inhibitory synaptic transmission through its role in PAK1 activation and eventually F-actin stabilization (By similarity). Required for DSG3 translocation to cell-cell junctions, DSG3-mediated organization of cortical F-actin bundles and anchoring of actin at cell junctions; via interaction with DSG3 (PubMed:22796473). Subunit of the phagocyte NADPH oxidase complex that mediates the transfer of electrons from cytosolic NADPH to O2 to produce the superoxide anion (O2(-)) (PubMed:38355798). {ECO:0000250|UniProtKB:P63001, ECO:0000250|UniProtKB:Q6RUV5, ECO:0000269|PubMed:12695502, ECO:0000269|PubMed:1643658, ECO:0000269|PubMed:22796473, ECO:0000269|PubMed:22843693, ECO:0000269|PubMed:23512198, ECO:0000269|PubMed:28886345, ECO:0000269|PubMed:38355798, ECO:0000269|PubMed:9121475}.; FUNCTION: [Isoform B]: Isoform B has an accelerated GEF-independent GDP/GTP exchange and an impaired GTP hydrolysis, which is restored partially by GTPase-activating proteins (PubMed:14625275). It is able to bind to the GTPase-binding domain of PAK but not full-length PAK in a GTP-dependent manner, suggesting that the insertion does not completely abolish effector interaction (PubMed:14625275). {ECO:0000269|PubMed:14625275}.",,,enzyme binding [GO:0019899]; G protein activity [GO:0003925]; GTP binding [GO:0005525]; GTPase activity [GO:0003924]; membrane scission GTPase motor activity [GO:1990606]; protein kinase binding [GO:0019901]; protein-containing complex binding [GO:0044877]; Rho GDP-dissociation inhibitor binding [GO:0051022]; thioesterase binding [GO:0031996],"DISEASE: Intellectual developmental disorder, autosomal dominant 48 (MRD48) [MIM:617751]: A disorder characterized by significantly below average general intellectual functioning associated with impairments in adaptive behavior and manifested during the developmental period. MRD48 patients manifest global developmental delay and moderate to severe intellectual disability. {ECO:0000269|PubMed:28886345}. Note=The disease is caused by variants affecting the gene represented in this entry.",CHEMBL6094;
RAC1,P15153,Ras-related C3 botulinum toxin substrate 2 (EC 3.6.5.2) (GX) (Small G protein) (p21-Rac2),,"FUNCTION: Plasma membrane-associated small GTPase which cycles between an active GTP-bound and inactive GDP-bound state (PubMed:30723080). In its active state, binds to a variety of effector proteins to regulate cellular responses, such as secretory processes, phagocytose of apoptotic cells and epithelial cell polarization. Regulatory subunit of the phagocyte NADPH oxidase complex that mediates the transfer of electrons from cytosolic NADPH to O2 to produce the superoxide anion (O2(-)) (PubMed:1660188). {ECO:0000269|PubMed:1660188, ECO:0000269|PubMed:30723080}.",,,GTP binding [GO:0005525]; GTPase activity [GO:0003924]; protein kinase regulator activity [GO:0019887],"DISEASE: Immunodeficiency 73A with defective neutrophil chemotaxis and leukocytosis (IMD73A) [MIM:608203]: An autosomal dominant immunologic disorder characterized by onset of recurrent infections in early infancy, leukocytosis, neutrophilia, invasive infections, and poor wound healing. {ECO:0000269|PubMed:10758162}. Note=The disease is caused by variants affecting the gene represented in this entry.; DISEASE: Immunodeficiency 73B with defective neutrophil chemotaxis and lymphopenia (IMD73B) [MIM:618986]: An autosomal dominant immunologic disorder characterized by respiratory infections, cellulitis, severe invasive infections, B- and T-cell lymphopenia, and impaired neutrophil chemotaxis. Disease onset is in infancy or early childhood. {ECO:0000269|PubMed:30654050, ECO:0000269|PubMed:30723080, ECO:0000269|PubMed:31071452, ECO:0000269|PubMed:31382036}. Note=The disease is caused by variants affecting the gene represented in this entry.; DISEASE: Immunodeficiency 73C with defective neutrophil chemotaxis and hypogammaglobulinemia (IMD73C) [MIM:618987]: An autosomal recessive immunologic disorder characterized by recurrent respiratory infections, decreased B cells, hypogammaglobulinemia, and impaired neutrophil chemotaxis. Variable features are urticaria, recurrent erythematous plaques, food allergy, arthralgia, bronchiectasis, and lymphadenopathy. In addition, patients suffer from glomerulonephritis, coagulopathy, multiple hormone deficiencies, and abnormalities of neutrophil granules. {ECO:0000269|PubMed:25512081}. Note=The disease is caused by variants affecting the gene represented in this entry.",CHEMBL5581;
RAC1,Q9NUQ9,CYFIP-related Rac1 interactor B (L1),CYRI FAM49B,"FUNCTION: Negatively regulates RAC1 signaling and RAC1-driven cytoskeletal remodeling (PubMed:30250061, PubMed:31285585). Regulates chemotaxis, cell migration and epithelial polarization by controlling the polarity, plasticity, duration and extent of protrusions. Limits Rac1 mediated activation of the Scar/WAVE complex, focuses protrusion signals and regulates pseudopod complexity by inhibiting Scar/WAVE-induced actin polymerization (PubMed:30250061). Protects against Salmonella bacterial infection. Attenuates processes such as macropinocytosis, phagocytosis and cell migration and restrict sopE-mediated bacterial entry (PubMed:31285585). Restricts also infection mediated by Mycobacterium tuberculosis and Listeria monocytogenes (By similarity). Involved in the regulation of mitochondrial dynamics and oxidative stress (PubMed:29059164). {ECO:0000250|UniProtKB:Q921M7, ECO:0000269|PubMed:29059164, ECO:0000269|PubMed:30250061, ECO:0000269|PubMed:31285585}.",,,"MHC class Ib protein binding, via antigen binding groove [GO:0023030]; small GTPase binding [GO:0031267]",,
RAC1,P53365,Arfaptin-2 (ADP-ribosylation factor-interacting protein 2) (Partner of RAC1) (POR1),POR1,"FUNCTION: Plays a role in constitutive metalloproteinase (MMP) secretion from the trans Golgi network (PubMed:26507660). May have important functions during vesicle biogenesis at certain cargo subdomains, which could be predominantly utilized by secreted MMPs, such as MMP7 and MMP2 (PubMed:26507660). Also involved in autophagy by regulating the starvation-dependent trafficking of ATG9A vesicles which deliver the phosphatidylinositol 4-kinase beta (PI4KB) to the autophagosome initiation site (PubMed:30917996, PubMed:31204568). Involved in phagophore growth during mitophagy by regulating ATG9A trafficking to mitochondria (PubMed:33773106). In addition, plays a role in NF-kappa-B inhibition by interacting with IKBKB and IKBKG (PubMed:26296658). {ECO:0000269|PubMed:26296658, ECO:0000269|PubMed:26507660, ECO:0000269|PubMed:30917996, ECO:0000269|PubMed:31204568, ECO:0000269|PubMed:33773106}.",,,cadherin binding [GO:0045296]; GTP binding [GO:0005525]; GTP-dependent protein binding [GO:0030742]; identical protein binding [GO:0042802]; membrane curvature sensor activity [GO:0140090]; phosphatidylinositol-4-phosphate binding [GO:0070273]; phospholipid binding [GO:0005543]; protein domain specific binding [GO:0019904]; small GTPase binding [GO:0031267],,
RAC1,Q7L576,Cytoplasmic FMR1-interacting protein 1 (Specifically Rac1-associated protein 1) (Sra-1) (p140sra-1),KIAA0068,"FUNCTION: Component of the CYFIP1-EIF4E-FMR1 complex which binds to the mRNA cap and mediates translational repression. In the CYFIP1-EIF4E-FMR1 complex this subunit is an adapter between EIF4E and FMR1. Promotes the translation repression activity of FMR1 in brain probably by mediating its association with EIF4E and mRNA (By similarity). Regulates formation of membrane ruffles and lamellipodia. Plays a role in axon outgrowth. Binds to F-actin but not to RNA. Part of the WAVE complex that regulates actin filament reorganization via its interaction with the Arp2/3 complex. Actin remodeling activity is regulated by RAC1. Regulator of epithelial morphogenesis. As component of the WAVE1 complex, required for BDNF-NTRK2 endocytic trafficking and signaling from early endosomes (By similarity). May act as an invasion suppressor in cancers. {ECO:0000250|UniProtKB:Q7TMB8, ECO:0000269|PubMed:16260607, ECO:0000269|PubMed:19524508, ECO:0000269|PubMed:21107423, ECO:0000269|PubMed:9417078}.",,,actin filament binding [GO:0051015]; RNA 7-methylguanosine cap binding [GO:0000340]; small GTPase binding [GO:0031267]; translation repressor activity [GO:0030371],,
RAC1,O43157,Plexin-B1 (Semaphorin receptor SEP),KIAA0407 PLXN5 SEP,"FUNCTION: Receptor for SEMA4D (PubMed:19843518, PubMed:20877282, PubMed:21912513). Plays a role in GABAergic synapse development (By similarity). Mediates SEMA4A- and SEMA4D-dependent inhibitory synapse development (By similarity). Plays a role in RHOA activation and subsequent changes of the actin cytoskeleton (PubMed:12196628, PubMed:15210733). Plays a role in axon guidance, invasive growth and cell migration (PubMed:12198496). {ECO:0000250|UniProtKB:Q8CJH3, ECO:0000269|PubMed:12196628, ECO:0000269|PubMed:12198496, ECO:0000269|PubMed:15210733, ECO:0000269|PubMed:19843518, ECO:0000269|PubMed:20877282, ECO:0000269|PubMed:21912513}.",,,GTPase activating protein binding [GO:0032794]; GTPase activator activity [GO:0005096]; semaphorin receptor activity [GO:0017154]; semaphorin receptor binding [GO:0030215]; transmembrane signaling receptor activity [GO:0004888],,
RAC1,Q92608,Dedicator of cytokinesis protein 2,KIAA0209,"FUNCTION: Involved in cytoskeletal rearrangements required for lymphocyte migration in response of chemokines. Activates RAC1 and RAC2, but not CDC42, by functioning as a guanine nucleotide exchange factor (GEF), which exchanges bound GDP for free GTP. May also participate in IL2 transcriptional activation via the activation of RAC2. {ECO:0000269|PubMed:21613211}.",,,GTPase activator activity [GO:0005096]; guanyl-nucleotide exchange factor activity [GO:0005085]; small GTPase binding [GO:0031267]; T cell receptor binding [GO:0042608],"DISEASE: Immunodeficiency 40 (IMD40) [MIM:616433]: A form of combined immunodeficiency characterized by lymphopenia, and defective T-cell, B-cell, and NK-cell responses. Patients suffer from severe invasive bacterial and viral infections in early childhood and may die without bone marrow transplantation. {ECO:0000269|PubMed:26083206}. Note=The disease is caused by variants affecting the gene represented in this entry.",CHEMBL4105810;
RAC1,Q9P258,Protein RCC2 (RCC1-like protein TD-60) (Telophase disk protein of 60 kDa),KIAA1470 TD60,"FUNCTION: Multifunctional protein that may affect its functions by regulating the activity of small GTPases, such as RAC1 and RALA (PubMed:12919680, PubMed:25074804, PubMed:26158537, PubMed:28869598). Required for normal progress through the cell cycle, both during interphase and during mitosis (PubMed:12919680, PubMed:23388455, PubMed:26158537). Required for the presence of normal levels of MAD2L1, AURKB and BIRC5 on inner centromeres during mitosis, and for normal attachment of kinetochores to mitotic spindles (PubMed:12919680, PubMed:26158537). Required for normal organization of the microtubule cytoskeleton in interphase cells (PubMed:23388455). Functions as guanine nucleotide exchange factor (GEF) for RALA (PubMed:26158537). Interferes with the activation of RAC1 by guanine nucleotide exchange factors (PubMed:25074804). Prevents accumulation of active, GTP-bound RAC1, and suppresses RAC1-mediated reorganization of the actin cytoskeleton and formation of membrane protrusions (PubMed:25074804, PubMed:28869598). Required for normal cellular responses to contacts with the extracellular matrix of adjacent cells, and for directional cell migration in response to a fibronectin gradient (in vitro) (PubMed:25074804, PubMed:28869598). {ECO:0000269|PubMed:12919680, ECO:0000269|PubMed:23388455, ECO:0000269|PubMed:25074804, ECO:0000269|PubMed:26158537, ECO:0000269|PubMed:28869598}.",,,guanyl-nucleotide exchange factor activity [GO:0005085]; microtubule binding [GO:0008017]; protein domain specific binding [GO:0019904]; protein kinase binding [GO:0019901]; RNA binding [GO:0003723]; small GTPase binding [GO:0031267],,
RAC1,Q86UR1,NADPH oxidase activator 1 (NOX activator 1) (Antigen NY-CO-31) (NCF2-like protein) (P67phox-like factor) (p51-nox),P51NOX,"FUNCTION: Functions as an activator of NOX1, a superoxide-producing NADPH oxidase. Functions in the production of reactive oxygen species (ROS) which participate in a variety of biological processes including host defense, hormone biosynthesis, oxygen sensing and signal transduction. May also activate CYBB/gp91phox and NOX3. {ECO:0000269|PubMed:12657628, ECO:0000269|PubMed:12716910, ECO:0000269|PubMed:14617635, ECO:0000269|PubMed:14978110, ECO:0000269|PubMed:15181005, ECO:0000269|PubMed:15824103, ECO:0000269|PubMed:17602954, ECO:0000269|PubMed:19755710}.",,,enzyme binding [GO:0019899]; identical protein binding [GO:0042802]; SH3 domain binding [GO:0017124]; small GTPase binding [GO:0031267]; superoxide-generating NADPH oxidase activator activity [GO:0016176],,
RAC1,P52306,Rap1 GTPase-GDP dissociation stimulator 1 (Exchange factor smgGDS) (SMG GDS protein) (SMG P21 stimulatory GDP/GTP exchange protein),SMGGDS,"FUNCTION: Acts as a GEF (guanine nucleotide exchange factor) for the Rho family of small GTP-binding proteins (G proteins) that stimulates the dissociation of GDP to enable subsequent binding of GTP (PubMed:11948427, PubMed:1549351, PubMed:20709748, PubMed:28630045, PubMed:30190425). Additionally, appears to chaperone the processing and/or trafficking of small GTPases containing a C-terminal polybasic region independently of GEF activity (PubMed:20709748, PubMed:21242305). Targets include RAP1A/RAP1B, RHOA, RHOB, RHOC, RAC1 and KRAS (PubMed:11948427, PubMed:1549351, PubMed:20709748, PubMed:24415755). Regulates mitochondrial dynamics by controlling RHOT function to promote mitochondrial fission during high calcium conditions (PubMed:27716788). Able to promote the Ca(2+) release from the endoplasmic reticulum via both inositol trisphosphate (Ins3P) and ryanodine sensitive receptors leading to a enhanced mitochondrial Ca(2+) uptake (PubMed:24349085). {ECO:0000269|PubMed:11948427, ECO:0000269|PubMed:1549351, ECO:0000269|PubMed:20709748, ECO:0000269|PubMed:21242305, ECO:0000269|PubMed:24349085, ECO:0000269|PubMed:24415755, ECO:0000269|PubMed:27716788, ECO:0000269|PubMed:28630045, ECO:0000269|PubMed:30190425, ECO:0000305|PubMed:30190425}.; FUNCTION: [Isoform 1]: Acts as a GEF (guanine nucleotide exchange factor) for unprenylated RHOA (PubMed:24415755, PubMed:28630045, PubMed:30190425). Chaperones the entry and passage of small GTPases through the prenylation pathway (PubMed:20709748). Recognizes the last amino acid in the GTPase C-terminal CAAX motif with a preference for 'Leu' over 'Met', indicating involvement in the geranylgeranylation pathway (PubMed:24415755). {ECO:0000269|PubMed:20709748, ECO:0000269|PubMed:24415755, ECO:0000269|PubMed:28630045, ECO:0000269|PubMed:30190425}.; FUNCTION: [Isoform 2]: Acts as a GEF (guanine nucleotide exchange factor) for prenylated RHOA (PubMed:21242305, PubMed:28630045, PubMed:30190425). Acts as a GEF for RHOC (PubMed:21242305). Chaperones the downstream trafficking and/or processing of small newly prenylated GTPases (PubMed:20709748). Escorts RAC1 to the nucleus (PubMed:12551911). {ECO:0000269|PubMed:12551911, ECO:0000269|PubMed:20709748, ECO:0000269|PubMed:21242305, ECO:0000269|PubMed:28630045, ECO:0000269|PubMed:30190425}.",,,guanyl-nucleotide exchange factor activity [GO:0005085],"DISEASE: Alfadhel syndrome (AFDL) [MIM:620655]: An autosomal recessive neurodevelopmental disorder characterized by global developmental delay and regression, intellectual disability, hypotonia, delayed motor development, stereotypy, behavioral abnormalities, and dysmorphic features. {ECO:0000269|PubMed:32431071, ECO:0000269|PubMed:33875846}. Note=The disease is caused by variants affecting the gene represented in this entry.; DISEASE: Note=A chromosomal aberration involving RAP1GDS1 has been found in M0 type acute myeloid leukemia. Translocation (t4;11)(q23;p15) with NUP98. {ECO:0000269|PubMed:16419055}.; DISEASE: Note=A chromosomal aberration involving RAP1GDS1 has been found in T-cell acute lymphocytic leukemia. Translocation t(4;11)(q23;p15) with NUP98. {ECO:0000269|PubMed:10477737, ECO:0000269|PubMed:10929031}.",
RAC1,Q9NPB6,Partitioning defective 6 homolog alpha (PAR-6) (PAR-6 alpha) (PAR-6A) (PAR6C) (Tax interaction protein 40) (TIP-40),PAR6A,"FUNCTION: Adapter protein involved in asymmetrical cell division and cell polarization processes. Probably involved in the formation of epithelial tight junctions. Association with PARD3 may prevent the interaction of PARD3 with F11R/JAM1, thereby preventing tight junction assembly. The PARD6-PARD3 complex links GTP-bound Rho small GTPases to atypical protein kinase C proteins (PubMed:10873802). Regulates centrosome organization and function. Essential for the centrosomal recruitment of key proteins that control centrosomal microtubule organization (PubMed:20719959). {ECO:0000269|PubMed:10873802, ECO:0000269|PubMed:20719959}.",,,GTP-dependent protein binding [GO:0030742]; small GTPase binding [GO:0031267],,
RAC1,P19878,Neutrophil cytosol factor 2 (NCF-2) (67 kDa neutrophil oxidase factor) (NADPH oxidase activator 2) (Neutrophil NADPH oxidase factor 2) (p67-phox),NOXA2 P67PHOX,"FUNCTION: Subunit of the phagocyte NADPH oxidase complex that mediates the transfer of electrons from cytosolic NADPH to O2 to produce the superoxide anion (O2(-)) (PubMed:12207919, PubMed:38355798). In the activated complex, electrons are first transferred from NADPH to flavin adenine dinucleotide (FAD) and subsequently transferred via two heme molecules to molecular oxygen, producing superoxide through an outer-sphere reaction (PubMed:38355798). Activation of the NADPH oxidase complex is initiated by the assembly of cytosolic subunits of the NADPH oxidase complex with the core NADPH oxidase complex to form a complex at the plasma membrane or phagosomal membrane (PubMed:38355798). This activation process is initiated by phosphorylation dependent binding of the cytosolic NCF1/p47-phox subunit to the C-terminus of CYBA/p22-phox (By similarity). {ECO:0000250|UniProtKB:P14598, ECO:0000269|PubMed:12207919, ECO:0000269|PubMed:38355798}.",,,electron transfer activity [GO:0009055]; small GTPase binding [GO:0031267]; superoxide-generating NAD(P)H oxidase activity [GO:0016175]; superoxide-generating NADPH oxidase activator activity [GO:0016176],"DISEASE: Granulomatous disease, chronic, autosomal recessive, 2 (CGD2) [MIM:233710]: A form of chronic granulomatous disease, a primary immunodeficiency characterized by severe recurrent bacterial and fungal infections, along with manifestations of chronic granulomatous inflammation. It results from an impaired ability of phagocytes to mount a burst of reactive oxygen species in response to pathogens. {ECO:0000269|PubMed:10498624, ECO:0000269|PubMed:10598813, ECO:0000269|PubMed:11112388, ECO:0000269|PubMed:16937026, ECO:0000269|PubMed:18625437, ECO:0000269|PubMed:19624736, ECO:0000269|PubMed:20167518, ECO:0000269|PubMed:23910690, ECO:0000269|PubMed:8286749, ECO:0000269|PubMed:9070911}. Note=The disease is caused by variants affecting the gene represented in this entry.",
RAC1,Q00722,"1-phosphatidylinositol 4,5-bisphosphate phosphodiesterase beta-2 (EC 3.1.4.11) (Phosphoinositide phospholipase C-beta-2) (Phospholipase C-beta-2) (PLC-beta-2)",,"FUNCTION: The production of the second messenger molecules diacylglycerol (DAG) and inositol 1,4,5-trisphosphate (IP3) is mediated by activated phosphatidylinositol-specific phospholipase C enzymes (PubMed:1644792, PubMed:9188725). In neutrophils, participates in a phospholipase C-activating N-formyl peptide-activated GPCR (G protein-coupled receptor) signaling pathway by promoting RASGRP4 activation by DAG, to promote neutrophil functional responses (By similarity). {ECO:0000250|UniProtKB:A3KGF7, ECO:0000269|PubMed:1644792, ECO:0000269|PubMed:9188725}.","ACT_SITE 327; /evidence=""ECO:0000255|PROSITE-ProRule:PRU00270""; ACT_SITE 374; /evidence=""ECO:0000255|PROSITE-ProRule:PRU00270""",,calcium ion binding [GO:0005509]; G-protein beta/gamma-subunit complex binding [GO:0031683]; phosphatidylinositol phospholipase C activity [GO:0004435]; phospholipase C activity [GO:0004629]; phospholipid binding [GO:0005543],,
RAC1,Q16512,Serine/threonine-protein kinase N1 (EC 2.7.11.13) (Protease-activated kinase 1) (PAK-1) (Protein kinase C-like 1) (Protein kinase C-like PKN) (Protein kinase PKN-alpha) (Protein-kinase C-related kinase 1) (Serine-threonine protein kinase N),PAK1 PKN PRK1 PRKCL1,"FUNCTION: PKC-related serine/threonine-protein kinase involved in various processes such as regulation of the intermediate filaments of the actin cytoskeleton, cell migration, tumor cell invasion and transcription regulation. Part of a signaling cascade that begins with the activation of the adrenergic receptor ADRA1B and leads to the activation of MAPK14. Regulates the cytoskeletal network by phosphorylating proteins such as VIM and neurofilament proteins NEFH, NEFL and NEFM, leading to inhibit their polymerization. Phosphorylates 'Ser-575', 'Ser-637' and 'Ser-669' of MAPT/Tau, lowering its ability to bind to microtubules, resulting in disruption of tubulin assembly. Acts as a key coactivator of androgen receptor (AR)-dependent transcription, by being recruited to AR target genes and specifically mediating phosphorylation of 'Thr-11' of histone H3 (H3T11ph), a specific tag for epigenetic transcriptional activation that promotes demethylation of histone H3 'Lys-9' (H3K9me) by KDM4C/JMJD2C. Phosphorylates HDAC5, HDAC7 and HDAC9, leading to impair their import in the nucleus. Phosphorylates 'Thr-38' of PPP1R14A, 'Ser-159', 'Ser-163' and 'Ser-170' of MARCKS, and GFAP. Able to phosphorylate RPS6 in vitro. {ECO:0000269|PubMed:11104762, ECO:0000269|PubMed:12514133, ECO:0000269|PubMed:17332740, ECO:0000269|PubMed:18066052, ECO:0000269|PubMed:20188095, ECO:0000269|PubMed:21224381, ECO:0000269|PubMed:21754995, ECO:0000269|PubMed:24248594, ECO:0000269|PubMed:8557118, ECO:0000269|PubMed:8621664, ECO:0000269|PubMed:9175763}.","ACT_SITE 740; /note=""Proton acceptor""; /evidence=""ECO:0000255|PROSITE-ProRule:PRU00159, ECO:0000255|PROSITE-ProRule:PRU10027""",,"ATP binding [GO:0005524]; calcium,diacylglycerol-dependent serine/threonine kinase activity [GO:0004698]; chromatin binding [GO:0003682]; diacylglycerol-dependent serine/threonine kinase activity [GO:0004697]; diacylglycerol-dependent, calcium-independent serine/threonine kinase activity [GO:0004699]; histone binding [GO:0042393]; histone deacetylase binding [GO:0042826]; histone H3T11 kinase activity [GO:0035402]; nuclear androgen receptor binding [GO:0050681]; nuclear receptor coactivator activity [GO:0030374]; protein kinase activity [GO:0004672]; protein kinase C binding [GO:0005080]; protein serine kinase activity [GO:0106310]; protein serine/threonine kinase activity [GO:0004674]; small GTPase binding [GO:0031267]",,CHEMBL3384;
