Gene,Entry,Protein names,Gene Names (synonym),Function [CC],Active site,Pathway,Gene Ontology (molecular function),Involvement in disease,ChEMBL
F10,Q70Z53,Protein FRA10AC1,C10orf4,FUNCTION: May be involved in pre-mRNA splicing. {ECO:0000269|PubMed:34694367}.,,,phosphatase activity [GO:0016791],"DISEASE: Neurodevelopmental disorder with growth retardation, dysmorphic facies, and corpus callosum abnormalities (NEDGFC) [MIM:620113]: An autosomal recessive neurodevelopmental disorder characterized by developmental delay, intellectual disability, and absent speech. Patients have microcephaly, hypoplasia or agenesis of the corpus callosum, growth retardation, and craniofacial dysmorphism. {ECO:0000269|PubMed:34694367, ECO:0000269|PubMed:35821753, ECO:0000269|PubMed:35871492}. Note=The disease is caused by variants affecting the gene represented in this entry.",
F10,Q9BQ89,Protein FAM110A,C20orf55 F10,,,,,,
F10,P00742,Coagulation factor X (EC 3.4.21.6) (Stuart factor) (Stuart-Prower factor) [Cleaved into: Factor X light chain; Factor X heavy chain; Activated factor Xa heavy chain],,"FUNCTION: Factor Xa is a vitamin K-dependent glycoprotein that converts prothrombin to thrombin in the presence of factor Va, calcium and phospholipid during blood clotting (PubMed:22409427). Factor Xa activates pro-inflammatory signaling pathways in a protease-activated receptor (PAR)-dependent manner (PubMed:24041930, PubMed:30568593, PubMed:34831181, PubMed:18202198). Up-regulates expression of protease-activated receptors (PARs) F2R, F2RL1 and F2RL2 in dermal microvascular endothelial cells (PubMed:35738824). Triggers the production of pro-inflammatory cytokines, such as MCP-1/CCL2 and IL6, in cardiac fibroblasts and umbilical vein endothelial cells in PAR-1/F2R-dependent manner (PubMed:30568593, PubMed:34831181). Triggers the production of pro-inflammatory cytokines, such as MCP-1/CCL2, IL6, TNF-alpha/TNF, IL-1beta/IL1B, IL8/CXCL8 and IL18, in endothelial cells and atrial tissues (PubMed:24041930, PubMed:35738824, PubMed:9780208). Induces expression of adhesion molecules, such as ICAM1, VCAM1 and SELE, in endothelial cells and atrial tissues (PubMed:24041930, PubMed:35738824, PubMed:9780208). Increases expression of phosphorylated ERK1/2 in dermal microvascular endothelial cells and atrial tissues (PubMed:24041930, PubMed:35738824). Triggers activation of the transcription factor NF-kappa-B in dermal microvascular endothelial cells and atrial tissues (PubMed:24041930, PubMed:35738824). Activates pro-inflammatory and pro-fibrotic responses in dermal fibroblasts and enhances wound healing probably via PAR-2/F2RL1-dependent mechanism (PubMed:18202198). Activates barrier protective signaling responses in endothelial cells in PAR-2/F2RL1-dependent manner; the activity depends on the cleavage of PAR-2/F2RL1 by factor Xa (PubMed:22409427). Up-regulates expression of plasminogen activator inhibitor 1 (SERPINE1) in atrial tissues (PubMed:24041930). {ECO:0000269|PubMed:18202198, ECO:0000269|PubMed:22409427, ECO:0000269|PubMed:24041930, ECO:0000269|PubMed:30568593, ECO:0000269|PubMed:34831181, ECO:0000269|PubMed:35738824, ECO:0000269|PubMed:9780208}.","ACT_SITE 276; /note=""Charge relay system""; ACT_SITE 322; /note=""Charge relay system""; ACT_SITE 419; /note=""Charge relay system""",,calcium ion binding [GO:0005509]; phospholipid binding [GO:0005543]; serine-type endopeptidase activity [GO:0004252],"DISEASE: Factor X deficiency (FA10D) [MIM:227600]: A hemorrhagic disease with variable presentation. Affected individuals can manifest prolonged nasal and mucosal hemorrhage, menorrhagia, hematuria, and occasionally hemarthrosis. Some patients do not have clinical bleeding diathesis. {ECO:0000269|PubMed:10468877, ECO:0000269|PubMed:10739379, ECO:0000269|PubMed:10746568, ECO:0000269|PubMed:11248282, ECO:0000269|PubMed:11728527, ECO:0000269|PubMed:12574802, ECO:0000269|PubMed:12945883, ECO:0000269|PubMed:15075089, ECO:0000269|PubMed:15650540, ECO:0000269|PubMed:17393015, ECO:0000269|PubMed:19135706, ECO:0000269|PubMed:1973167, ECO:0000269|PubMed:1985698, ECO:0000269|PubMed:25313940, ECO:0000269|PubMed:26222694, ECO:0000269|PubMed:2790181, ECO:0000269|PubMed:7669671, ECO:0000269|PubMed:7860069, ECO:0000269|PubMed:8529633, ECO:0000269|PubMed:8845463, ECO:0000269|PubMed:8910490}. Note=The disease is caused by variants affecting the gene represented in this entry.",CHEMBL244;
F10,P50502,Hsc70-interacting protein (Hip) (Aging-associated protein 2) (Progesterone receptor-associated p48 protein) (Protein FAM10A1) (Putative tumor suppressor ST13) (Renal carcinoma antigen NY-REN-33) (Suppression of tumorigenicity 13 protein),AAG2 FAM10A1 HIP SNC6,"FUNCTION: One HIP oligomer binds the ATPase domains of at least two HSC70 molecules dependent on activation of the HSC70 ATPase by HSP40. Stabilizes the ADP state of HSC70 that has a high affinity for substrate protein. Through its own chaperone activity, it may contribute to the interaction of HSC70 with various target proteins (By similarity). {ECO:0000250}.",,,Hsp70 protein binding [GO:0030544]; protein dimerization activity [GO:0046983]; protein-macromolecule adaptor activity [GO:0030674],,
F10,Q8TCE6,DENN domain-containing protein 10 (Protein FAM45A),FAM45A,"FUNCTION: Guanine nucleotide exchange factor (GEF) regulating homeostasis of late endocytic pathway, including endosomal positioning, maturation and secretion, possibly through activating Rab proteins such as RAB27A and RAB27B. Seems to promote the exchange of GDP to GTP, converting inactive GDP-bound RAB27A and RAB27B into their active GTP-bound form. {ECO:0000269|PubMed:30771381}.",,,guanyl-nucleotide exchange factor activity [GO:0005085]; small GTPase binding [GO:0031267],,
F10,Q9NZB2,Constitutive coactivator of PPAR-gamma-like protein 1 (Oxidative stress-associated SRC activator) (Protein FAM120A),C9orf10 KIAA0183 OSSA,FUNCTION: Component of the oxidative stress-induced survival signaling. May regulate the activation of SRC family protein kinases (PubMed:19015244). May act as a scaffolding protein enabling SRC family protein kinases to phosphorylate and activate PI3-kinase (PubMed:19015244). Binds IGF2 RNA and promotes the production of IGF2 protein (PubMed:19015244). {ECO:0000269|PubMed:19015244}.,,,RNA binding [GO:0003723],DISEASE: Note=May play a role in the progression of scirrhous-type gastric cancer by supporting cancer cell survival during oxidative stress. {ECO:0000269|PubMed:19015244}.,CHEMBL4295966;
F10,P13500,C-C motif chemokine 2 (HC11) (Monocyte chemoattractant protein 1) (Monocyte chemotactic and activating factor) (MCAF) (Monocyte chemotactic protein 1) (MCP-1) (Monocyte secretory protein JE) (Small-inducible cytokine A2),MCP1 SCYA2,"FUNCTION: Acts as a ligand for C-C chemokine receptor CCR2 (PubMed:10529171, PubMed:10587439, PubMed:9837883). Signals through binding and activation of CCR2 and induces a strong chemotactic response and mobilization of intracellular calcium ions (PubMed:10587439, PubMed:9837883). Exhibits a chemotactic activity for monocytes and basophils but not neutrophils or eosinophils (PubMed:8195247, PubMed:8627182, PubMed:9792674). May be involved in the recruitment of monocytes into the arterial wall during the disease process of atherosclerosis (PubMed:8107690). {ECO:0000269|PubMed:10529171, ECO:0000269|PubMed:10587439, ECO:0000269|PubMed:8107690, ECO:0000269|PubMed:8195247, ECO:0000269|PubMed:8627182, ECO:0000269|PubMed:9792674, ECO:0000269|PubMed:9837883}.",,,CCR chemokine receptor binding [GO:0048020]; CCR2 chemokine receptor binding [GO:0031727]; chemokine activity [GO:0008009]; protein kinase activity [GO:0004672]; signaling receptor binding [GO:0005102],,CHEMBL1649052;
F10,P05231,Interleukin-6 (IL-6) (B-cell stimulatory factor 2) (BSF-2) (CTL differentiation factor) (CDF) (Hybridoma growth factor) (Interferon beta-2) (IFN-beta-2),IFNB2,"FUNCTION: Cytokine with a wide variety of biological functions in immunity, tissue regeneration, and metabolism. Binds to IL6R, then the complex associates to the signaling subunit IL6ST/gp130 to trigger the intracellular IL6-signaling pathway (Probable). The interaction with the membrane-bound IL6R and IL6ST stimulates 'classic signaling', whereas the binding of IL6 and soluble IL6R to IL6ST stimulates 'trans-signaling'. Alternatively, 'cluster signaling' occurs when membrane-bound IL6:IL6R complexes on transmitter cells activate IL6ST receptors on neighboring receiver cells (Probable). {ECO:0000305|PubMed:30995492}.; FUNCTION: IL6 is a potent inducer of the acute phase response. Rapid production of IL6 contributes to host defense during infection and tissue injury, but excessive IL6 synthesis is involved in disease pathology. In the innate immune response, is synthesized by myeloid cells, such as macrophages and dendritic cells, upon recognition of pathogens through toll-like receptors (TLRs) at the site of infection or tissue injury (Probable). In the adaptive immune response, is required for the differentiation of B cells into immunoglobulin-secreting cells. Plays a major role in the differentiation of CD4(+) T cell subsets. Essential factor for the development of T follicular helper (Tfh) cells that are required for the induction of germinal-center formation. Required to drive naive CD4(+) T cells to the Th17 lineage. Also required for proliferation of myeloma cells and the survival of plasmablast cells (By similarity). {ECO:0000250|UniProtKB:P08505, ECO:0000305|PubMed:30995492}.; FUNCTION: Acts as an essential factor in bone homeostasis and on vessels directly or indirectly by induction of VEGF, resulting in increased angiogenesis activity and vascular permeability (PubMed:12794819, PubMed:17075861). Induces, through 'trans-signaling' and synergistically with IL1B and TNF, the production of VEGF (PubMed:12794819). Involved in metabolic controls, is discharged into the bloodstream after muscle contraction increasing lipolysis and improving insulin resistance (PubMed:20823453). 'Trans-signaling' in central nervous system also regulates energy and glucose homeostasis (By similarity). Mediates, through GLP-1, crosstalk between insulin-sensitive tissues, intestinal L cells and pancreatic islets to adapt to changes in insulin demand (By similarity). Also acts as a myokine (Probable). Plays a protective role during liver injury, being required for maintenance of tissue regeneration (By similarity). Also has a pivotal role in iron metabolism by regulating HAMP/hepcidin expression upon inflammation or bacterial infection (PubMed:15124018). Through activation of IL6ST-YAP-NOTCH pathway, induces inflammation-induced epithelial regeneration (By similarity). {ECO:0000250|UniProtKB:P08505, ECO:0000269|PubMed:12794819, ECO:0000269|PubMed:15124018, ECO:0000269|PubMed:17075861, ECO:0000269|PubMed:20823453, ECO:0000305|PubMed:30995492}.",,,cytokine activity [GO:0005125]; growth factor activity [GO:0008083]; identical protein binding [GO:0042802]; interleukin-6 receptor binding [GO:0005138],"DISEASE: Rheumatoid arthritis systemic juvenile (RASJ) [MIM:604302]: An inflammatory articular disorder with systemic onset beginning before the age of 16. It represents a subgroup of juvenile arthritis associated with severe extraarticular features and occasionally fatal complications. During active phases of the disorder, patients display a typical daily spiking fever, an evanescent macular rash, lymphadenopathy, hepatosplenomegaly, serositis, myalgia and arthritis. {ECO:0000269|PubMed:9769329}. Note=Disease susceptibility is associated with variants affecting the gene represented in this entry.; DISEASE: Note=A IL6 promoter polymorphism is associated with a lifetime risk of development of Kaposi sarcoma in HIV-infected men. {ECO:0000269|PubMed:11001912}.",CHEMBL1795129;
F10,Q8NFI4,Putative protein FAM10A5 (Suppression of tumorigenicity 13 pseudogene 5),FAM10A5,,,,protein dimerization activity [GO:0046983],,
F10,P05362,Intercellular adhesion molecule 1 (ICAM-1) (Major group rhinovirus receptor) (CD antigen CD54),,"FUNCTION: ICAM proteins are ligands for the leukocyte adhesion protein LFA-1 (integrin alpha-L/beta-2). During leukocyte trans-endothelial migration, ICAM1 engagement promotes the assembly of endothelial apical cups through ARHGEF26/SGEF and RHOG activation. {ECO:0000269|PubMed:11173916, ECO:0000269|PubMed:17875742}.; FUNCTION: (Microbial infection) Acts as a receptor for major receptor group rhinovirus A-B capsid proteins. {ECO:0000269|PubMed:1968231, ECO:0000269|PubMed:2538243}.; FUNCTION: (Microbial infection) Acts as a receptor for Coxsackievirus A21 capsid proteins. {ECO:0000269|PubMed:11160747, ECO:0000269|PubMed:16004874, ECO:0000269|PubMed:9539703}.; FUNCTION: (Microbial infection) Upon Kaposi's sarcoma-associated herpesvirus/HHV-8 infection, is degraded by viral E3 ubiquitin ligase MIR2, presumably to prevent lysis of infected cells by cytotoxic T-lymphocytes and NK cell. {ECO:0000269|PubMed:11413168}.",,,integrin binding [GO:0005178]; signaling receptor activity [GO:0038023]; transmembrane signaling receptor activity [GO:0004888]; virus receptor activity [GO:0001618],,CHEMBL3070;
F10,P05121,Plasminogen activator inhibitor 1 (PAI) (PAI-1) (Endothelial plasminogen activator inhibitor) (Serpin E1),PAI1 PLANH1,"FUNCTION: Serine protease inhibitor. Inhibits TMPRSS7 (PubMed:15853774). Is a primary inhibitor of tissue-type plasminogen activator (PLAT) and urokinase-type plasminogen activator (PLAU). As PLAT inhibitor, it is required for fibrinolysis down-regulation and is responsible for the controlled degradation of blood clots (PubMed:17912461, PubMed:8481516, PubMed:9207454). As PLAU inhibitor, it is involved in the regulation of cell adhesion and spreading (PubMed:9175705). Acts as a regulator of cell migration, independently of its role as protease inhibitor (PubMed:15001579, PubMed:9168821). It is required for stimulation of keratinocyte migration during cutaneous injury repair (PubMed:18386027). It is involved in cellular and replicative senescence (PubMed:16862142). Plays a role in alveolar type 2 cells senescence in the lung (By similarity). Is involved in the regulation of cementogenic differentiation of periodontal ligament stem cells, and regulates odontoblast differentiation and dentin formation during odontogenesis (PubMed:25808697, PubMed:27046084). {ECO:0000250|UniProtKB:P22777, ECO:0000269|PubMed:15001579, ECO:0000269|PubMed:15853774, ECO:0000269|PubMed:16862142, ECO:0000269|PubMed:17912461, ECO:0000269|PubMed:18386027, ECO:0000269|PubMed:25808697, ECO:0000269|PubMed:27046084, ECO:0000269|PubMed:8481516, ECO:0000269|PubMed:9168821, ECO:0000269|PubMed:9175705, ECO:0000269|PubMed:9207454}.",,,protease binding [GO:0002020]; serine-type endopeptidase inhibitor activity [GO:0004867]; signaling receptor binding [GO:0005102],"DISEASE: Plasminogen activator inhibitor-1 deficiency (PAI-1D) [MIM:613329]: A hematologic disorder characterized by increased bleeding after trauma, injury, or surgery. Affected females have menorrhagia. The bleeding defect is due to increased fibrinolysis of fibrin blood clots due to deficiency of plasminogen activator inhibitor-1, which inhibits tissue and urinary activators of plasminogen. {ECO:0000269|PubMed:8481516, ECO:0000269|PubMed:9207454}. Note=The disease is caused by variants affecting the gene represented in this entry. A rare PAI-1D mutation resulting in a frameshift and protein truncation has been found in an Old Order Amish community. Homozygous mutation carriers suffer from episodes of major hemorrhage, while heterozygous carriers do not manifest abnormal bleeding (PubMed:9207454). Heterozygosity for the mutation is associated with longer leukocyte telomere length, lower fasting insulin levels, lower prevalence of diabetes mellitus, and a longer life span (PubMed:29152572). {ECO:0000269|PubMed:29152572, ECO:0000269|PubMed:9207454}.",CHEMBL3475;
F10,P55085,"Proteinase-activated receptor 2 (PAR-2) (Coagulation factor II receptor-like 1) (G-protein coupled receptor 11) (Thrombin receptor-like 1) [Cleaved into: Proteinase-activated receptor 2, alternate cleaved 1; Proteinase-activated receptor 2, alternate cleaved 2]",GPR11 PAR2,"FUNCTION: Receptor for trypsin and trypsin-like enzymes coupled to G proteins (PubMed:28445455). Its function is mediated through the activation of several signaling pathways including phospholipase C (PLC), intracellular calcium, mitogen-activated protein kinase (MAPK), I-kappaB kinase/NF-kappaB and Rho (PubMed:28445455). Can also be transactivated by cleaved F2R/PAR1. Involved in modulation of inflammatory responses and regulation of innate and adaptive immunity, and acts as a sensor for proteolytic enzymes generated during infection. Generally is promoting inflammation. Can signal synergistically with TLR4 and probably TLR2 in inflammatory responses and modulates TLR3 signaling. Has a protective role in establishing the endothelial barrier; the activity involves coagulation factor X. Regulates endothelial cell barrier integrity during neutrophil extravasation, probably following proteolytic cleavage by PRTN3 (PubMed:23202369). Proposed to have a bronchoprotective role in airway epithelium, but also shown to compromise the airway epithelial barrier by interrupting E-cadherin adhesion (PubMed:10086357). Involved in the regulation of vascular tone; activation results in hypotension presumably mediated by vasodilation. Associates with a subset of G proteins alpha subunits such as GNAQ, GNA11, GNA14, GNA12 and GNA13, but probably not with G(o)-alpha, G(i) subunit alpha-1 and G(i) subunit alpha-2. However, according to PubMed:21627585 can signal through G(i) subunit alpha. Believed to be a class B receptor which internalizes as a complex with arrestin and traffic with it to endosomal vesicles, presumably as desensitized receptor, for extended periods of time. Mediates inhibition of TNF-alpha stimulated JNK phosphorylation via coupling to GNAQ and GNA11; the function involves dissociation of RIPK1 and TRADD from TNFR1. Mediates phosphorylation of nuclear factor NF-kappa-B RELA subunit at 'Ser-536'; the function involves IKBKB and is predominantly independent of G proteins. Involved in cellular migration. Involved in cytoskeletal rearrangement and chemotaxis through beta-arrestin-promoted scaffolds; the function is independent of GNAQ and GNA11 and involves promotion of cofilin dephosphorylation and actin filament severing. Induces redistribution of COPS5 from the plasma membrane to the cytosol and activation of the JNK cascade is mediated by COPS5. Involved in the recruitment of leukocytes to the sites of inflammation and is the major PAR receptor capable of modulating eosinophil function such as pro-inflammatory cytokine secretion, superoxide production and degranulation. During inflammation promotes dendritic cell maturation, trafficking to the lymph nodes and subsequent T-cell activation. Involved in antimicrobial response of innate immune cells; activation enhances phagocytosis of Gram-positive and killing of Gram-negative bacteria. Acts synergistically with interferon-gamma in enhancing antiviral responses. Implicated in a number of acute and chronic inflammatory diseases such as of the joints, lungs, brain, gastrointestinal tract, periodontium, skin, and vascular systems, and in autoimmune disorders. Probably mediates activation of pro-inflammatory and pro-fibrotic responses in fibroblasts, triggered by coagulation factor Xa (F10) (By similarity). Mediates activation of barrier protective signaling responses in endothelial cells, triggered by coagulation factor Xa (F10) (PubMed:22409427). {ECO:0000250|UniProtKB:P55086, ECO:0000269|PubMed:10086357, ECO:0000269|PubMed:10725339, ECO:0000269|PubMed:11413129, ECO:0000269|PubMed:11441110, ECO:0000269|PubMed:11447194, ECO:0000269|PubMed:11714832, ECO:0000269|PubMed:12832443, ECO:0000269|PubMed:15155775, ECO:0000269|PubMed:16359518, ECO:0000269|PubMed:16410250, ECO:0000269|PubMed:16478888, ECO:0000269|PubMed:16714334, ECO:0000269|PubMed:17404307, ECO:0000269|PubMed:17500066, ECO:0000269|PubMed:18424071, ECO:0000269|PubMed:18453611, ECO:0000269|PubMed:18474671, ECO:0000269|PubMed:18622013, ECO:0000269|PubMed:19494303, ECO:0000269|PubMed:19781631, ECO:0000269|PubMed:19864598, ECO:0000269|PubMed:19865078, ECO:0000269|PubMed:20826780, ECO:0000269|PubMed:21501162, ECO:0000269|PubMed:22409427, ECO:0000269|PubMed:23202369, ECO:0000269|PubMed:28445455}.",,,G protein-coupled receptor activity [GO:0004930]; G-protein alpha-subunit binding [GO:0001965]; G-protein beta-subunit binding [GO:0031681]; protease binding [GO:0002020]; signaling receptor activity [GO:0038023]; signaling receptor binding [GO:0005102]; thrombin-activated receptor activity [GO:0015057],,CHEMBL5963;
F10,P05154,Plasma serine protease inhibitor (Acrosomal serine protease inhibitor) (Plasminogen activator inhibitor 3) (PAI-3) (PAI3) (Protein C inhibitor) (PCI) (Serpin A5),PCI PLANH3 PROCI,"FUNCTION: Heparin-dependent serine protease inhibitor acting in body fluids and secretions. Inactivates serine proteases by binding irreversibly to their serine activation site. Involved in the regulation of intravascular and extravascular proteolytic activities. Plays hemostatic roles in the blood plasma. Acts as a procoagulant and pro-inflammatory factor by inhibiting the anticoagulant activated protein C factor as well as the generation of activated protein C factor by the thrombin/thrombomodulin complex. Acts as an anticoagulant factor by inhibiting blood coagulation factors like prothrombin, factor XI, factor Xa, plasma kallikrein and fibrinolytic enzymes such as tissue- and urinary-type plasminogen activators. In seminal plasma, inactivates several serine proteases implicated in the reproductive system. Inhibits the serpin acrosin; indirectly protects component of the male genital tract from being degraded by excessive released acrosin. Inhibits tissue- and urinary-type plasminogen activator, prostate-specific antigen and kallikrein activities; has a control on the sperm motility and fertilization. Inhibits the activated protein C-catalyzed degradation of SEMG1 and SEMG2; regulates the degradation of semenogelin during the process of transfer of spermatozoa from the male reproductive tract into the female tract. In urine, inhibits urinary-type plasminogen activator and kallikrein activities. Inactivates membrane-anchored serine proteases activities such as MPRSS7 and TMPRSS11E. Inhibits urinary-type plasminogen activator-dependent tumor cell invasion and metastasis. May also play a non-inhibitory role in seminal plasma and urine as a hydrophobic hormone carrier by its binding to retinoic acid. {ECO:0000269|PubMed:10340997, ECO:0000269|PubMed:11722589, ECO:0000269|PubMed:14696115, ECO:0000269|PubMed:15140131, ECO:0000269|PubMed:15328353, ECO:0000269|PubMed:15853774, ECO:0000269|PubMed:1725227, ECO:0000269|PubMed:18467335, ECO:0000269|PubMed:2844223, ECO:0000269|PubMed:3501295, ECO:0000269|PubMed:6323392, ECO:0000269|PubMed:7521127, ECO:0000269|PubMed:7548057, ECO:0000269|PubMed:8536714, ECO:0000269|PubMed:8665956, ECO:0000269|PubMed:9473218, ECO:0000269|PubMed:9510955, ECO:0000269|PubMed:9556620}.",,,acrosin binding [GO:0032190]; glycosaminoglycan binding [GO:0005539]; heparin binding [GO:0008201]; phosphatidylcholine binding [GO:0031210]; protease binding [GO:0002020]; retinoic acid binding [GO:0001972]; serine-type endopeptidase inhibitor activity [GO:0004867],,
F10,P25116,Proteinase-activated receptor 1 (PAR-1) (Coagulation factor II receptor) (Thrombin receptor),CF2R PAR1 TR,"FUNCTION: High affinity receptor that binds the activated thrombin, leading to calcium release from intracellular stores (PubMed:1672265, PubMed:8136362). The thrombin-activated receptor signaling pathway is mediated through PTX-insensitive G proteins, activation of phospholipase C resulting in the production of 1D-myo-inositol 1,4,5-trisphosphate (InsP3) which binds to InsP3 receptors causing calcium release from the stores (By similarity). In astrocytes, the calcium released into the cytosol allows the Ca(2+)-dependent release of L-glutamate into the synaptic cleft through BEST1, that targets the neuronal postsynaptic GRIN2A/NMDAR receptor resulting in the synaptic plasticity regulation (By similarity). May play a role in platelets activation and in vascular development (PubMed:10079109). Mediates up-regulation of pro-inflammatory cytokines, such as MCP-1/CCL2 and IL6, triggered by coagulation factor Xa (F10) in cardiac fibroblasts and umbilical vein endothelial cells (PubMed:30568593, PubMed:34831181). {ECO:0000250|UniProtKB:P26824, ECO:0000250|UniProtKB:P30558, ECO:0000269|PubMed:10079109, ECO:0000269|PubMed:1672265, ECO:0000269|PubMed:30568593, ECO:0000269|PubMed:34831181, ECO:0000269|PubMed:8136362}.",,,G protein-coupled receptor activity [GO:0004930]; G-protein alpha-subunit binding [GO:0001965]; G-protein beta-subunit binding [GO:0031681]; signaling receptor binding [GO:0005102]; thrombin-activated receptor activity [GO:0015057],,CHEMBL3974;
F10,Q8IZP2,Putative protein FAM10A4 (Suppression of tumorigenicity 13 pseudogene 4),FAM10A4,,,,protein dimerization activity [GO:0046983],,
F10,B7ZBK1,Coagulation factor X (EC 3.4.21.6) (Stuart factor),,,,,calcium ion binding [GO:0005509]; serine-type endopeptidase activity [GO:0004252],,
F10,Q6NSW5,Putative DENN domain-containing protein 10 B (DENND10 pseudogene 1) (Putative protein FAM45B),FAM45 FAM45BP,FUNCTION: May be a guanine nucleotide exchange factor (GEF). {ECO:0000250|UniProtKB:Q8TCE6}.,,,guanyl-nucleotide exchange factor activity [GO:0005085]; small GTPase binding [GO:0031267],,
F10,Q5JVE8,Coagulation factor X (EC 3.4.21.6) (Stuart factor),,,,,calcium ion binding [GO:0005509]; serine-type endopeptidase activity [GO:0004252],,
