CHP2,P19634,"Sodium/hydrogen exchanger 1 (APNH) (Na(+)/H(+) antiporter, amiloride-sensitive) (Na(+)/H(+) exchanger 1) (NHE-1) (Solute carrier family 9 member 1)",APNH1 NHE1,"FUNCTION: Electroneutral Na(+) /H(+) antiporter that extrudes Na(+) in exchange for external protons driven by the inward sodium ion chemical gradient, protecting cells from acidification that occurs from metabolism (PubMed:11350981, PubMed:11532004, PubMed:14680478, PubMed:15035633, PubMed:15677483, PubMed:17073455, PubMed:17493937, PubMed:22020933, PubMed:27650500, PubMed:32130622, PubMed:7110335, PubMed:7603840). Exchanges intracellular H(+) ions for extracellular Na(+) in 1:1 stoichiometry (By similarity). Plays a key role in maintening intracellular pH neutral and cell volume, and thus is important for cell growth, proliferation, migration and survival (PubMed:12947095, PubMed:15096511, PubMed:22020933, PubMed:8901634). In addition, can transport lithium Li(+) and functions also as a Na(+)/Li(+) antiporter (PubMed:7603840). SLC9A1 also functions in membrane anchoring and organization of scaffolding complexes that coordinate signaling inputs (PubMed:15096511). {ECO:0000250|UniProtKB:P26431, ECO:0000269|PubMed:11350981, ECO:0000269|PubMed:11532004, ECO:0000269|PubMed:12947095, ECO:0000269|PubMed:14680478, ECO:0000269|PubMed:15035633, ECO:0000269|PubMed:15096511, ECO:0000269|PubMed:15677483, ECO:0000269|PubMed:17073455, ECO:0000269|PubMed:17493937, ECO:0000269|PubMed:22020933, ECO:0000269|PubMed:27650500, ECO:0000269|PubMed:32130622, ECO:0000269|PubMed:7110335, ECO:0000269|PubMed:7603840, ECO:0000269|PubMed:8901634}.",,,"calcium-dependent protein binding [GO:0048306]; calmodulin binding [GO:0005516]; identical protein binding [GO:0042802]; molecular adaptor activity [GO:0060090]; phosphatidylinositol-4,5-bisphosphate binding [GO:0005546]; phospholipid binding [GO:0005543]; potassium:proton antiporter activity [GO:0015386]; protein phosphatase 2B binding [GO:0030346]; protein-macromolecule adaptor activity [GO:0030674]; sodium:proton antiporter activity [GO:0015385]","DISEASE: Lichtenstein-Knorr syndrome (LIKNS) [MIM:616291]: An autosomal recessive neurologic disorder characterized by progressive cerebellar ataxia and severe progressive sensorineural hearing loss. {ECO:0000269|PubMed:25205112, ECO:0000269|PubMed:30237576}. Note=The disease is caused by variants affecting the gene represented in this entry.",CHEMBL2781;
CHP2,Q9UBY0,Sodium/hydrogen exchanger 2 (Na(+)/H(+) exchanger 2) (NHE-2) (Solute carrier family 9 member 2),NHE2,"FUNCTION: Plasma membrane Na(+)/H(+) antiporter. Mediates the electroneutral exchange of intracellular H(+) ions for extracellular Na(+) (PubMed:10444453). Major apical Na(+)/H(+) exchanger in the base of the colonic crypt. Controls in the colonic crypt intracellular pH (pHi) to direct colonic epithelial cell differentiation into the absorptive enterocyte lineage at the expense of the secretory lineage (By similarity). {ECO:0000250|UniProtKB:Q3ZAS0, ECO:0000269|PubMed:10444453}.",,,potassium:proton antiporter activity [GO:0015386]; sodium:proton antiporter activity [GO:0015385],,CHEMBL3133;
CHP2,Q6AI14,Sodium/hydrogen exchanger 4 (Na(+)/H(+) exchanger 4) (NHE-4) (Solute carrier family 9 member 4),NHE4,"FUNCTION: Electroneutral antiporter that exchanges sodium for protons or ammonium ions at the basolateral membrane of epithelia to regulate cell volume and intracellular pH upon hypertonic conditions (By similarity). As part of transcellular ammonia transport in renal tubules, mediates basolateral ammonium extrusion in the medullary thick ascending limb, regulating the corticopapillary ammonium gradient and overall renal acid excretion (By similarity). Mediates sodium:proton exchange in gastric parietal cells secondary to cAMP-dependent acid secretion and hyperosmolarity. Possibly coupled to chloride:bicarbonate antiporter, enables loading of parietal cells with sodium and chloride ions to maintain cell volume and normal gastric acid secretion (By similarity). Functions as a sodium sensor in neurons of organum vasculosum of the lamina terminalis where it regulates water intake in response to increased sodium concentration in body fluids (By similarity). {ECO:0000250|UniProtKB:P26434, ECO:0000250|UniProtKB:Q8BUE1}.",,,potassium:proton antiporter activity [GO:0015386]; sodium:proton antiporter activity [GO:0015385],,
CHP2,Q14940,Sodium/hydrogen exchanger 5 (Na(+)/H(+) exchanger 5) (NHE-5) (Solute carrier family 9 member 5),NHE5,"FUNCTION: Plasma membrane Na(+)/H(+) antiporter. Mediates the electroneutral exchange of intracellular H(+) ions for extracellular Na(+) in 1:1 stoichiometry, thus regulating intracellular pH homeostasis, in particular in neural tissues (PubMed:10692428, PubMed:19276089, PubMed:24936055, PubMed:9933641). Acts as a negative regulator of dendritic spine growth (PubMed:21551074). Plays a role in postsynaptic remodeling and signaling (PubMed:21551074, PubMed:24006492). Can also contribute to organellar pH regulation, with consequences for receptor tyrosine kinase trafficking (PubMed:24936055). {ECO:0000269|PubMed:10692428, ECO:0000269|PubMed:19276089, ECO:0000269|PubMed:21551074, ECO:0000269|PubMed:24006492, ECO:0000269|PubMed:24936055, ECO:0000269|PubMed:9933641}.",,,arrestin family protein binding [GO:1990763]; potassium:proton antiporter activity [GO:0015386]; sodium:proton antiporter activity [GO:0015385],,CHEMBL3058;
CHP2,P48764,Sodium/hydrogen exchanger 3 (Na(+)/H(+) exchanger 3) (NHE-3) (Solute carrier family 9 member 3),NHE3,"FUNCTION: Plasma membrane Na(+)/H(+) antiporter (PubMed:18829453, PubMed:26358773, PubMed:35613257). Exchanges intracellular H(+) ions for extracellular Na(+) in 1:1 stoichiometry, playing a key role in salt and fluid absorption and pH homeostasis (By similarity). Major apical Na(+)/H(+) exchanger in kidney and intestine playing an important role in renal and intestine Na(+) absorption and blood pressure regulation (PubMed:24622516, PubMed:26358773). {ECO:0000250|UniProtKB:G3X939, ECO:0000269|PubMed:18829453, ECO:0000269|PubMed:24622516, ECO:0000269|PubMed:26358773, ECO:0000269|PubMed:35613257}.",,,identical protein binding [GO:0042802]; PDZ domain binding [GO:0030165]; phosphatidylinositol binding [GO:0035091]; potassium:proton antiporter activity [GO:0015386]; sodium:proton antiporter activity [GO:0015385],"DISEASE: Diarrhea 8, secretory sodium, congenital (DIAR8) [MIM:616868]: A disease characterized by watery secretory diarrhea with prenatal onset, prominent abdominal distension after birth due to dilated fluid-filled loops of intestine, elevated fecal sodium concentrations and low urinary sodium concentrations. {ECO:0000269|PubMed:26358773, ECO:0000269|PubMed:31276831}. Note=The disease is caused by variants affecting the gene represented in this entry.",CHEMBL3273;
CHP2,Q12968,"Nuclear factor of activated T-cells, cytoplasmic 3 (NF-ATc3) (NFATc3) (NFATx) (T-cell transcription factor NFAT4) (NF-AT4) (NF-AT4c)",NFAT4,"FUNCTION: Acts as a regulator of transcriptional activation. Binds to the TNFSF11/RANKL promoter region and promotes TNFSF11 transcription (By similarity). Binding to the TNFSF11 promoter region is increased by high levels of Ca(2+) which induce NFATC3 expression and may lead to regulation of TNFSF11 expression in osteoblasts (By similarity). Plays a role in promoting mesenteric arterial wall remodeling in response to the intermittent hypoxia-induced increase in EDN1 and ROCK signaling (By similarity). As a result NFATC3 colocalizes with F-actin filaments, translocates to the nucleus and promotes transcription of the smooth muscle hypertrophy and differentiation marker ACTA2 (By similarity). Promotes lipopolysaccharide-induced apoptosis and hypertrophy in cardiomyocytes (By similarity). Following JAK/STAT signaling activation and as part of a complex with NFATC4 and STAT3, binds to the alpha-beta E4 promoter region of CRYAB and activates transcription in cardiomyocytes (By similarity). In conjunction with NFATC4, involved in embryonic heart development via maintenance of cardiomyocyte survival, proliferation and differentiation (By similarity). Plays a role in the inducible expression of cytokine genes in T-cells, especially in the induction of the IL-2 (PubMed:18815128). Required for thymocyte maturation during DN3 to DN4 transition and during positive selection (By similarity). Positively regulates macrophage-derived polymicrobial clearance, via binding to the promoter region and promoting transcription of NOS2 resulting in subsequent generation of nitric oxide (By similarity). Involved in Ca(2+)-mediated transcriptional responses upon Ca(2+) influx via ORAI1 CRAC channels. {ECO:0000250|UniProtKB:A0A0G2JTY4, ECO:0000250|UniProtKB:P97305, ECO:0000269|PubMed:18815128, ECO:0000269|PubMed:32415068}.",,,"DNA-binding transcription activator activity, RNA polymerase II-specific [GO:0001228]; DNA-binding transcription factor activity, RNA polymerase II-specific [GO:0000981]; DNA-binding transcription repressor activity, RNA polymerase II-specific [GO:0001227]; RNA polymerase II cis-regulatory region sequence-specific DNA binding [GO:0000978]; sequence-specific double-stranded DNA binding [GO:1990837]",,
CHP2,Q08209,Protein phosphatase 3 catalytic subunit alpha (EC 3.1.3.16) (CAM-PRP catalytic subunit) (Calcineurin A alpha) (Calmodulin-dependent calcineurin A subunit alpha isoform) (CNA alpha) (Serine/threonine-protein phosphatase 2B catalytic subunit alpha isoform),CALNA CNA,"FUNCTION: Calcium-dependent, calmodulin-stimulated protein phosphatase which plays an essential role in the transduction of intracellular Ca(2+)-mediated signals (PubMed:15671020, PubMed:18838687, PubMed:19154138, PubMed:23468591, PubMed:30254215). Many of the substrates contain a PxIxIT motif and/or a LxVP motif (PubMed:17498738, PubMed:17502104, PubMed:22343722, PubMed:23468591, PubMed:27974827). In response to increased Ca(2+) levels, dephosphorylates and activates phosphatase SSH1 which results in cofilin dephosphorylation (PubMed:15671020). In response to increased Ca(2+) levels following mitochondrial depolarization, dephosphorylates DNM1L inducing DNM1L translocation to the mitochondrion (PubMed:18838687). Positively regulates the CACNA1B/CAV2.2-mediated Ca(2+) release probability at hippocampal neuronal soma and synaptic terminals (By similarity). Dephosphorylates heat shock protein HSPB1 (By similarity). Dephosphorylates and activates transcription factor NFATC1 (PubMed:19154138). In response to increased Ca(2+) levels, regulates NFAT-mediated transcription probably by dephosphorylating NFAT and promoting its nuclear translocation (PubMed:26248042). Dephosphorylates and inactivates transcription factor ELK1 (PubMed:19154138). Dephosphorylates DARPP32 (PubMed:19154138). May dephosphorylate CRTC2 at 'Ser-171' resulting in CRTC2 dissociation from 14-3-3 proteins (PubMed:30611118). Dephosphorylates transcription factor TFEB at 'Ser-211' following Coxsackievirus B3 infection, promoting nuclear translocation (PubMed:33691586). Required for postnatal development of the nephrogenic zone and superficial glomeruli in the kidneys, cell cycle homeostasis in the nephrogenic zone, and ultimately normal kidney function (By similarity). Plays a role in intracellular AQP2 processing and localization to the apical membrane in the kidney, may thereby be required for efficient kidney filtration (By similarity). Required for secretion of salivary enzymes amylase, peroxidase, lysozyme and sialic acid via formation of secretory vesicles in the submandibular glands (By similarity). Required for calcineurin activity and homosynaptic depotentiation in the hippocampus (By similarity). Required for normal differentiation and survival of keratinocytes and therefore required for epidermis superstructure formation (By similarity). Positively regulates osteoblastic bone formation, via promotion of osteoblast differentiation (By similarity). Positively regulates osteoclast differentiation, potentially via NFATC1 signaling (By similarity). May play a role in skeletal muscle fiber type specification, potentially via NFATC1 signaling (By similarity). Negatively regulates MAP3K14/NIK signaling via inhibition of nuclear translocation of the transcription factors RELA and RELB (By similarity). Required for antigen-specific T-cell proliferation response (By similarity). Dephosphorylates KLHL3, promoting the interaction between KLHL3 and WNK4 and subsequent degradation of WNK4 (PubMed:30718414). Negatively regulates SLC9A1 activity (PubMed:31375679). {ECO:0000250|UniProtKB:P48452, ECO:0000250|UniProtKB:P63328, ECO:0000250|UniProtKB:P63329, ECO:0000269|PubMed:15671020, ECO:0000269|PubMed:17498738, ECO:0000269|PubMed:17502104, ECO:0000269|PubMed:18838687, ECO:0000269|PubMed:19154138, ECO:0000269|PubMed:22343722, ECO:0000269|PubMed:23468591, ECO:0000269|PubMed:26248042, ECO:0000269|PubMed:27974827, ECO:0000269|PubMed:30254215, ECO:0000269|PubMed:30611118, ECO:0000269|PubMed:30718414, ECO:0000269|PubMed:31375679, ECO:0000269|PubMed:33691586}.","ACT_SITE 151; /note=""Proton donor""; /evidence=""ECO:0000305|PubMed:8524402""",,ATPase binding [GO:0051117]; calcium ion binding [GO:0005509]; calmodulin binding [GO:0005516]; calmodulin-dependent protein phosphatase activity [GO:0033192]; enzyme binding [GO:0019899]; histone H2AXS140 phosphatase activity [GO:0140791]; MAP kinase serine/threonine phosphatase activity [GO:1990439]; myosin phosphatase activity [GO:0017018]; protein dimerization activity [GO:0046983]; protein serine/threonine phosphatase activity [GO:0004722]; protein-containing complex binding [GO:0044877]; RNA polymerase II CTD heptapeptide repeat S2 phosphatase activity [GO:0180006]; RNA polymerase II CTD heptapeptide repeat S5 phosphatase activity [GO:0180007]; RNA polymerase II CTD heptapeptide repeat S7 phosphatase activity [GO:0180008]; RNA polymerase II CTD heptapeptide repeat T4 phosphatase activity [GO:0180005]; RNA polymerase II CTD heptapeptide repeat Y1 phosphatase activity [GO:0180004],"DISEASE: Epileptic encephalopathy, infantile or early childhood, 1 (IECEE1) [MIM:617711]: A form of epileptic encephalopathy, a heterogeneous group of severe childhood onset epilepsies characterized by refractory seizures, neurodevelopmental impairment, and poor prognosis. Development is normal prior to seizure onset, after which cognitive and motor delays become apparent. IECEE1 is an autosomal dominant condition with onset of seizures between the first weeks and first years of life. {ECO:0000269|PubMed:28942967, ECO:0000269|PubMed:29432562, ECO:0000269|PubMed:30254215}. Note=The disease is caused by variants affecting the gene represented in this entry.; DISEASE: Arthrogryposis, cleft palate, craniosynostosis, and impaired intellectual development (ACCIID) [MIM:618265]: An autosomal dominant disease characterized by moderate to severe intellectual disability, craniosynostosis, cleft palate, micrognathia, arthrogryposis, and short stature. Some patients may present bone abnormalities and generalized seizures. {ECO:0000269|PubMed:29432562}. Note=The disease is caused by variants affecting the gene represented in this entry.",CHEMBL4445;
CHP2,Q99750,MyoD family inhibitor (Myogenic repressor I-mf),,"FUNCTION: Inhibits the transactivation activity of the Myod family of myogenic factors and represses myogenesis. Acts by associating with Myod family members and retaining them in the cytoplasm by masking their nuclear localization signals. Can also interfere with the DNA-binding activity of Myod family members. Plays an important role in trophoblast and chondrogenic differentiation. Regulates the transcriptional activity of TCF7L1/TCF3 by interacting directly with TCF7L1/TCF3 and preventing it from binding DNA. Binds to the axin complex, resulting in an increase in the level of free beta-catenin. Affects axin regulation of the WNT and JNK signaling pathways (By similarity). {ECO:0000250}.",,,identical protein binding [GO:0042802]; transcription regulator inhibitor activity [GO:0140416],,
CELA2A,P08217,Chymotrypsin-like elastase family member 2A (EC 3.4.21.71) (Elastase-2A),ELA2A,"FUNCTION: Elastase that enhances insulin signaling and might have a physiologic role in cellular glucose metabolism. Circulates in plasma and reduces platelet hyperactivation, triggers both insulin secretion and degradation, and increases insulin sensitivity. {ECO:0000269|PubMed:31358993}.","ACT_SITE 73; /note=""Charge relay system""; /evidence=""ECO:0000250""; ACT_SITE 121; /note=""Charge relay system""; /evidence=""ECO:0000250""; ACT_SITE 216; /note=""Charge relay system""; /evidence=""ECO:0000250""",,endopeptidase activity [GO:0004175]; serine hydrolase activity [GO:0017171]; serine-type endopeptidase activity [GO:0004252],"DISEASE: Abdominal obesity-metabolic syndrome 4 (AOMS4) [MIM:618620]: A form of abdominal obesity-metabolic syndrome, a disorder characterized by abdominal obesity, high triglycerides, low levels of high density lipoprotein cholesterol, high blood pressure, and elevated fasting glucose levels. AOMS4 is an autosomal dominant disease. Patients manifest obesity, hypertension, early-onset coronary artery disease and type 2 diabetes. {ECO:0000269|PubMed:31358993}. Note=The disease is caused by variants affecting the gene represented in this entry.",
CELA2A,P01009,Alpha-1-antitrypsin (Alpha-1 protease inhibitor) (Alpha-1-antiproteinase) (Serpin A1) [Cleaved into: Short peptide from AAT (SPAAT)],AAT PI,"FUNCTION: Inhibitor of serine proteases. Its primary target is elastase, but it also has a moderate affinity for plasmin and thrombin. Irreversibly inhibits trypsin, chymotrypsin and plasminogen activator. The aberrant form inhibits insulin-induced NO synthesis in platelets, decreases coagulation time and has proteolytic activity against insulin and plasmin.; FUNCTION: [Short peptide from AAT]: Reversible chymotrypsin inhibitor. It also inhibits elastase, but not trypsin. Its major physiological function is the protection of the lower respiratory tract against proteolytic destruction by human leukocyte elastase (HLE).",,,identical protein binding [GO:0042802]; protease binding [GO:0002020]; serine-type endopeptidase inhibitor activity [GO:0004867],"DISEASE: Alpha-1-antitrypsin deficiency (A1ATD) [MIM:613490]: A disorder whose most common manifestation is emphysema, which becomes evident by the third to fourth decade. A less common manifestation of the deficiency is liver disease, which occurs in children and adults, and may result in cirrhosis and liver failure. Environmental factors, particularly cigarette smoking, greatly increase the risk of emphysema at an earlier age. {ECO:0000269|PubMed:1905728, ECO:0000269|PubMed:2227940, ECO:0000269|PubMed:2390072}. Note=The disease is caused by variants affecting the gene represented in this entry.",
CELA2A,Q9UNI1,Chymotrypsin-like elastase family member 1 (EC 3.4.21.36) (Elastase-1) (Pancreatic elastase 1),ELA1,FUNCTION: Serine proteases that hydrolyze many proteins in addition to elastin. {ECO:0000250|UniProtKB:Q91X79}.,"ACT_SITE 63; /note=""Charge relay system""; /evidence=""ECO:0000250|UniProtKB:P00772""; ACT_SITE 111; /note=""Charge relay system""; /evidence=""ECO:0000250|UniProtKB:P00772""; ACT_SITE 206; /note=""Charge relay system""; /evidence=""ECO:0000250|UniProtKB:P00772""",,metal ion binding [GO:0046872]; serine-type endopeptidase activity [GO:0004252],,CHEMBL3000;
UGT1A9,O60656,UDP-glucuronosyltransferase 1A9 (UGT1A9) (EC 2.4.1.17) (UDP-glucuronosyltransferase 1-9) (UDPGT 1-9) (UGT1*9) (UGT1-09) (UGT1.9) (UDP-glucuronosyltransferase 1-I) (UGT-1I) (UGT1I) (lugP4),GNT1 UGT1,"FUNCTION: [Isoform 1]: UDP-glucuronosyltransferase (UGT) that catalyzes phase II biotransformation reactions in which lipophilic substrates are conjugated with glucuronic acid to increase the metabolite's water solubility, thereby facilitating excretion into either the urine or bile (PubMed:12181437, PubMed:15470161, PubMed:15472229, PubMed:18004212, PubMed:18052087, PubMed:18674515, PubMed:19545173, PubMed:15231852, PubMed:21422672, PubMed:38211441). Essential for the elimination and detoxification of drugs, xenobiotics and endogenous compounds (PubMed:12181437, PubMed:18004212). Catalyzes the glucuronidation of endogenous estrogen hormones such as estradiol and estrone (PubMed:15472229). Involved in the glucuronidation of arachidonic acid (AA) and AA-derived eicosanoids including 15-HETE, PGB1 and F2-isoprostanes (8-iso-PGF2alpha and 5-epi-5-F2t-IsoP) (PubMed:15231852, PubMed:38211441). Glucuronates the phytochemical ferulic acid efficently at both the phenolic or the carboxylic acid group (PubMed:21422672). Also catalyzes the glucuronidation of the isoflavones genistein, daidzein, glycitein, formononetin, biochanin A and prunetin, which are phytoestrogens with anticancer and cardiovascular properties (PubMed:18052087, PubMed:19545173). Involved in the glucuronidation of the AGTR1 angiotensin receptor antagonist caderastan, a drug which can inhibit the effect of angiotensin II (PubMed:18674515). Involved in the biotransformation of 7-ethyl-10-hydroxycamptothecin (SN-38), the pharmacologically active metabolite of the anticancer drug irinotecan (PubMed:12181437, PubMed:20610558). Also metabolizes mycophenolate, an immunosuppressive agent (PubMed:15470161, PubMed:18004212). {ECO:0000269|PubMed:12181437, ECO:0000269|PubMed:15231852, ECO:0000269|PubMed:15470161, ECO:0000269|PubMed:15472229, ECO:0000269|PubMed:18004212, ECO:0000269|PubMed:18052087, ECO:0000269|PubMed:18674515, ECO:0000269|PubMed:19545173, ECO:0000269|PubMed:20610558, ECO:0000269|PubMed:21422672, ECO:0000269|PubMed:38211441}.; FUNCTION: [Isoform 2]: Lacks UGT glucuronidation activity but acts as a negative regulator of isoform 1. {ECO:0000269|PubMed:18004212, ECO:0000269|PubMed:20610558}.",,,enzyme binding [GO:0019899]; enzyme inhibitor activity [GO:0004857]; glucuronosyltransferase activity [GO:0015020]; identical protein binding [GO:0042802]; protein heterodimerization activity [GO:0046982]; protein homodimerization activity [GO:0042803]; retinoic acid binding [GO:0001972],,CHEMBL1743319;
UGT1A9,P35504,UDP-glucuronosyltransferase 1A5 (UGT1A5) (EC 2.4.1.17) (UDP-glucuronosyltransferase 1-5) (UDPGT 1-5) (UGT1*5) (UGT1-05) (UGT1.5) (UDP-glucuronosyltransferase 1-E) (UGT-1E) (UGT1E),GNT1 UGT1,"FUNCTION: [Isoform 1]: UDP-glucuronosyltransferase (UGT) that catalyzes phase II biotransformation reactions in which lipophilic substrates are conjugated with glucuronic acid to increase the metabolite's water solubility, thereby facilitating excretion into either the urine or bile (PubMed:18674515). Essential for the elimination and detoxification of drugs, xenobiotics and endogenous compounds (PubMed:18674515). Involved in the glucuronidation of the AGTR1 angiotensin receptor antagonist zolarsatan, a drug which can inhibit the effect of angiotensin II (PubMed:18674515). {ECO:0000269|PubMed:18674515}.; FUNCTION: [Isoform 2]: Lacks UGT glucuronidation activity but acts as a negative regulator of isoform 1. {ECO:0000269|PubMed:18004212}.",,,enzyme binding [GO:0019899]; glucuronosyltransferase activity [GO:0015020]; protein heterodimerization activity [GO:0046982]; protein homodimerization activity [GO:0042803],,CHEMBL4523985;
UGT1A9,P22310,UDP-glucuronosyltransferase 1A4 (UGT1A4) (EC 2.4.1.17) (Bilirubin-specific UDPGT isozyme 2) (hUG-BR2) (UDP-glucuronosyltransferase 1-4) (UDPGT 1-4) (UGT1*4) (UGT1-04) (UGT1.4) (UDP-glucuronosyltransferase 1-D) (UGT-1D) (UGT1D),GNT1 UGT1,"FUNCTION: [Isoform 1]: UDP-glucuronosyltransferase (UGT) that catalyzes phase II biotransformation reactions in which lipophilic substrates are conjugated with glucuronic acid to increase the metabolite's water solubility, thereby facilitating excretion into either the urine or bile (PubMed:18177842, PubMed:24641623, PubMed:15231852). Essential for the elimination and detoxification of drugs, xenobiotics and endogenous compounds (PubMed:18177842). Involved in the glucuronidation of calcidiol, which is the major circulating form of vitamin D3 essential for the regulation of calcium and phosphate homeostasis (PubMed:24641623). Also glucuronidates the biologically active form of vitamin D3, calcitriol, probably leading to its biliary transport and intestinal reabsorption (PubMed:18177842). Involved in the glucuronidation of arachidonic acid (AA) and AA-derived eicosanoids including 15-HETE, 20-HETE and PGB1 (PubMed:15231852). {ECO:0000269|PubMed:15231852, ECO:0000269|PubMed:18177842, ECO:0000269|PubMed:24641623}.; FUNCTION: [Isoform 2]: Lacks UDP-glucuronosyltransferase (UGT) activity but acts as a negative regulator of isoform 1. {ECO:0000269|PubMed:18004212, ECO:0000269|PubMed:20610558}.",,,enzyme binding [GO:0019899]; enzyme inhibitor activity [GO:0004857]; glucuronosyltransferase activity [GO:0015020]; protein heterodimerization activity [GO:0046982]; protein homodimerization activity [GO:0042803],,CHEMBL3619;
