ALOX12,P18054,Polyunsaturated fatty acid lipoxygenase ALOX12 (EC 1.13.11.-) (Arachidonate (12S)-lipoxygenase) (12S-LOX) (12S-lipoxygenase) (EC 1.13.11.31) (Arachidonate (15S)-lipoxygenase) (EC 1.13.11.33) (Linoleate (13S)-lipoxygenase) (Lipoxin synthase 12-LO) (EC 3.3.2.-) (Platelet-type lipoxygenase 12),12LO LOG12,"FUNCTION: Catalyzes the regio and stereo-specific incorporation of molecular oxygen into free and esterified polyunsaturated fatty acids generating lipid hydroperoxides that can be further reduced to the corresponding hydroxy species (PubMed:17493578, PubMed:18311922, PubMed:1851637, PubMed:32404334, PubMed:8319693, PubMed:8500694). Mainly converts arachidonate ((5Z,8Z,11Z,14Z)-eicosatetraenoate) to the specific bioactive lipid (12S)-hydroperoxyeicosatetraenoate/(12S)-HPETE (PubMed:17493578, PubMed:22984144, PubMed:24282679, PubMed:8319693, PubMed:8500694). Through the production of bioactive lipids like (12S)-HPETE it regulates different biological processes including platelet activation (PubMed:8319693, PubMed:8500694). It can also catalyze the epoxidation of double bonds of polyunsaturated fatty acids such as (14S)-hydroperoxy-docosahexaenoate/(14S)-HPDHA resulting in the formation of (13S,14S)-epoxy-DHA (PubMed:23504711). Furthermore, it may participate in the sequential oxidations of DHA ((4Z,7Z,10Z,13Z,16Z,19Z)-docosahexaenoate) to generate specialized pro-resolving mediators (SPMs) like resolvin D5 ((7S,17S)-diHPDHA) and (7S,14S)-diHPDHA, that actively down-regulate the immune response and have anti-aggregation properties with platelets (PubMed:32404334). An additional function involves a multistep process by which it transforms leukotriene A4/LTA4 into the bioactive lipids lipoxin A4/LXA4 and lipoxin B4/LXB4, both are vasoactive and LXA4 may regulate neutrophil function via occupancy of specific recognition sites (PubMed:8250832). Can also peroxidize linoleate ((9Z,12Z)-octadecadienoate) to (13S)-hydroperoxyoctadecadienoate/ (13S-HPODE) (By similarity). Due to its role in regulating both the expression of the vascular endothelial growth factor (VEGF, an angiogenic factor involved in the survival and metastasis of solid tumors) and the expression of integrin beta-1 (known to affect tumor cell migration and proliferation), it can be regarded as protumorigenic (PubMed:16638750, PubMed:22237009, PubMed:9751607). Important for cell survival, as it may play a role not only in proliferation but also in the prevention of apoptosis in vascular smooth muscle cells (PubMed:23578768). {ECO:0000250|UniProtKB:P39655, ECO:0000269|PubMed:16638750, ECO:0000269|PubMed:17493578, ECO:0000269|PubMed:18311922, ECO:0000269|PubMed:1851637, ECO:0000269|PubMed:22237009, ECO:0000269|PubMed:22984144, ECO:0000269|PubMed:23504711, ECO:0000269|PubMed:23578768, ECO:0000269|PubMed:24282679, ECO:0000269|PubMed:32404334, ECO:0000269|PubMed:8250832, ECO:0000269|PubMed:8319693, ECO:0000269|PubMed:8500694, ECO:0000269|PubMed:9751607}.",,PATHWAY: Lipid metabolism; hydroperoxy eicosatetraenoic acid biosynthesis. {ECO:0000269|PubMed:1851637}.,arachidonate 12(S)-lipoxygenase activity [GO:0004052]; arachidonate 15-lipoxygenase activity [GO:0050473]; hepoxilin-epoxide hydrolase activity [GO:0047977]; iron ion binding [GO:0005506]; linoleate 13S-lipoxygenase activity [GO:0016165],"DISEASE: Esophageal cancer (ESCR) [MIM:133239]: A malignancy of the esophagus. The most common types are esophageal squamous cell carcinoma and adenocarcinoma. Cancer of the esophagus remains a devastating disease because it is usually not detected until it has progressed to an advanced incurable stage. {ECO:0000269|PubMed:17460548}. Note=Disease susceptibility may be associated with variants affecting the gene represented in this entry. Gln at position 261 may confer interindividual susceptibility to esophageal cancer (PubMed:17460548). {ECO:0000269|PubMed:17460548}.; DISEASE: Colorectal cancer (CRC) [MIM:114500]: A complex disease characterized by malignant lesions arising from the inner wall of the large intestine (the colon) and the rectum. Genetic alterations are often associated with progression from premalignant lesion (adenoma) to invasive adenocarcinoma. Risk factors for cancer of the colon and rectum include colon polyps, long-standing ulcerative colitis, and genetic family history. {ECO:0000269|PubMed:17151091}. Note=Disease susceptibility may be associated with variants affecting the gene represented in this entry. Gln at position 261 may confer interindividual susceptibility to colorectal cancer (PubMed:17460548). {ECO:0000269|PubMed:17460548}.",CHEMBL3687;
ALOX12,O00270,"12-(S)-hydroxy-5,8,10,14-eicosatetraenoic acid receptor (12-(S)-HETE receptor) (12-HETER) (G-protein coupled receptor 31) (GPR31/12-HETER)",,"FUNCTION: High-affinity receptor for 12-(S)-hydroxy-5,8,10,14-eicosatetraenoic acid (12-S-HETE), with much lower affinities for other HETE isomers (PubMed:21712392, PubMed:29227475). 12-S-HETE is a eicosanoid, a 12-lipoxygenase (ALOX12) metabolite of arachidonic acid, involved in many physiologic and pathologic processes (PubMed:26965684, PubMed:28619714, PubMed:29227475). 12-S-HETE-binding leads to activation of ERK1/2 (MAPK3/MAPK1), MEK, and NF-kappa-B pathways leading to cell growth (PubMed:21712392, PubMed:29227475). Plays a crucial role for proliferation, survival and macropinocytosis of KRAS-dependent cancer cells by mediating the translocation of KRAS from the endoplasmic reticulum to the plasma membrane (PM) and its association with the PM (PubMed:28619714). Contributes to enhanced immune responses by inducing dendrite protrusion of small intestinal CX3CR1(+) phagocytes for the uptake of luminal antigens (By similarity). Acts also as a key receptor for 12-(S)-HETE-mediated liver ischemia reperfusion injury (PubMed:29227475). {ECO:0000250|UniProtKB:F8VQN3, ECO:0000269|PubMed:21712392, ECO:0000269|PubMed:26965684, ECO:0000269|PubMed:28619714, ECO:0000269|PubMed:29227475}.; FUNCTION: Proton-sensing G protein-coupled receptor. {ECO:0000269|PubMed:31119277}.",,,arachidonate binding [GO:0050544]; bioactive lipid receptor activity [GO:0045125]; G protein-coupled receptor activity [GO:0004930],,CHEMBL4523859;
ALOX12,P13647,"Keratin, type II cytoskeletal 5 (58 kDa cytokeratin) (Cytokeratin-5) (CK-5) (Keratin-5) (K5) (Type-II keratin Kb5)",,"FUNCTION: Required for the formation of keratin intermediate filaments in the basal epidermis and maintenance of the skin barrier in response to mechanical stress (By similarity). Regulates the recruitment of Langerhans cells to the epidermis, potentially by modulation of the abundance of macrophage chemotactic cytokines, macrophage inflammatory cytokines and CTNND1 localization in keratinocytes (By similarity). {ECO:0000250|UniProtKB:Q922U2}.",,,scaffold protein binding [GO:0097110]; structural constituent of cytoskeleton [GO:0005200]; structural constituent of skin epidermis [GO:0030280],"DISEASE: Epidermolysis bullosa simplex 2A, generalized severe (EBS2A) [MIM:619555]: A form of epidermolysis bullosa simplex, a group of skin fragility disorders characterized by skin blistering due to cleavage within the basal layer of keratinocytes, and erosions caused by minor mechanical trauma. There is a broad spectrum of clinical severity ranging from minor blistering on the feet, to subtypes with extracutaneous involvement and a lethal outcome. EBS2A is an autosomal dominant, severe form characterized by extensive intraepidermal blistering from the time of birth with herpetiform marginal spreading and central healing. Oral mucosal involvement, nail dystrophy, onychogryposis, formation of milia, and palmoplantar hyperkeratosis are common features. {ECO:0000269|PubMed:10730767, ECO:0000269|PubMed:12655565, ECO:0000269|PubMed:1372711, ECO:0000269|PubMed:16786515, ECO:0000269|PubMed:16882168, ECO:0000269|PubMed:19691749, ECO:0000269|PubMed:20128788, ECO:0000269|PubMed:21375516, ECO:0000269|PubMed:21623745, ECO:0000269|PubMed:26432462, ECO:0000269|PubMed:8757772, ECO:0000269|PubMed:9036937, ECO:0000269|PubMed:9406827, ECO:0000269|PubMed:9989794, ECO:0000269|Ref.22}. Note=The disease is caused by variants affecting the gene represented in this entry.; DISEASE: Epidermolysis bullosa simplex 2B, generalized intermediate (EBS2B) [MIM:619588]: A form of epidermolysis bullosa simplex, a group of skin fragility disorders characterized by skin blistering due to cleavage within the basal layer of keratinocytes, and erosions caused by minor mechanical trauma. There is a broad spectrum of clinical severity ranging from minor blistering on the feet, to subtypes with extracutaneous involvement and a lethal outcome. EBS2B is an autosomal dominant form characterized by generalized blistering manifesting at birth. The tendency to blistering diminishes in adolescence, when it may become localized to hands and feet. {ECO:0000269|PubMed:11407988, ECO:0000269|PubMed:16882168, ECO:0000269|PubMed:17855059, ECO:0000269|PubMed:21375516, ECO:0000269|PubMed:21623745, ECO:0000269|PubMed:23450297, ECO:0000269|PubMed:26432462, ECO:0000269|PubMed:7534039, ECO:0000269|PubMed:7686424, ECO:0000269|PubMed:9740251, ECO:0000269|PubMed:9989794}. Note=The disease is caused by variants affecting the gene represented in this entry.; DISEASE: Epidermolysis bullosa simplex 2C, localized (EBS2C) [MIM:619594]: A form of epidermolysis bullosa simplex, a group of skin fragility disorders characterized by skin blistering due to cleavage within the basal layer of keratinocytes, and erosions caused by minor mechanical trauma. There is a broad spectrum of clinical severity ranging from minor blistering on the feet, to subtypes with extracutaneous involvement and a lethal outcome. EBS2C is an autosomal dominant form with intraepidermal blistering mainly restricted to hands and feet beginning in infancy. Nails may be thick and dystrophic. {ECO:0000269|PubMed:10782015, ECO:0000269|PubMed:11973334, ECO:0000269|PubMed:12655565, ECO:0000269|PubMed:12707098, ECO:0000269|PubMed:14723728, ECO:0000269|PubMed:15140024, ECO:0000269|PubMed:15347343, ECO:0000269|PubMed:16786515, ECO:0000269|PubMed:16882168, ECO:0000269|PubMed:19220453, ECO:0000269|PubMed:21375516, ECO:0000269|PubMed:21623745, ECO:0000269|PubMed:26432462, ECO:0000269|PubMed:30240119, ECO:0000269|PubMed:7506097, ECO:0000269|PubMed:7520042, ECO:0000269|PubMed:7688477, ECO:0000269|PubMed:8595431, ECO:0000269|PubMed:8807337, ECO:0000269|PubMed:9804357}. Note=The disease is caused by variants affecting the gene represented in this entry.; DISEASE: Epidermolysis bullosa simplex 2D, generalized, intermediate or severe, autosomal recessive (EBS2D) [MIM:619599]: A form of epidermolysis bullosa simplex, a group of skin fragility disorders characterized by skin blistering due to cleavage within the basal layer of keratinocytes, and erosions caused by minor mechanical trauma. There is a broad spectrum of clinical severity ranging from minor blistering on the feet, to subtypes with extracutaneous involvement and a lethal outcome. EBS2D is an autosomal recessive form characterized by widespread intraepidermal skin blistering and erosions from birth. Death may occur in the neonatal period. {ECO:0000269|PubMed:11973334, ECO:0000269|PubMed:22832485, ECO:0000269|PubMed:31302245}. Note=The disease is caused by variants affecting the gene represented in this entry.; DISEASE: Epidermolysis bullosa simplex 2E, with migratory circinate erythema (EBS2E) [MIM:609352]: A form of epidermolysis bullosa simplex, a group of skin fragility disorders characterized by skin blistering due to cleavage within the basal layer of keratinocytes, and erosions caused by minor mechanical trauma. There is a broad spectrum of clinical severity ranging from minor blistering on the feet, to subtypes with extracutaneous involvement and a lethal outcome. EBS2E is an autosomal dominant form in which multiple vesicles are present from birth onward and acquire over time a typical migratory circinate pattern on an erythematous background. Postinflammatory hyperpigmentation develops gradually and may have a mottled pattern. {ECO:0000269|PubMed:12925204}. Note=The disease is caused by variants affecting the gene represented in this entry.; DISEASE: Epidermolysis bullosa simplex 2F, with mottled pigmentation (EBS2F) [MIM:131960]: A form of epidermolysis bullosa simplex, a group of skin fragility disorders characterized by skin blistering due to cleavage within the basal layer of keratinocytes, and erosions caused by minor mechanical trauma. There is a broad spectrum of clinical severity ranging from minor blistering on the feet, to subtypes with extracutaneous involvement and a lethal outcome. EBS2F is an autosomal dominant form characterized by generalized skin blistering of intermediate severity beginning at birth, with mottled or reticulate pigmentation developing gradually. Focal keratoses of palms and soles and dystrophic, thickened nails develop over time. {ECO:0000269|PubMed:10494094, ECO:0000269|PubMed:16882168, ECO:0000269|PubMed:21375516, ECO:0000269|PubMed:21623745, ECO:0000269|PubMed:26432462, ECO:0000269|PubMed:8799157}. Note=The disease is caused by variants affecting the gene represented in this entry.; DISEASE: Dowling-Degos disease 1 (DDD1) [MIM:179850]: An autosomal dominant genodermatosis. Affected individuals develop a postpubertal reticulate hyperpigmentation that is progressive and disfiguring, and small hyperkeratotic dark brown papules that affect mainly the flexures and great skin folds. Patients usually show no abnormalities of the hair or nails. {ECO:0000269|PubMed:16465624, ECO:0000269|PubMed:21569119, ECO:0000269|PubMed:22437315}. Note=The disease is caused by variants affecting the gene represented in this entry.",
ALOX12,P02545,Prelamin-A/C [Cleaved into: Lamin-A/C (70 kDa lamin) (Renal carcinoma antigen NY-REN-32)],LMN1,"FUNCTION: [Lamin-A/C]: Lamins are intermediate filament proteins that assemble into a filamentous meshwork, and which constitute the major components of the nuclear lamina, a fibrous layer on the nucleoplasmic side of the inner nuclear membrane (PubMed:10080180, PubMed:10580070, PubMed:10587585, PubMed:10814726, PubMed:11799477, PubMed:12075506, PubMed:12927431, PubMed:15317753, PubMed:18551513, PubMed:18611980, PubMed:2188730, PubMed:22431096, PubMed:2344612, PubMed:23666920, PubMed:24741066, PubMed:31434876, PubMed:31548606, PubMed:37788673, PubMed:37832547). Lamins provide a framework for the nuclear envelope, bridging the nuclear envelope and chromatin, thereby playing an important role in nuclear assembly, chromatin organization, nuclear membrane and telomere dynamics (PubMed:10080180, PubMed:10580070, PubMed:10587585, PubMed:10814726, PubMed:11799477, PubMed:12075506, PubMed:12927431, PubMed:15317753, PubMed:18551513, PubMed:18611980, PubMed:22431096, PubMed:23666920, PubMed:24741066, PubMed:31548606, PubMed:37788673, PubMed:37832547). Lamin A and C also regulate matrix stiffness by conferring nuclear mechanical properties (PubMed:23990565, PubMed:25127216). The structural integrity of the lamina is strictly controlled by the cell cycle, as seen by the disintegration and formation of the nuclear envelope in prophase and telophase, respectively (PubMed:2188730, PubMed:2344612). Lamin A and C are present in equal amounts in the lamina of mammals (PubMed:10080180, PubMed:10580070, PubMed:10587585, PubMed:10814726, PubMed:11799477, PubMed:12075506, PubMed:12927431, PubMed:15317753, PubMed:18551513, PubMed:18611980, PubMed:22431096, PubMed:23666920, PubMed:31548606). Also invoved in DNA repair: recruited by DNA repair proteins XRCC4 and IFFO1 to the DNA double-strand breaks (DSBs) to prevent chromosome translocation by immobilizing broken DNA ends (PubMed:31548606). Required for normal development of peripheral nervous system and skeletal muscle and for muscle satellite cell proliferation (PubMed:10080180, PubMed:10814726, PubMed:11799477, PubMed:18551513, PubMed:22431096). Required for osteoblastogenesis and bone formation (PubMed:12075506, PubMed:15317753, PubMed:18611980). Also prevents fat infiltration of muscle and bone marrow, helping to maintain the volume and strength of skeletal muscle and bone (PubMed:10587585). Required for cardiac homeostasis (PubMed:10580070, PubMed:12927431, PubMed:18611980, PubMed:23666920). {ECO:0000269|PubMed:10080180, ECO:0000269|PubMed:10580070, ECO:0000269|PubMed:10587585, ECO:0000269|PubMed:10814726, ECO:0000269|PubMed:11799477, ECO:0000269|PubMed:12075506, ECO:0000269|PubMed:12927431, ECO:0000269|PubMed:15317753, ECO:0000269|PubMed:18551513, ECO:0000269|PubMed:18611980, ECO:0000269|PubMed:2188730, ECO:0000269|PubMed:22431096, ECO:0000269|PubMed:2344612, ECO:0000269|PubMed:23666920, ECO:0000269|PubMed:23990565, ECO:0000269|PubMed:24741066, ECO:0000269|PubMed:25127216, ECO:0000269|PubMed:31434876, ECO:0000269|PubMed:31548606, ECO:0000269|PubMed:37788673, ECO:0000269|PubMed:37832547}.; FUNCTION: [Prelamin-A/C]: Prelamin-A/C can accelerate smooth muscle cell senescence (PubMed:20458013). It acts to disrupt mitosis and induce DNA damage in vascular smooth muscle cells (VSMCs), leading to mitotic failure, genomic instability, and premature senescence (PubMed:20458013). {ECO:0000269|PubMed:20458013}.",,,identical protein binding [GO:0042802]; structural constituent of cytoskeleton [GO:0005200]; structural constituent of nuclear lamina [GO:0160123]; structural molecule activity [GO:0005198],"DISEASE: Emery-Dreifuss muscular dystrophy 2, autosomal dominant (EDMD2) [MIM:181350]: A form of Emery-Dreifuss muscular dystrophy, a degenerative myopathy characterized by weakness and atrophy of muscle without involvement of the nervous system, early contractures of the elbows, Achilles tendons and spine, and cardiomyopathy associated with cardiac conduction defects. {ECO:0000269|PubMed:22431096, ECO:0000269|PubMed:27234031}. Note=The disease is caused by variants affecting the gene represented in this entry.; DISEASE: Emery-Dreifuss muscular dystrophy 3, autosomal recessive (EDMD3) [MIM:616516]: A form of Emery-Dreifuss muscular dystrophy, a degenerative myopathy characterized by weakness and atrophy of muscle without involvement of the nervous system, early contractures of the elbows, Achilles tendons and spine, and cardiomyopathy associated with cardiac conduction defects. {ECO:0000269|PubMed:22431096, ECO:0000269|PubMed:27234031}. Note=The disease is caused by variants affecting the gene represented in this entry.; DISEASE: Cardiomyopathy, dilated, 1A (CMD1A) [MIM:115200]: A disorder characterized by ventricular dilation and impaired systolic function, resulting in congestive heart failure and arrhythmia. Patients are at risk of premature death. {ECO:0000269|PubMed:10580070, ECO:0000269|PubMed:11561226, ECO:0000269|PubMed:11792809, ECO:0000269|PubMed:11897440, ECO:0000269|PubMed:12486434, ECO:0000269|PubMed:12628721, ECO:0000269|PubMed:12920062, ECO:0000269|PubMed:14675861, ECO:0000269|PubMed:14684700, ECO:0000269|PubMed:15140538, ECO:0000269|PubMed:15219508, ECO:0000269|PubMed:15372542, ECO:0000269|PubMed:16061563, ECO:0000269|PubMed:16156025, ECO:0000269|PubMed:18606848, ECO:0000269|PubMed:19167105, ECO:0000269|PubMed:20160190, ECO:0000269|PubMed:21846512}. Note=The disease is caused by variants affecting the gene represented in this entry.; DISEASE: Lipodystrophy, familial partial, 2 (FPLD2) [MIM:151660]: A disorder characterized by the loss of subcutaneous adipose tissue in the lower parts of the body (limbs, buttocks, trunk). It is accompanied by an accumulation of adipose tissue in the face and neck causing a double chin, fat neck, or cushingoid appearance. Adipose tissue may also accumulate in the axillae, back, labia majora, and intraabdominal region. Affected patients are insulin-resistant and may develop glucose intolerance and diabetes mellitus after age 20 years, hypertriglyceridemia, and low levels of high density lipoprotein cholesterol. {ECO:0000269|PubMed:10587585, ECO:0000269|PubMed:10655060, ECO:0000269|PubMed:10739751, ECO:0000269|PubMed:11792809, ECO:0000269|PubMed:12015247, ECO:0000269|PubMed:12196663, ECO:0000269|PubMed:12629077, ECO:0000269|PubMed:15372542, ECO:0000269|PubMed:17250669, ECO:0000269|PubMed:19220582, ECO:0000269|PubMed:24485160}. Note=The disease is caused by variants affecting the gene represented in this entry.; DISEASE: Charcot-Marie-Tooth disease, axonal, 2B1 (CMT2B1) [MIM:605588]: A recessive axonal form of Charcot-Marie-Tooth disease, a disorder of the peripheral nervous system, characterized by progressive weakness and atrophy, initially of the peroneal muscles and later of the distal muscles of the arms. Charcot-Marie-Tooth disease is classified in two main groups on the basis of electrophysiologic properties and histopathology: primary peripheral demyelinating neuropathies (designated CMT1 when they are dominantly inherited) and primary peripheral axonal neuropathies (CMT2). Neuropathies of the CMT2 group are characterized by signs of axonal degeneration in the absence of obvious myelin alterations, normal or slightly reduced nerve conduction velocities, and progressive distal muscle weakness and atrophy. {ECO:0000269|PubMed:11799477}. Note=The disease is caused by variants affecting the gene represented in this entry.; DISEASE: Hutchinson-Gilford progeria syndrome (HGPS) [MIM:176670]: Rare genetic disorder characterized by features reminiscent of marked premature aging. {ECO:0000269|PubMed:12714972, ECO:0000269|PubMed:12768443, ECO:0000269|PubMed:12927431, ECO:0000269|PubMed:15060110, ECO:0000269|PubMed:15286156, ECO:0000269|PubMed:15622532, ECO:0000269|PubMed:19933576, ECO:0000269|PubMed:21791255, ECO:0000269|PubMed:22355414, ECO:0000269|PubMed:23666920}. Note=The disease is caused by variants affecting the gene represented in this entry. HGPS is caused by the toxic accumulation of a truncated form of lamin-A/C. This mutant protein, called progerin (isoform 6), acts to deregulate mitosis and DNA damage signaling, leading to premature cell death and senescence. The mutant form is mainly generated by a silent or missense mutation at codon 608 of prelamin A that causes activation of a cryptic splice donor site, resulting in production of isoform 6 with a deletion of 50 amino acids near the C terminus. Progerin lacks the conserved ZMPSTE24/FACE1 cleavage site and therefore remains permanently farnesylated. Thus, although it can enter the nucleus and associate with the nuclear envelope, it cannot incorporate normally into the nuclear lamina (PubMed:12714972). {ECO:0000269|PubMed:12714972}.; DISEASE: Cardiomyopathy, dilated, with hypergonadotropic hypogonadism (CMDHH) [MIM:212112]: A disorder characterized by the association of genital anomalies, hypergonadotropic hypogonadism and dilated cardiomyopathy. Patients can present other variable clinical manifestations including intellectual disability, skeletal anomalies, scleroderma-like skin, graying and thinning of hair, osteoporosis. Dilated cardiomyopathy is characterized by ventricular dilation and impaired systolic function, resulting in congestive heart failure and arrhythmia. {ECO:0000269|PubMed:12927431, ECO:0000269|PubMed:17150192, ECO:0000269|PubMed:19283854}. Note=The disease is caused by variants affecting the gene represented in this entry.; DISEASE: Mandibuloacral dysplasia with type A lipodystrophy (MADA) [MIM:248370]: A form of mandibuloacral dysplasia, a rare progeroid disorder with clinical and genetic heterogeneity, characterized by growth retardation, craniofacial dysmorphic features due to distal bone resorption, musculoskeletal and skin abnormalities associated with lipodystrophy. MADA is an autosomal recessive disease characterized by mandibular and clavicular hypoplasia, acroosteolysis, delayed closure of the cranial suture, progeroid appearance, partial alopecia, soft tissue calcinosis, joint contractures, and partial lipodystrophy with loss of subcutaneous fat from the extremities. Adipose tissue in the face, neck and trunk is normal or increased. {ECO:0000269|PubMed:12075506, ECO:0000269|PubMed:15998779, ECO:0000269|PubMed:16278265}. Note=The disease is caused by variants affecting the gene represented in this entry.; DISEASE: Restrictive dermopathy 2 (RSDM2) [MIM:619793]: An autosomal dominant form of restrictive dermopathy, a genodermatosis mainly characterized by intrauterine growth retardation, tight and rigid skin with erosions, prominent superficial vasculature and epidermal hyperkeratosis, facial dysmorphism, sparse/absent eyelashes and eyebrows, mineralization defects of the skull, thin dysplastic clavicles, pulmonary hypoplasia, multiple joint contractures and an early neonatal lethal course. Liveborn children usually die within the first week of life. {ECO:0000269|PubMed:15317753}. Note=The disease is caused by variants affecting the gene represented in this entry.; DISEASE: Heart-hand syndrome Slovenian type (HHS-Slovenian) [MIM:610140]: Heart-hand syndrome (HHS) is a clinically and genetically heterogeneous disorder characterized by the co-occurrence of a congenital cardiac disease and limb malformations. {ECO:0000269|PubMed:18611980}. Note=The disease is caused by variants affecting the gene represented in this entry.; DISEASE: Muscular dystrophy congenital LMNA-related (MDCL) [MIM:613205]: A form of congenital muscular dystrophy. Patients present at birth, or within the first few months of life, with hypotonia, muscle weakness and often with joint contractures. {ECO:0000269|PubMed:18551513}. Note=The disease is caused by variants affecting the gene represented in this entry.; DISEASE: Note=Defects in LMNA may cause a late-onset cardiocutaneous progeria syndrome characterized by cutaneous manifestations of aging appearing in the third decade of life, cardiac valve calcification and dysfunction, prominent atherosclerosis, and cardiomyopathy, leading to death on average in the fourth decade. {ECO:0000269|PubMed:23666920}.",CHEMBL1293235;
