SLC6A20,Q6UY14,ADAMTS-like protein 4 (ADAMTSL-4) (Thrombospondin repeat-containing protein 1),TSRC1,"FUNCTION: Positive regulation of apoptosis. May facilitate FBN1 microfibril biogenesis. {ECO:0000269|PubMed:16364318, ECO:0000269|PubMed:21989719}.",,,identical protein binding [GO:0042802]; protease binding [GO:0002020],"DISEASE: Ectopia lentis 2, isolated, autosomal recessive (ECTOL2) [MIM:225100]: An ocular abnormality characterized by partial or complete displacement of the lens from its space resulting from defective zonule formation. {ECO:0000269|PubMed:19200529}. Note=The disease is caused by variants affecting the gene represented in this entry.; DISEASE: Ectopia lentis et pupillae (ECTOLP) [MIM:225200]: An ocular abnormality characterized by displacement of the lenses and the pupils, associated with other ocular anomalies, but without systemic manifestations. The condition is usually bilateral, with the lenses and pupils displaced in opposite directions. Additional signs include enlarged corneal diameter, increased corneal astigmatism, increased anterior chamber depth, thinning and flattening of the iris with loss of crypts, angle malformation caused by enlarged iris processes, persistent pupillary membrane, loss of zonular fibers, tilted disk, and increased axial length. Secondary manifestations include refractive errors, glaucoma, early cataract development, and retinal detachment. Membrane formation on the posterior aspect of the iris has been observed both in histologic sections and on ultrasound biomicroscopy. {ECO:0000269|PubMed:20702823}. Note=The disease is caused by variants affecting the gene represented in this entry.",
SLC6A20,P60409,Keratin-associated protein 10-7 (High sulfur keratin-associated protein 10.7) (Keratin-associated protein 10.7) (Keratin-associated protein 18-7) (Keratin-associated protein 18.7),KAP10.7 KAP18-7 KRTAP10.7 KRTAP18-7 KRTAP18.7,"FUNCTION: In the hair cortex, hair keratin intermediate filaments are embedded in an interfilamentous matrix, consisting of hair keratin-associated proteins (KRTAP), which are essential for the formation of a rigid and resistant hair shaft through their extensive disulfide bond cross-linking with abundant cysteine residues of hair keratins. The matrix proteins include the high-sulfur and high-glycine-tyrosine keratins.",,,identical protein binding [GO:0042802],,
SLC6A20,P0DPK4,Notch homolog 2 N-terminal-like protein C,,"FUNCTION: Human-specific protein that promotes neural progenitor proliferation and evolutionary expansion of the brain neocortex by regulating the Notch signaling pathway (PubMed:29561261, PubMed:29856954, PubMed:29856955). Able to promote neural progenitor self-renewal, possibly by down-regulating neuronal differentiation genes, thereby delaying the differentiation of neuronal progenitors and leading to an overall final increase in neuronal production (PubMed:29856954). Acts by enhancing the Notch signaling pathway via two different mechanisms that probably work in parallel to reach the same effect (PubMed:29856954). Enhances Notch signaling pathway in a non-cell-autonomous manner via direct interaction with NOTCH2 (PubMed:29856954). Also promotes Notch signaling pathway in a cell-autonomous manner through inhibition of cis DLL1-NOTCH2 interactions, which promotes neuronal differentiation (By similarity). {ECO:0000250|UniProtKB:P0DPK3, ECO:0000269|PubMed:29561261, ECO:0000269|PubMed:29856954, ECO:0000269|PubMed:29856955}.",,,calcium ion binding [GO:0005509],"DISEASE: Neuronal intranuclear inclusion disease (NIID) [MIM:603472]: An autosomal dominant, slowly progressive, neurodegenerative disease characterized by eosinophilic hyaline intranuclear inclusions in the central and peripheral nervous system, and also in the visceral organs. Clinical manifestations are variable and include pyramidal and extrapyramidal symptoms, cerebellar ataxia, cognitive decline and dementia, peripheral neuropathy, and autonomic dysfunction. {ECO:0000269|PubMed:31178126, ECO:0000269|PubMed:31332380, ECO:0000269|PubMed:31332381}. Note=The disease is caused by variants affecting the gene represented in this entry. The molecular defect in NOTCH2NLC is a CGG repeat expansion in the 5-prime untranslated region of the gene. The expansion can be greater than one hundred repeat units in patients, while healthy individuals have 5 to 43 repeats. {ECO:0000269|PubMed:31178126, ECO:0000269|PubMed:31332380, ECO:0000269|PubMed:31332381}.; DISEASE: Note=Defects in NOTCH2NLC may be a cause of chromosome 1q21.1 deletion/duplication syndrome (PubMed:29856954). Deletions of NOTCH2NL (NOTCH2NLA, NOTCH2NLB and/or NOTCH2NLC) are present in patients affected by microcephaly, whereas macrocephaly is observed in patients with NOTCH2NL duplications (PubMed:29856954). {ECO:0000269|PubMed:29856954}.; DISEASE: Tremor, hereditary essential 6 (ETM6) [MIM:618866]: A form of essential tremor, a common movement disorder mainly characterized by postural tremor of the arms. Head, legs, trunk, voice, jaw, and facial muscles may also be involved. The condition can be aggravated by emotions, hunger, fatigue and temperature extremes, and may cause a functional disability or even incapacitation. ETM6 inheritance is autosomal dominant. {ECO:0000269|PubMed:32333675}. Note=The disease is caused by variants affecting the gene represented in this entry.; DISEASE: Oculopharyngodistal myopathy 3 (OPDM3) [MIM:619473]: A form of oculopharyngodistal myopathy, a rare hereditary muscle disease characterized by progressive distal limb weakness, ptosis, ophthalmoplegia, bulbar muscle weakness and rimmed vacuoles on muscle biopsy. In addition to muscular features, OPDM3 patients may develop pigmentary retinopathy, peripheral neuropathy, or hearing loss. Cognition is usually not affected, but there may be deficits or psychiatric manifestations. Brain imaging tends to show a leukoencephalopathy, often with a characteristic linear signal along the corticomedullary junction on brain imaging. OPDM3 is a slowly progressive form with an autosomal dominant transmission pattern, and variable age at onset ranging from childhood to late adulthood. {ECO:0000269|PubMed:33239111, ECO:0000269|PubMed:33693509}. Note=The disease is caused by variants affecting the gene represented in this entry. The causative mutation is a heterozygous trinucleotide repeat expansion (CGG) that results in expanded polyglycine (polyG) tract in isoform 1. Mutant proteins may form aggregates that contribute to toxicity and induce cell death. {ECO:0000269|PubMed:33693509}.",
SLC6A20,P60410,Keratin-associated protein 10-8 (High sulfur keratin-associated protein 10.8) (Keratin-associated protein 10.8) (Keratin-associated protein 18-8) (Keratin-associated protein 18.8),KAP10.8 KAP18-8 KRTAP10.8 KRTAP18-8 KRTAP18.8,"FUNCTION: In the hair cortex, hair keratin intermediate filaments are embedded in an interfilamentous matrix, consisting of hair keratin-associated proteins (KRTAP), which are essential for the formation of a rigid and resistant hair shaft through their extensive disulfide bond cross-linking with abundant cysteine residues of hair keratins. The matrix proteins include the high-sulfur and high-glycine-tyrosine keratins.",,,identical protein binding [GO:0042802],,
SLC6A20,A8MQ03,Cysteine-rich tail protein 1,C9orf169,FUNCTION: Component of the stratum corneum that may contribute to epidermal antimicrobial host defenses. {ECO:0000269|PubMed:36804407}.,,,identical protein binding [GO:0042802],,
SLC6A20,B7ZLW4,Transporter,,,,,metal ion binding [GO:0046872]; symporter activity [GO:0015293],,
SLC6A20,A0A8V8TQV4,Transporter,,,,,metal ion binding [GO:0046872]; symporter activity [GO:0015293],,
SLC6A3,Q01959,Sodium-dependent dopamine transporter (DA transporter) (DAT) (Solute carrier family 6 member 3),DAT1,"FUNCTION: Mediates sodium- and chloride-dependent transport of dopamine (PubMed:10375632, PubMed:11093780, PubMed:1406597, PubMed:15505207, PubMed:19478460, PubMed:8302271). Also mediates sodium- and chloride-dependent transport of norepinephrine (also known as noradrenaline) (By similarity). Regulator of light-dependent retinal hyaloid vessel regression, downstream of OPN5 signaling (By similarity). {ECO:0000250|UniProtKB:P23977, ECO:0000250|UniProtKB:Q61327, ECO:0000269|PubMed:1406597, ECO:0000269|PubMed:15505207, ECO:0000269|PubMed:8302271}.",,,amine binding [GO:0043176]; dopamine binding [GO:0035240]; dopamine:sodium symporter activity [GO:0005330]; heterocyclic compound binding [GO:1901363]; metal ion binding [GO:0046872]; monoamine transmembrane transporter activity [GO:0008504]; neurotransmitter transmembrane transporter activity [GO:0005326]; norepinephrine:sodium symporter activity [GO:0005334]; protease binding [GO:0002020]; protein phosphatase 2A binding [GO:0051721]; protein-containing complex binding [GO:0044877]; signaling receptor binding [GO:0005102],"DISEASE: Parkinsonism-dystonia 1, infantile-onset (PKDYS1) [MIM:613135]: An autosomal recessive neurodegenerative disorder characterized by infantile onset of parkinsonism and dystonia. Other neurologic features include global developmental delay, bradykinesia and pyramidal tract signs. {ECO:0000269|PubMed:19478460}. Note=The disease is caused by variants affecting the gene represented in this entry.",CHEMBL238;
SLC6A3,O43294,Transforming growth factor beta-1-induced transcript 1 protein (Androgen receptor coactivator 55 kDa protein) (Androgen receptor-associated protein of 55 kDa) (Hydrogen peroxide-inducible clone 5 protein) (Hic-5),ARA55,"FUNCTION: Functions as a molecular adapter coordinating multiple protein-protein interactions at the focal adhesion complex and in the nucleus. Links various intracellular signaling modules to plasma membrane receptors and regulates the Wnt and TGFB signaling pathways. May also regulate SLC6A3 and SLC6A4 targeting to the plasma membrane hence regulating their activity. In the nucleus, functions as a nuclear receptor coactivator regulating glucocorticoid, androgen, mineralocorticoid and progesterone receptor transcriptional activity. May play a role in the processes of cell growth, proliferation, migration, differentiation and senescence. May have a zinc-dependent DNA-binding activity. {ECO:0000269|PubMed:10075738, ECO:0000269|PubMed:11463817, ECO:0000269|PubMed:11856738, ECO:0000269|PubMed:12177201, ECO:0000269|PubMed:12445807, ECO:0000269|PubMed:12700349, ECO:0000269|PubMed:15211577, ECO:0000269|PubMed:15561701, ECO:0000269|PubMed:16141357, ECO:0000269|PubMed:16624805, ECO:0000269|PubMed:16803896, ECO:0000269|PubMed:16849583, ECO:0000269|PubMed:17166536, ECO:0000269|PubMed:17233630, ECO:0000269|PubMed:9032249}.",,,I-SMAD binding [GO:0070411]; metal ion binding [GO:0046872]; nuclear androgen receptor binding [GO:0050681]; Roundabout binding [GO:0048495]; transcription coactivator activity [GO:0003713],,
SLC6A3,O14656,Torsin-1A (Dystonia 1 protein) (Torsin ATPase-1A) (EC 3.6.4.-) (Torsin family 1 member A),DQ2 DYT1 TA TORA,"FUNCTION: Protein with chaperone functions important for the control of protein folding, processing, stability and localization as well as for the reduction of misfolded protein aggregates. Involved in the regulation of synaptic vesicle recycling, controls STON2 protein stability in collaboration with the COP9 signalosome complex (CSN). In the nucleus, may link the cytoskeleton with the nuclear envelope, this mechanism seems to be crucial for the control of nuclear polarity, cell movement and, specifically in neurons, nuclear envelope integrity. Participates in the cellular trafficking and may regulate the subcellular location of multipass membrane proteins such as the dopamine transporter SLC6A3, leading to the modulation of dopamine neurotransmission. In the endoplasmic reticulum, plays a role in the quality control of protein folding by increasing clearance of misfolded proteins such as SGCE variants or holding them in an intermediate state for proper refolding. May have a redundant function with TOR1B in non-neural tissues. {ECO:0000269|PubMed:15505207, ECO:0000269|PubMed:16361107, ECO:0000269|PubMed:17428918, ECO:0000269|PubMed:18167355, ECO:0000269|PubMed:18827015, ECO:0000269|PubMed:19339278, ECO:0000269|PubMed:20169475, ECO:0000269|PubMed:23569223, ECO:0000269|PubMed:24930953}.",,,ATP binding [GO:0005524]; ATP hydrolysis activity [GO:0016887]; ATP-dependent H2AZ histone chaperone activity [GO:0140849]; ATP-dependent H3-H4 histone complex chaperone activity [GO:0140665]; ATP-dependent protein folding chaperone [GO:0140662]; chromatin extrusion motor activity [GO:0140584]; cohesin loader activity [GO:0061775]; cytoskeletal protein binding [GO:0008092]; DNA clamp loader activity [GO:0003689]; identical protein binding [GO:0042802]; kinesin binding [GO:0019894]; misfolded protein binding [GO:0051787]; unfolded protein binding [GO:0051082],"DISEASE: Dystonia 1, torsion, autosomal dominant (DYT1) [MIM:128100]: A primary torsion dystonia, and the most common and severe form. Dystonia is defined by the presence of sustained involuntary muscle contractions, often leading to abnormal postures. Dystonia type 1 is characterized by involuntary, repetitive, sustained muscle contractions or postures involving one or more sites of the body, in the absence of other neurological symptoms. Typically, symptoms develop first in an arm or leg in middle to late childhood and progress in approximately 30% of patients to other body regions (generalized dystonia) within about five years. 'Torsion' refers to the twisting nature of body movements observed in DYT1, often affecting the trunk. Distribution and severity of symptoms vary widely between affected individuals, ranging from mild focal dystonia to severe generalized dystonia, even within families. {ECO:0000269|PubMed:14970196, ECO:0000269|PubMed:15505207, ECO:0000269|PubMed:16361107, ECO:0000269|PubMed:17428918, ECO:0000269|PubMed:18167355, ECO:0000269|PubMed:18477710, ECO:0000269|PubMed:18827015, ECO:0000269|PubMed:19955557, ECO:0000269|PubMed:20169475, ECO:0000269|PubMed:21102408, ECO:0000269|PubMed:24930953, ECO:0000269|PubMed:27490483, ECO:0000269|PubMed:9288096}. Note=The disease is caused by variants affecting the gene represented in this entry.; DISEASE: Arthrogryposis multiplex congenita 5 (AMC5) [MIM:618947]: A form of arthrogryposis multiplex congenita, a developmental condition characterized by multiple joint contractures resulting from reduced or absent fetal movements. AMC5 is an autosomal recessive form characterized by severe congenital contractures, developmental delay, strabismus and tremor. {ECO:0000269|PubMed:28516161, ECO:0000269|PubMed:29053766, ECO:0000269|PubMed:30244176}. Note=The disease is caused by variants affecting the gene represented in this entry.",
SLC6A3,Q9NRD5,PRKCA-binding protein (Protein interacting with C kinase 1) (Protein kinase C-alpha-binding protein),PRKCABP,"FUNCTION: Probable adapter protein that bind to and organize the subcellular localization of a variety of membrane proteins containing some PDZ recognition sequence. Involved in the clustering of various receptors, possibly by acting at the receptor internalization level. Plays a role in synaptic plasticity by regulating the trafficking and internalization of AMPA receptors. May be regulated upon PRKCA activation. May regulate ASIC1/ASIC3 channel. Regulates actin polymerization by inhibiting the actin-nucleating activity of the Arp2/3 complex; the function is competitive with nucleation promoting factors and is linked to neuronal morphology regulation and AMPA receptor (AMPAR) endocytosis. Via interaction with the Arp2/3 complex involved in regulation of synaptic plasicity of excitatory synapses and required for spine shrinkage during long-term depression (LTD). Involved in regulation of astrocyte morphology, antagonistic to Arp2/3 complex activator WASL/N-WASP function. {ECO:0000269|PubMed:20403402}.",,,actin filament binding [GO:0051015]; Arp2/3 complex binding [GO:0071933]; G protein-coupled receptor binding [GO:0001664]; identical protein binding [GO:0042802]; membrane curvature sensor activity [GO:0140090]; metal ion binding [GO:0046872]; phospholipid binding [GO:0005543]; protein domain specific binding [GO:0019904]; protein kinase C binding [GO:0005080]; signaling receptor binding [GO:0005102],,
SLC6A3,P37840,Alpha-synuclein (Non-A beta component of AD amyloid) (Non-A4 component of amyloid precursor) (NACP),NACP PARK1,"FUNCTION: Neuronal protein that plays several roles in synaptic activity such as regulation of synaptic vesicle trafficking and subsequent neurotransmitter release (PubMed:20798282, PubMed:26442590, PubMed:28288128, PubMed:30404828). Participates as a monomer in synaptic vesicle exocytosis by enhancing vesicle priming, fusion and dilation of exocytotic fusion pores (PubMed:28288128, PubMed:30404828). Mechanistically, acts by increasing local Ca(2+) release from microdomains which is essential for the enhancement of ATP-induced exocytosis (PubMed:30404828). Acts also as a molecular chaperone in its multimeric membrane-bound state, assisting in the folding of synaptic fusion components called SNAREs (Soluble NSF Attachment Protein REceptors) at presynaptic plasma membrane in conjunction with cysteine string protein-alpha/DNAJC5 (PubMed:20798282). This chaperone activity is important to sustain normal SNARE-complex assembly during aging (PubMed:20798282). Also plays a role in the regulation of the dopamine neurotransmission by associating with the dopamine transporter (DAT1) and thereby modulating its activity (PubMed:26442590). {ECO:0000269|PubMed:20798282, ECO:0000269|PubMed:26442590, ECO:0000269|PubMed:28288128, ECO:0000269|PubMed:30404828}.",,,actin binding [GO:0003779]; alpha-tubulin binding [GO:0043014]; calcium ion binding [GO:0005509]; copper ion binding [GO:0005507]; cuprous ion binding [GO:1903136]; cysteine-type endopeptidase inhibitor activity involved in apoptotic process [GO:0043027]; dynein complex binding [GO:0070840]; ferrous iron binding [GO:0008198]; histone binding [GO:0042393]; Hsp70 protein binding [GO:0030544]; identical protein binding [GO:0042802]; kinesin binding [GO:0019894]; lipid binding [GO:0008289]; magnesium ion binding [GO:0000287]; molecular adaptor activity [GO:0060090]; oxidoreductase activity [GO:0016491]; phospholipid binding [GO:0005543]; phosphoprotein binding [GO:0051219]; protein kinase inhibitor activity [GO:0004860]; SNARE binding [GO:0000149]; tau protein binding [GO:0048156]; transcription cis-regulatory region binding [GO:0000976]; zinc ion binding [GO:0008270],"DISEASE: Note=Genetic alterations of SNCA resulting in aberrant polymerization into fibrils, are associated with several neurodegenerative diseases (synucleinopathies). SNCA fibrillar aggregates represent the major non A-beta component of Alzheimer disease amyloid plaque, and a major component of Lewy body inclusions. They are also found within Lewy body (LB)-like intraneuronal inclusions, glial inclusions and axonal spheroids in neurodegeneration with brain iron accumulation type 1.; DISEASE: Parkinson disease 1, autosomal dominant (PARK1) [MIM:168601]: A complex neurodegenerative disorder characterized by bradykinesia, resting tremor, muscular rigidity and postural instability. Additional features are characteristic postural abnormalities, dysautonomia, dystonic cramps, and dementia. The pathology of Parkinson disease involves the loss of dopaminergic neurons in the substantia nigra and the presence of Lewy bodies (intraneuronal accumulations of aggregated proteins), in surviving neurons in various areas of the brain. The disease is progressive and usually manifests after the age of 50 years, although early-onset cases (before 50 years) are known. The majority of the cases are sporadic suggesting a multifactorial etiology based on environmental and genetic factors. However, some patients present with a positive family history for the disease. Familial forms of the disease usually begin at earlier ages and are associated with atypical clinical features. {ECO:0000269|PubMed:14755719, ECO:0000269|PubMed:23427326, ECO:0000269|PubMed:23457019, ECO:0000269|PubMed:24936070, ECO:0000269|PubMed:25561023, ECO:0000269|PubMed:9197268, ECO:0000269|PubMed:9462735}. Note=The disease is caused by variants affecting the gene represented in this entry.; DISEASE: Parkinson disease 4, autosomal dominant (PARK4) [MIM:605543]: A complex neurodegenerative disorder with manifestations ranging from typical Parkinson disease to dementia with Lewy bodies. Clinical features include parkinsonian symptoms (resting tremor, rigidity, postural instability and bradykinesia), dementia, diffuse Lewy body pathology, autonomic dysfunction, hallucinations and paranoia. Note=The disease is caused by variants affecting the gene represented in this entry.; DISEASE: Dementia, Lewy body (DLB) [MIM:127750]: A neurodegenerative disorder characterized by mental impairment leading to dementia, parkinsonism, fluctuating cognitive function, visual hallucinations, falls, syncopal episodes, and sensitivity to neuroleptic medication. Brainstem or cortical intraneuronal accumulations of aggregated proteins (Lewy bodies) are the only essential pathologic features. Patients may also have hippocampal and neocortical senile plaques, sometimes in sufficient number to fulfill the diagnostic criteria for Alzheimer disease. {ECO:0000269|PubMed:14755719}. Note=The disease is caused by variants affecting the gene represented in this entry.",CHEMBL6152;
SLC6A3,A0AAQ5BGN6,Transporter,,"FUNCTION: Mediates sodium- and chloride-dependent transport of dopamine. Also mediates sodium- and chloride-dependent transport of norepinephrine (also known as noradrenaline). Regulator of light-dependent retinal hyaloid vessel regression, downstream of OPN5 signaling. {ECO:0000256|ARBA:ARBA00045868}.",,,dopamine:sodium symporter activity [GO:0005330]; metal ion binding [GO:0046872],,
SLC6A3,A0AAQ5BGS7,Transporter,,"FUNCTION: Mediates sodium- and chloride-dependent transport of dopamine. Also mediates sodium- and chloride-dependent transport of norepinephrine (also known as noradrenaline). Regulator of light-dependent retinal hyaloid vessel regression, downstream of OPN5 signaling. {ECO:0000256|ARBA:ARBA00045868}.",,,dopamine:sodium symporter activity [GO:0005330]; metal ion binding [GO:0046872],,
SLC6A3,A0AAQ5BGQ7,Transporter,,"FUNCTION: Mediates sodium- and chloride-dependent transport of dopamine. Also mediates sodium- and chloride-dependent transport of norepinephrine (also known as noradrenaline). Regulator of light-dependent retinal hyaloid vessel regression, downstream of OPN5 signaling. {ECO:0000256|ARBA:ARBA00045868}.",,,dopamine:sodium symporter activity [GO:0005330]; metal ion binding [GO:0046872],,
SLC6A3,O43761,Synaptogyrin-3,,FUNCTION: May play a role in regulated exocytosis. May indirectly regulate the activity of the plasma membrane dopamine transporter SLC6A3 and thereby regulate dopamine transport back from the synaptic cleft into the presynaptic terminal. {ECO:0000250|UniProtKB:Q8R191}.,,,SH2 domain binding [GO:0042169],,
SLC6A3,Q99578,GTP-binding protein Rit2 (EC 3.6.5.2) (Ras-like protein expressed in neurons) (Ras-like without CAAX protein 2),RIN ROC2,FUNCTION: Binds and exchanges GTP and GDP. Binds and modulates the activation of POU4F1 as gene expression regulator. {ECO:0000250|UniProtKB:P70425}.,,,calmodulin binding [GO:0005516]; chromatin binding [GO:0003682]; G protein activity [GO:0003925]; GDP binding [GO:0019003]; GTP binding [GO:0005525]; GTPase activity [GO:0003924]; semaphorin receptor binding [GO:0030215],,
SLC6A3,Q6U736,Opsin-5 (G-protein coupled receptor 136) (G-protein coupled receptor PGR12) (Neuropsin) (Transmembrane protein 13),GPR136 PGR12 TMEM13,"FUNCTION: G-protein coupled receptor which selectively activates G(i) type G proteins via ultraviolet A (UVA) light-mediated activation in the retina (By similarity). Preferentially binds the chromophore 11-cis retinal and is a bistable protein that displays emission peaks at 380 nm (UVA light) and 470 nm (blue light) (PubMed:22043319). Required for the light-response in the inner plexiform layer, and contributes to the regulation of the light-response in the nerve fiber layer, via phosphorylated DAT/SLC6A3 dopamine uptake (By similarity). Involved in local corneal and retinal circadian rhythm photoentrainment via modulation of the UVA light-induced phase-shift of the retina clock (By similarity). Acts as a circadian photoreceptor in the outer ear, via modulation of circadian clock-gene expression in response to violet light during the light-to-dark transition phase and night phase of the circadian cycle (By similarity). Required in the retina to negatively regulate hyaloid vessel regression during postnatal development via light-dependent OPN5-SLC32A1-DRD2-VEGFR2 signaling (By similarity). Involved in the light-dependent regulation of retina and vitreous compartment dopamine levels (By similarity). {ECO:0000250|UniProtKB:Q6VZZ7, ECO:0000269|PubMed:22043319}.",,,11-cis retinal binding [GO:0005502]; G protein-coupled photoreceptor activity [GO:0008020],,CHEMBL4523878;
