OPRD1,P16615,"Sarcoplasmic/endoplasmic reticulum calcium ATPase 2 (SERCA2) (SR Ca(2+)-ATPase 2) (EC 7.2.2.10) (Calcium pump 2) (Calcium-transporting ATPase sarcoplasmic reticulum type, slow twitch skeletal muscle isoform) (Endoplasmic reticulum class 1/2 Ca(2+) ATPase)",ATP2B,"FUNCTION: This magnesium-dependent enzyme catalyzes the hydrolysis of ATP coupled with the translocation of calcium from the cytosol to the sarcoplasmic reticulum lumen (PubMed:12542527, PubMed:16402920). Involved in autophagy in response to starvation. Upon interaction with VMP1 and activation, controls ER-isolation membrane contacts for autophagosome formation (PubMed:28890335). Also modulates ER contacts with lipid droplets, mitochondria and endosomes (PubMed:28890335). In coordination with FLVCR2 mediates heme-stimulated switching from mitochondrial ATP synthesis to thermogenesis (By similarity). {ECO:0000250|UniProtKB:O55143, ECO:0000269|PubMed:12542527, ECO:0000269|PubMed:16402920, ECO:0000269|PubMed:28890335}.; FUNCTION: [Isoform 2]: Involved in the regulation of the contraction/relaxation cycle. Acts as a regulator of TNFSF11-mediated Ca(2+) signaling pathways via its interaction with TMEM64 which is critical for the TNFSF11-induced CREB1 activation and mitochondrial ROS generation necessary for proper osteoclast generation. Association between TMEM64 and SERCA2 in the ER leads to cytosolic Ca(2+) spiking for activation of NFATC1 and production of mitochondrial ROS, thereby triggering Ca(2+) signaling cascades that promote osteoclast differentiation and activation. {ECO:0000250|UniProtKB:O55143}.","ACT_SITE 351; /note=""4-aspartylphosphate intermediate""; /evidence=""ECO:0000250|UniProtKB:P04191""",,ATP binding [GO:0005524]; ATP hydrolysis activity [GO:0016887]; calcium ion binding [GO:0005509]; enzyme binding [GO:0019899]; lncRNA binding [GO:0106222]; P-type calcium transporter activity [GO:0005388]; P-type calcium transporter activity involved in regulation of cardiac muscle cell membrane potential [GO:0086039]; S100 protein binding [GO:0044548]; transmembrane transporter binding [GO:0044325],"DISEASE: Acrokeratosis verruciformis (AKV) [MIM:101900]: A localized disorder of keratinization, which is inherited as an autosomal dominant trait. Its onset is early in life with multiple flat-topped, flesh-colored papules on the hands and feet, punctate keratoses on the palms and soles, with varying degrees of nail involvement. The histopathology shows a distinctive pattern of epidermal features with hyperkeratosis, hypergranulosis and acanthosis together with papillomatosis. These changes are frequently associated with circumscribed elevations of the epidermis that are said to resemble church spires. There are no features of dyskeratosis or acantholysis, the typical findings in lesions of Darier disease. {ECO:0000269|PubMed:12542527}. Note=The disease is caused by variants affecting the gene represented in this entry.; DISEASE: Darier disease (DD) [MIM:124200]: A skin disorder characterized by warty papules and plaques in seborrheic areas (central trunk, flexures, scalp and forehead), palmoplantar pits and distinctive nail abnormalities. It is due to loss of adhesion between epidermal cells (acantholysis) and abnormal keratinization. Patients with mild disease may have no more than a few scattered keratotic papules or subtle nail changes, whereas those with severe disease are handicapped by widespread malodorous keratotic plaques. Some patients present with hemorrhage into acantholytic vesicles on the palms and dorsal aspects of the fingers which gives rise to black macules. In a few families affected by Darier disease, neuropsychiatric abnormalities such as mild intellectual disability, schizophrenia, bipolar disorder and epilepsy have been reported. Stress, UV exposure, heat, sweat, friction and oral contraception exacerbate disease symptoms. Clinical variants of Darier disease include hypertrophic, vesicobullous, hypopigmented, cornifying, zosteriform or linear, acute and comedonal subtypes. Comedonal Darier disease is characterized by the coexistence of acne-like comedonal lesions with typical Darier hyperkeratotic papules on light-exposed areas. At histopathologic level, comedonal Darier disease differs from classic Darier disease in the prominent follicular involvement and the presence of greatly elongated dermal villi. {ECO:0000269|PubMed:10080178, ECO:0000269|PubMed:10441323, ECO:0000269|PubMed:10441324, ECO:0000269|PubMed:10441325, ECO:0000269|PubMed:19995371, ECO:0000269|PubMed:28035777}. Note=The disease is caused by variants affecting the gene represented in this entry.",CHEMBL3901;
OPRD1,A0A346G5W5,Opioid receptor delta 1 isoform DOR-1E,DOP DOR DOR1 OPRD,,,,G protein-coupled opioid receptor activity [GO:0004985],,
OPRD1,A0A346G5W6,Opioid receptor delta 1 isoform DOR-1B,DOP DOR DOR1 OPRD,,,,G protein-coupled enkephalin receptor activity [GO:0038046],,
OPRD1,A0A346G5W7,Opioid receptor delta 1 isoform DOR-1C,DOP DOR DOR1 OPRD,,,,G protein-coupled enkephalin receptor activity [GO:0038046],,
OPRD1,A0A346G5W8,Opioid receptor delta 1 isoform DOR-1D,DOP DOR DOR1 OPRD,,,,G protein-coupled enkephalin receptor activity [GO:0038046],,
OPRD1,D2CGC9,Delta opioid receptor 1 variant,,,,,G protein-coupled enkephalin receptor activity [GO:0038046],,
OPRD1,G8XRH5,Mu-type opioid receptor,,,,,beta-endorphin receptor activity [GO:0004979],,
OPRD1,C7E9I8,Mu-type opioid receptor,,,,,beta-endorphin receptor activity [GO:0004979],,
OPRD1,Q71V90,Mu-type opioid receptor,,,,,beta-endorphin receptor activity [GO:0004979],,
OPRD1,L0E130,Mu-type opioid receptor,,,,,beta-endorphin receptor activity [GO:0004979],,
OPRD1,B8K2Q5,Mu opioid receptor splice variant MOR-1H,,,,,beta-endorphin receptor activity [GO:0004979],,
OPRD1,E7EW71,Opioid receptor mu 1,,,,,beta-endorphin receptor activity [GO:0004979],,
ADRB2,P07550,Beta-2 adrenergic receptor (Beta-2 adrenoreceptor) (Beta-2 adrenoceptor),ADRB2R B2AR,"FUNCTION: Beta-adrenergic receptors mediate the catecholamine-induced activation of adenylate cyclase through the action of G proteins. The beta-2-adrenergic receptor binds epinephrine with an approximately 30-fold greater affinity than it does norepinephrine. {ECO:0000269|PubMed:2831218, ECO:0000269|PubMed:7915137}.",,,adenylate cyclase binding [GO:0008179]; amyloid-beta binding [GO:0001540]; beta2-adrenergic receptor activity [GO:0004941]; identical protein binding [GO:0042802]; norepinephrine binding [GO:0051380]; potassium channel regulator activity [GO:0015459]; protein homodimerization activity [GO:0042803]; protein-containing complex binding [GO:0044877],,CHEMBL210;
ADRB2,X5DQM5,Beta-2 adrenergic receptor (Beta-2 adrenoceptor) (Beta-2 adrenoreceptor),,FUNCTION: Beta-adrenergic receptors mediate the catecholamine-induced activation of adenylate cyclase through the action of G proteins. The beta-2-adrenergic receptor binds epinephrine with an approximately 30-fold greater affinity than it does norepinephrine. {ECO:0000256|RuleBase:RU368057}.,,,adenylate cyclase binding [GO:0008179]; beta2-adrenergic receptor activity [GO:0004941],,
ADRB2,Q96B67,Arrestin domain-containing protein 3 (TBP-2-like inducible membrane protein) (TLIMP),KIAA1376,"FUNCTION: Adapter protein that plays a role in regulating cell-surface expression of adrenergic receptors and probably also other G protein-coupled receptors (PubMed:20559325, PubMed:21982743, PubMed:23208550). Plays a role in NEDD4-mediated ubiquitination and endocytosis af activated ADRB2 and subsequent ADRB2 degradation (PubMed:20559325, PubMed:23208550). May recruit NEDD4 to ADRB2 (PubMed:20559325). Alternatively, may function as adapter protein that does not play a major role in recruiting NEDD4 to ADRB2, but rather plays a role in a targeting ADRB2 to endosomes (PubMed:23208550). {ECO:0000269|PubMed:20559325, ECO:0000269|PubMed:23208550}.",,,beta-3 adrenergic receptor binding [GO:0031699],,
ADRB2,P32121,Beta-arrestin-2 (Arrestin beta-2) (Non-visual arrestin-3),ARB2 ARR2,"FUNCTION: Functions in regulating agonist-mediated G-protein coupled receptor (GPCR) signaling by mediating both receptor desensitization and resensitization processes. During homologous desensitization, beta-arrestins bind to the GPRK-phosphorylated receptor and sterically preclude its coupling to the cognate G-protein; the binding appears to require additional receptor determinants exposed only in the active receptor conformation. The beta-arrestins target many receptors for internalization by acting as endocytic adapters (CLASPs, clathrin-associated sorting proteins) and recruiting the GPRCs to the adapter protein 2 complex 2 (AP-2) in clathrin-coated pits (CCPs). However, the extent of beta-arrestin involvement appears to vary significantly depending on the receptor, agonist and cell type. Internalized arrestin-receptor complexes traffic to intracellular endosomes, where they remain uncoupled from G-proteins. Two different modes of arrestin-mediated internalization occur. Class A receptors, like ADRB2, OPRM1, ENDRA, D1AR and ADRA1B dissociate from beta-arrestin at or near the plasma membrane and undergo rapid recycling. Class B receptors, like AVPR2, AGTR1, NTSR1, TRHR and TACR1 internalize as a complex with arrestin and traffic with it to endosomal vesicles, presumably as desensitized receptors, for extended periods of time. Receptor resensitization then requires that receptor-bound arrestin is removed so that the receptor can be dephosphorylated and returned to the plasma membrane. Mediates endocytosis of CCR7 following ligation of CCL19 but not CCL21. Involved in internalization of P2RY1, P2RY4, P2RY6 and P2RY11 and ATP-stimulated internalization of P2RY2. Involved in phosphorylation-dependent internalization of OPRD1 and subsequent recycling or degradation. Involved in ubiquitination of IGF1R. Beta-arrestins function as multivalent adapter proteins that can switch the GPCR from a G-protein signaling mode that transmits short-lived signals from the plasma membrane via small molecule second messengers and ion channels to a beta-arrestin signaling mode that transmits a distinct set of signals that are initiated as the receptor internalizes and transits the intracellular compartment. Acts as a signaling scaffold for MAPK pathways such as MAPK1/3 (ERK1/2) and MAPK10 (JNK3). ERK1/2 and JNK3 activated by the beta-arrestin scaffold are largely excluded from the nucleus and confined to cytoplasmic locations such as endocytic vesicles, also called beta-arrestin signalosomes. Acts as a signaling scaffold for the AKT1 pathway. GPCRs for which the beta-arrestin-mediated signaling relies on both ARRB1 and ARRB2 (codependent regulation) include ADRB2, F2RL1 and PTH1R. For some GPCRs the beta-arrestin-mediated signaling relies on either ARRB1 or ARRB2 and is inhibited by the other respective beta-arrestin form (reciprocal regulation). Increases ERK1/2 signaling in AGTR1- and AVPR2-mediated activation (reciprocal regulation). Involved in CCR7-mediated ERK1/2 signaling involving ligand CCL19. Is involved in type-1A angiotensin II receptor/AGTR1-mediated ERK activity. Is involved in type-1A angiotensin II receptor/AGTR1-mediated MAPK10 activity. Is involved in dopamine-stimulated AKT1 activity in the striatum by disrupting the association of AKT1 with its negative regulator PP2A. Involved in AGTR1-mediated chemotaxis. Appears to function as signaling scaffold involved in regulation of MIP-1-beta-stimulated CCR5-dependent chemotaxis. Involved in attenuation of NF-kappa-B-dependent transcription in response to GPCR or cytokine stimulation by interacting with and stabilizing CHUK. Suppresses UV-induced NF-kappa-B-dependent activation by interacting with CHUK. The function is promoted by stimulation of ADRB2 and dephosphorylation of ARRB2. Involved in p53/TP53-mediated apoptosis by regulating MDM2 and reducing the MDM2-mediated degradation of p53/TP53. May serve as nuclear messenger for GPCRs. Upon stimulation of OR1D2, may be involved in regulation of gene expression during the early processes of fertilization. Also involved in regulation of receptors other than GPCRs. Involved in endocytosis of TGFBR2 and TGFBR3 and down-regulates TGF-beta signaling such as NF-kappa-B activation. Involved in endocytosis of low-density lipoprotein receptor/LDLR. Involved in endocytosis of smoothened homolog/Smo, which also requires GRK2. Involved in endocytosis of SLC9A5. Involved in endocytosis of ENG and subsequent TGF-beta-mediated ERK activation and migration of epithelial cells. Involved in Toll-like receptor and IL-1 receptor signaling through the interaction with TRAF6 which prevents TRAF6 autoubiquitination and oligomerization required for activation of NF-kappa-B and JUN (PubMed:26839314). Involved in insulin resistance by acting as insulin-induced signaling scaffold for SRC, AKT1 and INSR. Involved in regulation of inhibitory signaling of natural killer cells by recruiting PTPN6 and PTPN11 to KIR2DL1. Involved in IL8-mediated granule release in neutrophils. Involved in the internalization of the atypical chemokine receptor ACKR3. Acts as an adapter protein coupling FFAR4 receptor to specific downstream signaling pathways, as well as mediating receptor endocytosis (PubMed:22282525, PubMed:23809162). During the activation step of NLRP3 inflammasome, directly associates with NLRP3 leading to inhibition of pro-inflammatory cytokine release and inhibition of inflammation (PubMed:23809162). {ECO:0000269|PubMed:10644702, ECO:0000269|PubMed:11877451, ECO:0000269|PubMed:12488444, ECO:0000269|PubMed:12582207, ECO:0000269|PubMed:12949261, ECO:0000269|PubMed:12958365, ECO:0000269|PubMed:14711824, ECO:0000269|PubMed:15054093, ECO:0000269|PubMed:15125834, ECO:0000269|PubMed:15205453, ECO:0000269|PubMed:15475570, ECO:0000269|PubMed:15618519, ECO:0000269|PubMed:15635042, ECO:0000269|PubMed:15671180, ECO:0000269|PubMed:15699339, ECO:0000269|PubMed:15878855, ECO:0000269|PubMed:16144840, ECO:0000269|PubMed:16280323, ECO:0000269|PubMed:16378096, ECO:0000269|PubMed:16492667, ECO:0000269|PubMed:16820410, ECO:0000269|PubMed:17540773, ECO:0000269|PubMed:18419762, ECO:0000269|PubMed:18604210, ECO:0000269|PubMed:19325136, ECO:0000269|PubMed:19620252, ECO:0000269|PubMed:19643177, ECO:0000269|PubMed:20048153, ECO:0000269|PubMed:22282525, ECO:0000269|PubMed:22457824, ECO:0000269|PubMed:23809162, ECO:0000269|PubMed:24817116, ECO:0000269|PubMed:26839314}.",,,angiotensin receptor binding [GO:0031701]; D1 dopamine receptor binding [GO:0031748]; enzyme binding [GO:0019899]; G protein-coupled receptor binding [GO:0001664]; molecular adaptor activity [GO:0060090]; protein kinase B binding [GO:0043422]; signaling receptor binding [GO:0005102]; ubiquitin protein ligase binding [GO:0031625],,
ADRB2,O14745,Na(+)/H(+) exchange regulatory cofactor NHE-RF1 (NHERF-1) (Ezrin-radixin-moesin-binding phosphoprotein 50) (EBP50) (Regulatory cofactor of Na(+)/H(+) exchanger) (Sodium-hydrogen exchanger regulatory factor 1) (Solute carrier family 9 isoform A3 regulatory factor 1),NHERF SLC9A3R1,"FUNCTION: Scaffold protein that connects plasma membrane proteins with members of the ezrin/moesin/radixin family and thereby helps to link them to the actin cytoskeleton and to regulate their surface expression. Necessary for recycling of internalized ADRB2. Was first known to play a role in the regulation of the activity and subcellular location of SLC9A3. Necessary for cAMP-mediated phosphorylation and inhibition of SLC9A3. May enhance Wnt signaling. May participate in HTR4 targeting to microvilli (By similarity). Involved in the regulation of phosphate reabsorption in the renal proximal tubules. Involved in sperm capacitation. May participate in the regulation of the chloride and bicarbonate homeostasis in spermatozoa. {ECO:0000250, ECO:0000269|PubMed:10499588, ECO:0000269|PubMed:18784102, ECO:0000269|PubMed:9096337, ECO:0000269|PubMed:9430655}.",,,beta-2 adrenergic receptor binding [GO:0031698]; beta-catenin binding [GO:0008013]; channel activator activity [GO:0099103]; chloride channel regulator activity [GO:0017081]; dopamine receptor binding [GO:0050780]; gamma-aminobutyric acid transmembrane transporter activity [GO:0015185]; growth factor receptor binding [GO:0070851]; identical protein binding [GO:0042802]; myosin II binding [GO:0045159]; PDZ domain binding [GO:0030165]; phosphatase binding [GO:0019902]; protein-containing complex binding [GO:0044877]; protein-membrane adaptor activity [GO:0043495]; signaling receptor binding [GO:0005102]; transmembrane transporter binding [GO:0044325]; type 2 metabotropic glutamate receptor binding [GO:0031799]; type 3 metabotropic glutamate receptor binding [GO:0031800],"DISEASE: Nephrolithiasis/osteoporosis, hypophosphatemic, 2 (NPHLOP2) [MIM:612287]: A disease characterized by decreased renal phosphate absorption, renal phosphate wasting, hypophosphatemia, hyperphosphaturia, hypercalciuria, nephrolithiasis and osteoporosis. {ECO:0000269|PubMed:18784102, ECO:0000269|PubMed:22506049}. Note=The disease is caused by variants affecting the gene represented in this entry.",CHEMBL4523125;
ADRB2,P34947,G protein-coupled receptor kinase 5 (EC 2.7.11.16) (G protein-coupled receptor kinase GRK5),GPRK5,"FUNCTION: Serine/threonine kinase that phosphorylates preferentially the activated forms of a variety of G-protein-coupled receptors (GPCRs). Such receptor phosphorylation initiates beta-arrestin-mediated receptor desensitization, internalization, and signaling events leading to their down-regulation. Phosphorylates a variety of GPCRs, including adrenergic receptors, muscarinic acetylcholine receptors (more specifically Gi-coupled M2/M4 subtypes), dopamine receptors and opioid receptors. In addition to GPCRs, also phosphorylates various substrates: Hsc70-interacting protein/ST13, TP53/p53, HDAC5, and arrestin-1/ARRB1. Phosphorylation of ARRB1 by GRK5 inhibits G-protein independent MAPK1/MAPK3 signaling downstream of 5HT4-receptors. Phosphorylation of HDAC5, a repressor of myocyte enhancer factor 2 (MEF2) leading to nuclear export of HDAC5 and allowing MEF2-mediated transcription. Phosphorylation of TP53/p53, a crucial tumor suppressor, inhibits TP53/p53-mediated apoptosis. Phosphorylation of ST13 regulates internalization of the chemokine receptor. Phosphorylates rhodopsin (RHO) (in vitro) and a non G-protein-coupled receptor, LRP6 during Wnt signaling (in vitro). {ECO:0000269|PubMed:19661922, ECO:0000269|PubMed:19801552, ECO:0000269|PubMed:20038610, ECO:0000269|PubMed:20124405, ECO:0000269|PubMed:21728385}.","ACT_SITE 311; /note=""Proton acceptor""; /evidence=""ECO:0000255|PROSITE-ProRule:PRU00159""",,ATP binding [GO:0005524]; beta-adrenergic receptor kinase activity [GO:0047696]; G protein-coupled receptor kinase activity [GO:0004703]; phospholipid binding [GO:0005543]; protein kinase activity [GO:0004672]; protein kinase C binding [GO:0005080]; protein serine/threonine kinase activity [GO:0004674],,CHEMBL5678;
ADRB2,Q8NCT1,Arrestin domain-containing protein 4,,"FUNCTION: Functions as an adapter recruiting ubiquitin-protein ligases to their specific substrates (By similarity). Plays a role in endocytosis of activated G protein-coupled receptors (GPCRs) (Probable). Through an ubiquitination-dependent mechanism also plays a role in the incorporation of SLC11A2 into extracellular vesicles (By similarity). May play a role in glucose uptake (PubMed:19605364). Participates in innate immune response by promoting IFIH1/MDA5 activation through interaction with TRIM65 (PubMed:28594402). {ECO:0000250|UniProtKB:A0A0B4J1F4, ECO:0000269|PubMed:19605364, ECO:0000269|PubMed:28594402, ECO:0000305}.",,,ubiquitin-like ligase-substrate adaptor activity [GO:1990756],,
ADRB2,Q96L92,Sorting nexin-27,KIAA0488,"FUNCTION: Involved in the retrograde transport from endosome to plasma membrane, a trafficking pathway that promotes the recycling of internalized transmembrane proteins. Following internalization, endocytosed transmembrane proteins are delivered to early endosomes and recycled to the plasma membrane instead of being degraded in lysosomes. SNX27 specifically binds and directs sorting of a subset of transmembrane proteins containing a PDZ-binding motif at the C-terminus: following interaction with target transmembrane proteins, associates with the retromer complex, preventing entry into the lysosomal pathway, and promotes retromer-tubule based plasma membrane recycling. SNX27 also binds with the WASH complex. Interacts with membranes containing phosphatidylinositol-3-phosphate (PtdIns(3P)). May participate in establishment of natural killer cell polarity. Recruits CYTIP to early endosomes. {ECO:0000269|PubMed:17351151, ECO:0000269|PubMed:20733053, ECO:0000269|PubMed:21300787, ECO:0000269|PubMed:21303929, ECO:0000269|PubMed:21602791, ECO:0000269|PubMed:21926430, ECO:0000269|PubMed:22411990, ECO:0000269|PubMed:23563491}.",,,phosphatidylinositol binding [GO:0035091]; phosphatidylinositol-3-phosphate binding [GO:0032266],,
ADRB2,Q9H6Z9,Prolyl hydroxylase EGLN3 (EC 1.14.11.-) (Egl nine homolog 3) (EC 1.14.11.29) (HPH-1) (Hypoxia-inducible factor prolyl hydroxylase 3) (HIF-PH3) (HIF-prolyl hydroxylase 3) (HPH-3) (Prolyl hydroxylase domain-containing protein 3) (PHD3),,"FUNCTION: Prolyl hydroxylase that mediates hydroxylation of proline residues in target proteins, such as PKM, TELO2, ATF4 and HIF1A (PubMed:19584355, PubMed:20978507, PubMed:21483450, PubMed:21575608, PubMed:21620138, PubMed:22797300). Target proteins are preferentially recognized via a LXXLAP motif. Cellular oxygen sensor that catalyzes, under normoxic conditions, the post-translational formation of 4-hydroxyproline in hypoxia-inducible factor (HIF) alpha proteins (PubMed:11595184, PubMed:12181324). Hydroxylates a specific proline found in each of the oxygen-dependent degradation (ODD) domains (N-terminal, NODD, and C-terminal, CODD) of HIF1A (PubMed:11595184, PubMed:12181324). Also hydroxylates HIF2A (PubMed:11595184, PubMed:12181324). Has a preference for the CODD site for both HIF1A and HIF2A (PubMed:11595184, PubMed:12181324). Hydroxylation on the NODD site by EGLN3 appears to require prior hydroxylation on the CODD site (PubMed:11595184, PubMed:12181324). Hydroxylated HIFs are then targeted for proteasomal degradation via the von Hippel-Lindau ubiquitination complex (PubMed:11595184, PubMed:12181324). Under hypoxic conditions, the hydroxylation reaction is attenuated allowing HIFs to escape degradation resulting in their translocation to the nucleus, heterodimerization with HIF1B, and increased expression of hypoxy-inducible genes (PubMed:11595184, PubMed:12181324). ELGN3 is the most important isozyme in limiting physiological activation of HIFs (particularly HIF2A) in hypoxia. Also hydroxylates PKM in hypoxia, limiting glycolysis (PubMed:21483450, PubMed:21620138). Under normoxia, hydroxylates and regulates the stability of ADRB2 (PubMed:19584355). Regulator of cardiomyocyte and neuronal apoptosis. In cardiomyocytes, inhibits the anti-apoptotic effect of BCL2 by disrupting the BAX-BCL2 complex (PubMed:20849813). In neurons, has a NGF-induced proapoptotic effect, probably through regulating CASP3 activity (PubMed:16098468). Also essential for hypoxic regulation of neutrophilic inflammation (PubMed:21317538). Plays a crucial role in DNA damage response (DDR) by hydroxylating TELO2, promoting its interaction with ATR which is required for activation of the ATR/CHK1/p53 pathway (PubMed:22797300). Also mediates hydroxylation of ATF4, leading to decreased protein stability of ATF4 (Probable). {ECO:0000269|PubMed:11595184, ECO:0000269|PubMed:12181324, ECO:0000269|PubMed:16098468, ECO:0000269|PubMed:19584355, ECO:0000269|PubMed:20849813, ECO:0000269|PubMed:20978507, ECO:0000269|PubMed:21317538, ECO:0000269|PubMed:21483450, ECO:0000269|PubMed:21575608, ECO:0000269|PubMed:21620138, ECO:0000269|PubMed:22797300, ECO:0000305|PubMed:17684156}.",,,2-oxoglutarate-dependent dioxygenase activity [GO:0016706]; ferrous iron binding [GO:0008198]; hypoxia-inducible factor-proline dioxygenase activity [GO:0160082]; L-ascorbic acid binding [GO:0031418]; peptidyl-proline 4-dioxygenase activity [GO:0031545],,CHEMBL5705;
ADRB2,P25098,Beta-adrenergic receptor kinase 1 (Beta-ARK-1) (EC 2.7.11.15) (G-protein coupled receptor kinase 2),ADRBK1 BARK BARK1,"FUNCTION: Specifically phosphorylates the agonist-occupied form of the beta-adrenergic and closely related receptors, probably inducing a desensitization of them (PubMed:19715378). Key regulator of LPAR1 signaling (PubMed:19306925). Competes with RALA for binding to LPAR1 thus affecting the signaling properties of the receptor (PubMed:19306925). Desensitizes LPAR1 and LPAR2 in a phosphorylation-independent manner (PubMed:19306925). Positively regulates ciliary smoothened (SMO)-dependent Hedgehog (Hh) signaling pathway by facilitating the trafficking of SMO into the cilium and the stimulation of SMO activity (By similarity). Inhibits relaxation of airway smooth muscle in response to blue light (PubMed:30284927). {ECO:0000250|UniProtKB:P21146, ECO:0000269|PubMed:19306925, ECO:0000269|PubMed:19715378, ECO:0000269|PubMed:30284927}.","ACT_SITE 317; /note=""Proton acceptor""; /evidence=""ECO:0000255|PROSITE-ProRule:PRU00159, ECO:0000255|PROSITE-ProRule:PRU10027""",,alpha-2A adrenergic receptor binding [GO:0031694]; ATP binding [GO:0005524]; beta-adrenergic receptor kinase activity [GO:0047696]; Edg-2 lysophosphatidic acid receptor binding [GO:0031755]; G protein-coupled receptor binding [GO:0001664]; G protein-coupled receptor kinase activity [GO:0004703]; protein kinase activity [GO:0004672],,CHEMBL4079;
