OPRM1,P20292,Arachidonate 5-lipoxygenase-activating protein (FLAP) (MK-886-binding protein),FLAP,"FUNCTION: Required for leukotriene biosynthesis by ALOX5 (5-lipoxygenase). Anchors ALOX5 to the membrane. Binds arachidonic acid, and could play an essential role in the transfer of arachidonic acid to ALOX5. Binds to MK-886, a compound that blocks the biosynthesis of leukotrienes. {ECO:0000269|PubMed:2300173, ECO:0000269|PubMed:8440384}.",,,arachidonate 5-lipoxygenase activity [GO:0004051]; arachidonate binding [GO:0050544]; enzyme activator activity [GO:0008047]; enzyme binding [GO:0019899]; glutathione peroxidase activity [GO:0004602]; glutathione transferase activity [GO:0004364]; identical protein binding [GO:0042802]; leukotriene-C4 synthase activity [GO:0004464]; protein-containing complex binding [GO:0044877],"DISEASE: Ischemic stroke (ISCHSTR) [MIM:601367]: A stroke is an acute neurologic event leading to death of neural tissue of the brain and resulting in loss of motor, sensory and/or cognitive function. Ischemic strokes, resulting from vascular occlusion, is considered to be a highly complex disease consisting of a group of heterogeneous disorders with multiple genetic and environmental risk factors. Note=Disease susceptibility is associated with variants affecting the gene represented in this entry.; DISEASE: Note=Genetic variations in ALOX5AP may be associated with susceptibility to myocardial infarction. Involvement in myocardial infarction is however unclear: according to some authors (PubMed:14770184), a 4-SNP haplotype in ALOX5AP confers risk of myocardial infarction, while according to other (PubMed:17304054) ALOX5AP is not implicated in this condition. {ECO:0000269|PubMed:14770184, ECO:0000269|PubMed:17304054}.",CHEMBL4550;
OPRM1,O15342,V-type proton ATPase subunit e 1 (V-ATPase subunit e 1) (V-ATPase 9.2 kDa membrane accessory protein) (V-ATPase M9.2 subunit) (Vacuolar proton pump subunit e 1),ATP6H ATP6V0E,"FUNCTION: Subunit of the V0 complex of vacuolar(H+)-ATPase (V-ATPase), a multisubunit enzyme composed of a peripheral complex (V1) that hydrolyzes ATP and a membrane integral complex (V0) that translocates protons (PubMed:33065002). V-ATPase is responsible for acidifying and maintaining the pH of intracellular compartments and in some cell types, is targeted to the plasma membrane, where it is responsible for acidifying the extracellular environment (By similarity). {ECO:0000250|UniProtKB:Q2KIB5, ECO:0000269|PubMed:33065002}.",,,"ATPase-coupled ion transmembrane transporter activity [GO:0042625]; proton-transporting ATPase activity, rotational mechanism [GO:0046961]",,
OPRM1,O95406,Protein cornichon homolog 1 (CNIH-1) (Cornichon family AMPA receptor auxiliary protein 1) (Protein cornichon homolog) (T-cell growth-associated molecule 77) (TGAM77),CNIH CNIL,FUNCTION: Involved in the selective transport and maturation of TGF-alpha family proteins. {ECO:0000269|PubMed:17607000}.,,,signaling receptor binding [GO:0005102],,
OPRM1,Q0VAQ4,Small cell adhesion glycoprotein (Small transmembrane and glycosylated protein),,FUNCTION: May play a role in epithelial cell-cell contacts. May play a role in tumor invasiveness and metastasis formation. {ECO:0000269|PubMed:15986429}.,,,,,
OPRM1,Q8IX05,CD302 antigen (C-type lectin BIMLEC) (C-type lectin domain family 13 member A) (DEC205-associated C-type lectin 1) (Type I transmembrane C-type lectin receptor DCL-1) (CD antigen CD302),CLEC13A DCL1 KIAA0022,FUNCTION: Potential multifunctional C-type lectin receptor that may play roles in endocytosis and phagocytosis as well as in cell adhesion and migration. {ECO:0000269|PubMed:17947679}.,,,carbohydrate binding [GO:0030246]; signaling receptor activity [GO:0038023],,
OPRM1,Q15942,Zyxin (Zyxin-2),,FUNCTION: Adhesion plaque protein. Binds alpha-actinin and the CRP protein. Important for targeting TES and ENA/VASP family members to focal adhesions and for the formation of actin-rich structures. May be a component of a signal transduction pathway that mediates adhesion-stimulated changes in gene expression (By similarity). {ECO:0000250}.,,,metal ion binding [GO:0046872]; RNA binding [GO:0003723],,CHEMBL4295832;
OPRM1,Q2HXU8,C-type lectin domain family 12 member B (Macrophage antigen H),,"FUNCTION: Inhibitory receptor postulated to negatively regulate immune and non-immune functions (PubMed:17562706, PubMed:34310951). Upon phosphorylation, recruits SH2 domain-containing PTPN6 and PTPN11 phosphatases to its ITIM motif and antagonizes activation signals (PubMed:17562706, PubMed:34310951). Although it inhibits KLRK1/NKG2D-mediated signaling, it does not bind known ligands of KLRK1/NKG2D and therefore is not its inhibitory counterpart (PubMed:17562706). May limit activation of myeloid cell subsets in response to infection or tissue inflammation (PubMed:17562706). May protect target cells against natural killer cell-mediated lysis (PubMed:17562706). May negatively regulate cell cycle and differentiation of melanocytes via inactivation of STAT3 (PubMed:34310951). {ECO:0000269|PubMed:17562706, ECO:0000269|PubMed:34310951}.",,,carbohydrate binding [GO:0030246]; protein phosphatase binding [GO:0019903]; signaling receptor inhibitor activity [GO:0030547],,
OPRM1,Q8N6R1,Stress-associated endoplasmic reticulum protein 2 (Ribosome-associated membrane protein RAMP4-2),C13orf21,FUNCTION: Interacts with target proteins during their translocation into the lumen of the endoplasmic reticulum. Protects unfolded target proteins against degradation during ER stress. May facilitate glycosylation of target proteins after termination of ER stress. May modulate the use of N-glycosylation sites on target proteins. {ECO:0000250|UniProtKB:Q9R2C1}.,,,,,
OPRM1,Q4LDR2,Cortexin-3 (Kidney and brain-expressed protein),KABE,,,,,,
OPRM1,Q9H3P2,Negative elongation factor A (NELF-A) (Wolf-Hirschhorn syndrome candidate 2 protein),WHSC2,"FUNCTION: Essential component of the NELF complex, a complex that negatively regulates the elongation of transcription by RNA polymerase II. The NELF complex, which acts via an association with the DSIF complex and causes transcriptional pausing, is counteracted by the P-TEFb kinase complex. {ECO:0000269|PubMed:10199401, ECO:0000269|PubMed:12563561, ECO:0000269|PubMed:12612062}.; FUNCTION: (Microbial infection) The NELF complex is involved in HIV-1 latency possibly involving recruitment of PCF11 to paused RNA polymerase II. {ECO:0000269|PubMed:23884411}.",,,chromatin binding [GO:0003682]; molecular adaptor activity [GO:0060090],,
OPRM1,Q8N386,Leucine-rich repeat-containing protein 25 (Monocyte and plasmacytoid-activated protein),MAPA,"FUNCTION: Plays a role in the inhibition of RLR-mediated type I interferon signaling pathway by targeting RIGI for autophagic degradation. Interacts specifically with ISG15-associated RIGI to promote interaction between RIGI and the autophagic cargo receptor p62/SQSTM1 to mediate RIGI degradation via selective autophagy (PubMed:29288164). Also plays a role in the inhibition of NF-kappa-B signaling pathway and inflammatory response by promoting the degradation of p65/RELA. {ECO:0000269|PubMed:12384430, ECO:0000269|PubMed:29044191, ECO:0000269|PubMed:29288164}.",,,,,
OPRM1,P54852,Epithelial membrane protein 3 (EMP-3) (Hematopoietic neural membrane protein 1) (HNMP-1) (Protein YMP),YMP,FUNCTION: Probably involved in cell proliferation and cell-cell interactions.,,,,,
SRY,Q05066,Sex-determining region Y protein (Testis-determining factor),TDF,"FUNCTION: Transcriptional regulator that controls a genetic switch in male development (PubMed:11563911). It is necessary and sufficient for initiating male sex determination by directing the development of supporting cell precursors (pre-Sertoli cells) as Sertoli rather than granulosa cells (PubMed:16414182, PubMed:16996051). Involved in different aspects of gene regulation including promoter activation or repression (PubMed:9525897). Binds to the DNA consensus sequence 5'-[AT]AACAA[AT]-3' (PubMed:11563911, PubMed:1425584, PubMed:15170344, PubMed:8159753, PubMed:8265659). SRY HMG box recognizes DNA by partial intercalation in the minor groove and promotes DNA bending (PubMed:11563911, PubMed:1425584, PubMed:15170344, PubMed:16762365, PubMed:8159753, PubMed:8265659). Also involved in pre-mRNA splicing (PubMed:11818535). In male adult brain involved in the maintenance of motor functions of dopaminergic neurons (By similarity). {ECO:0000250|UniProtKB:P36394, ECO:0000269|PubMed:11563911, ECO:0000269|PubMed:11818535, ECO:0000269|PubMed:1425584, ECO:0000269|PubMed:15170344, ECO:0000269|PubMed:16762365, ECO:0000269|PubMed:8159753, ECO:0000269|PubMed:8265659, ECO:0000269|PubMed:9525897, ECO:0000303|PubMed:16414182, ECO:0000303|PubMed:16996051}.",,,"calmodulin binding [GO:0005516]; DNA binding [GO:0003677]; DNA-binding transcription activator activity, RNA polymerase II-specific [GO:0001228]; DNA-binding transcription factor activity, RNA polymerase II-specific [GO:0000981]; DNA-binding transcription factor binding [GO:0140297]; RNA polymerase II cis-regulatory region sequence-specific DNA binding [GO:0000978]","DISEASE: 46,XY sex reversal 1 (SRXY1) [MIM:400044]: A condition characterized by male-to-female sex reversal in the presence of a normal 46,XY karyotype. Patients manifest rapid and early degeneration of their gonads, which are present in the adult as 'streak gonads', consisting mainly of fibrous tissue and variable amounts of ovarian stroma. As a result these patients do not develop secondary sexual characteristics at puberty. The external genitalia in these subjects are completely female, and Muellerian structures are normal. {ECO:0000269|PubMed:10670762, ECO:0000269|PubMed:10721678, ECO:0000269|PubMed:10843173, ECO:0000269|PubMed:10852465, ECO:0000269|PubMed:11563911, ECO:0000269|PubMed:12107262, ECO:0000269|PubMed:12793612, ECO:0000269|PubMed:1339396, ECO:0000269|PubMed:1415266, ECO:0000269|PubMed:1483689, ECO:0000269|PubMed:1570829, ECO:0000269|PubMed:16762365, ECO:0000269|PubMed:17063144, ECO:0000269|PubMed:2247149, ECO:0000269|PubMed:28030592, ECO:0000269|PubMed:7717397, ECO:0000269|PubMed:7776083, ECO:0000269|PubMed:7985018, ECO:0000269|PubMed:8019555, ECO:0000269|PubMed:8105086, ECO:0000269|PubMed:8353496, ECO:0000269|PubMed:8447323, ECO:0000269|PubMed:9450909, ECO:0000269|PubMed:9521592, ECO:0000269|PubMed:9678356, ECO:0000269|Ref.42, ECO:0000269|Ref.48}. Note=The disease is caused by variants affecting the gene represented in this entry.; DISEASE: Note=A 45,X chromosomal aberration involving SRY is found in Turner syndrome, a disease characterized by gonadal dysgenesis with short stature, 'streak gonads', variable abnormalities such as webbing of the neck, cubitus valgus, cardiac defects, low posterior hair line. The phenotype is female. {ECO:0000269|PubMed:10843173}.; DISEASE: 46,XX sex reversal 1 (SRXX1) [MIM:400045]: A condition in which male gonads develop in a genetic female (female to male sex reversal). {ECO:0000269|PubMed:10602113, ECO:0000269|PubMed:9652903}. Note=The disease is caused by variants affecting the gene represented in this entry.",
SRY,Q15599,Na(+)/H(+) exchange regulatory cofactor NHE-RF2 (NHERF-2) (NHE3 kinase A regulatory protein E3KARP) (SRY-interacting protein 1) (SIP-1) (Sodium-hydrogen exchanger regulatory factor 2) (Solute carrier family 9 isoform A3 regulatory factor 2) (Tyrosine kinase activator protein 1) (TKA-1),SLC9A3R2,"FUNCTION: Scaffold protein that connects plasma membrane proteins with members of the ezrin/moesin/radixin family and thereby helps to link them to the actin cytoskeleton and to regulate their surface expression. Necessary for cAMP-mediated phosphorylation and inhibition of SLC9A3 (PubMed:18829453). May also act as scaffold protein in the nucleus. {ECO:0000269|PubMed:10455146, ECO:0000269|PubMed:18829453, ECO:0000269|PubMed:9096337}.",,,beta-catenin binding [GO:0008013]; cadherin binding [GO:0045296]; identical protein binding [GO:0042802]; phosphatase binding [GO:0019902]; protein-membrane adaptor activity [GO:0043495]; signaling receptor binding [GO:0005102]; type 2 metabotropic glutamate receptor binding [GO:0031799]; type 3 metabotropic glutamate receptor binding [GO:0031800],,CHEMBL4739686;
SRY,O60248,Transcription factor SOX-15 (Protein SOX-12) (Protein SOX-20) (SRY-box transcription factor 15),SOX12 SOX20 SOX26 SOX27,"FUNCTION: Transcription factor that binds to DNA at the 5'-AACAATG-3' consensus sequence (By similarity). Acts as a transcriptional activator and repressor (By similarity). Binds synergistically with POU5F1 (OCT3/4) to gene promoters (By similarity). Binds to the FOXK1 promoter and recruits FHL3, resulting in transcriptional activation of FOXK1 which leads to myoblast proliferation (By similarity). Acts as an inhibitor of myoblast differentiation via transcriptional repression which leads to down-regulation of the muscle-specific genes MYOD and MYOG (By similarity). Involved in trophoblast giant cell differentiation via enhancement of HAND1 transcriptional activity (By similarity). Regulates transcription of HRC via binding to it proximal enhancer region (By similarity). Involved in skeletal muscle regeneration (By similarity). Also plays a role in the development of myogenic precursor cells (By similarity). {ECO:0000250|UniProtKB:P43267}.",,,"chromatin binding [GO:0003682]; DNA binding [GO:0003677]; DNA-binding transcription activator activity, RNA polymerase II-specific [GO:0001228]; DNA-binding transcription factor activity [GO:0003700]; DNA-binding transcription factor activity, RNA polymerase II-specific [GO:0000981]; RNA polymerase II cis-regulatory region sequence-specific DNA binding [GO:0000978]",,
SRY,Q9UN79,Transcription factor SOX-13 (Islet cell antigen 12) (SRY (Sex determining region Y)-box 13) (Type 1 diabetes autoantigen ICA12),,"FUNCTION: Transcription factor that binds to DNA at the consensus sequence 5'-AACAAT-3' (PubMed:10871192). Binds to the proximal promoter region of the myelin protein MPZ gene, and may thereby be involved in the differentiation of oligodendroglia in the developing spinal tube (By similarity). Binds to the gene promoter of MBP and acts as a transcriptional repressor (By similarity). Binds to and modifies the activity of TCF7/TCF1, thereby inhibiting transcription and modulates normal gamma-delta T-cell development and differentiation of IL17A expressing gamma-delta T-cells (By similarity). Regulates expression of BLK in the differentiation of IL17A expressing gamma-delta T-cells (By similarity). Promotes brown adipocyte differentiation (By similarity). Inhibitor of WNT signaling (PubMed:20028982). {ECO:0000250|UniProtKB:Q04891, ECO:0000269|PubMed:10871192, ECO:0000269|PubMed:20028982}.",,,"DNA binding [GO:0003677]; DNA-binding transcription factor activity [GO:0003700]; DNA-binding transcription factor activity, RNA polymerase II-specific [GO:0000981]; DNA-binding transcription repressor activity [GO:0001217]; DNA-binding transcription repressor activity, RNA polymerase II-specific [GO:0001227]; identical protein binding [GO:0042802]; RNA polymerase II cis-regulatory region sequence-specific DNA binding [GO:0000978]; sequence-specific DNA binding [GO:0043565]; transcription cis-regulatory region binding [GO:0000976]",DISEASE: Note=Autoantibodies against SOX13 are present in sera from patients with type 1 diabetes. {ECO:0000269|PubMed:10871192}.,
