MAPK3,P00533,Epidermal growth factor receptor (EC 2.7.10.1) (Proto-oncogene c-ErbB-1) (Receptor tyrosine-protein kinase erbB-1),ERBB ERBB1 HER1,"FUNCTION: Receptor tyrosine kinase binding ligands of the EGF family and activating several signaling cascades to convert extracellular cues into appropriate cellular responses (PubMed:10805725, PubMed:27153536, PubMed:2790960, PubMed:35538033). Known ligands include EGF, TGFA/TGF-alpha, AREG, epigen/EPGN, BTC/betacellulin, epiregulin/EREG and HBEGF/heparin-binding EGF (PubMed:12297049, PubMed:15611079, PubMed:17909029, PubMed:20837704, PubMed:27153536, PubMed:2790960, PubMed:7679104, PubMed:8144591, PubMed:9419975). Ligand binding triggers receptor homo- and/or heterodimerization and autophosphorylation on key cytoplasmic residues. The phosphorylated receptor recruits adapter proteins like GRB2 which in turn activates complex downstream signaling cascades. Activates at least 4 major downstream signaling cascades including the RAS-RAF-MEK-ERK, PI3 kinase-AKT, PLCgamma-PKC and STATs modules (PubMed:27153536). May also activate the NF-kappa-B signaling cascade (PubMed:11116146). Also directly phosphorylates other proteins like RGS16, activating its GTPase activity and probably coupling the EGF receptor signaling to the G protein-coupled receptor signaling (PubMed:11602604). Also phosphorylates MUC1 and increases its interaction with SRC and CTNNB1/beta-catenin (PubMed:11483589). Positively regulates cell migration via interaction with CCDC88A/GIV which retains EGFR at the cell membrane following ligand stimulation, promoting EGFR signaling which triggers cell migration (PubMed:20462955). Plays a role in enhancing learning and memory performance (By similarity). Plays a role in mammalian pain signaling (long-lasting hypersensitivity) (By similarity). {ECO:0000250|UniProtKB:Q01279, ECO:0000269|PubMed:10805725, ECO:0000269|PubMed:11116146, ECO:0000269|PubMed:11483589, ECO:0000269|PubMed:11602604, ECO:0000269|PubMed:12297049, ECO:0000269|PubMed:12297050, ECO:0000269|PubMed:12620237, ECO:0000269|PubMed:12873986, ECO:0000269|PubMed:15374980, ECO:0000269|PubMed:15590694, ECO:0000269|PubMed:15611079, ECO:0000269|PubMed:17115032, ECO:0000269|PubMed:17909029, ECO:0000269|PubMed:19560417, ECO:0000269|PubMed:20462955, ECO:0000269|PubMed:20837704, ECO:0000269|PubMed:21258366, ECO:0000269|PubMed:27153536, ECO:0000269|PubMed:2790960, ECO:0000269|PubMed:35538033, ECO:0000269|PubMed:7679104, ECO:0000269|PubMed:8144591, ECO:0000269|PubMed:9419975}.; FUNCTION: Isoform 2 may act as an antagonist of EGF action.; FUNCTION: (Microbial infection) Acts as a receptor for hepatitis C virus (HCV) in hepatocytes and facilitates its cell entry. Mediates HCV entry by promoting the formation of the CD81-CLDN1 receptor complexes that are essential for HCV entry and by enhancing membrane fusion of cells expressing HCV envelope glycoproteins. {ECO:0000269|PubMed:21516087}.","ACT_SITE 837; /note=""Proton acceptor""; /evidence=""ECO:0000255|PROSITE-ProRule:PRU00159, ECO:0000255|PROSITE-ProRule:PRU10028""",,actin filament binding [GO:0051015]; ATP binding [GO:0005524]; ATPase binding [GO:0051117]; boss receptor activity [GO:0008288]; brain-derived neurotrophic factor receptor activity [GO:0060175]; cadherin binding [GO:0045296]; calmodulin binding [GO:0005516]; chromatin binding [GO:0003682]; double-stranded DNA binding [GO:0003690]; enzyme binding [GO:0019899]; epidermal growth factor binding [GO:0048408]; epidermal growth factor receptor activity [GO:0005006]; fibroblast growth factor receptor activity [GO:0005007]; GPI-linked ephrin receptor activity [GO:0005004]; hepatocyte growth factor receptor activity [GO:0005008]; histone H2AXY142 kinase activity [GO:0140801]; histone H3Y41 kinase activity [GO:0035401]; identical protein binding [GO:0042802]; insulin receptor activity [GO:0005009]; insulin-like growth factor receptor activity [GO:0005010]; integrin binding [GO:0005178]; kinase binding [GO:0019900]; macrophage colony-stimulating factor receptor activity [GO:0005011]; MAP kinase kinase kinase activity [GO:0004709]; placental growth factor receptor activity [GO:0036332]; platelet-derived growth factor alpha-receptor activity [GO:0005018]; platelet-derived growth factor beta-receptor activity [GO:0005019]; protein kinase binding [GO:0019901]; protein phosphatase binding [GO:0019903]; protein tyrosine kinase activator activity [GO:0030296]; protein tyrosine kinase activity [GO:0004713]; protein tyrosine kinase collagen receptor activity [GO:0038062]; stem cell factor receptor activity [GO:0005020]; transmembrane receptor protein tyrosine kinase activity [GO:0004714]; transmembrane signaling receptor activity [GO:0004888]; transmembrane-ephrin receptor activity [GO:0005005]; ubiquitin protein ligase binding [GO:0031625]; vascular endothelial growth factor receptor activity [GO:0005021]; virus receptor activity [GO:0001618],"DISEASE: Lung cancer (LNCR) [MIM:211980]: A common malignancy affecting tissues of the lung. The most common form of lung cancer is non-small cell lung cancer (NSCLC) that can be divided into 3 major histologic subtypes: squamous cell carcinoma, adenocarcinoma, and large cell lung cancer. NSCLC is often diagnosed at an advanced stage and has a poor prognosis. {ECO:0000269|PubMed:15118125, ECO:0000269|PubMed:16533793, ECO:0000269|PubMed:16672372}. Note=The gene represented in this entry is involved in disease pathogenesis.; DISEASE: Neonatal nephrocutaneous inflammatory syndrome (NNCIS) [MIM:616069]: An autosomal recessive disorder characterized by intrauterine growth retardation, premature birth, fragile skin, recurrent skin infections and sepsis, failure to thrive, nephrocalcinosis, and nephromegaly with tubular dysfunction. Some patients have chronic diarrhea, and necrotizing enterocolitis. {ECO:0000269|PubMed:24691054}. Note=The disease is caused by variants affecting the gene represented in this entry.",CHEMBL203;
MAPK3,O75676,Ribosomal protein S6 kinase alpha-4 (S6K-alpha-4) (EC 2.7.11.1) (90 kDa ribosomal protein S6 kinase 4) (Nuclear mitogen- and stress-activated protein kinase 2) (Ribosomal protein kinase B) (RSKB),MSK2,"FUNCTION: Serine/threonine-protein kinase that is required for the mitogen or stress-induced phosphorylation of the transcription factors CREB1 and ATF1 and for the regulation of the transcription factor RELA, and that contributes to gene activation by histone phosphorylation and functions in the regulation of inflammatory genes. Phosphorylates CREB1 and ATF1 in response to mitogenic or stress stimuli such as UV-C irradiation, epidermal growth factor (EGF) and anisomycin. Plays an essential role in the control of RELA transcriptional activity in response to TNF. Phosphorylates 'Ser-10' of histone H3 in response to mitogenics, stress stimuli and EGF, which results in the transcriptional activation of several immediate early genes, including proto-oncogenes c-fos/FOS and c-jun/JUN. May also phosphorylate 'Ser-28' of histone H3. Mediates the mitogen- and stress-induced phosphorylation of high mobility group protein 1 (HMGN1/HMG14). In lipopolysaccharide-stimulated primary macrophages, acts downstream of the Toll-like receptor TLR4 to limit the production of pro-inflammatory cytokines. Functions probably by inducing transcription of the MAP kinase phosphatase DUSP1 and the anti-inflammatory cytokine interleukin 10 (IL10), via CREB1 and ATF1 transcription factors. {ECO:0000269|PubMed:11035004, ECO:0000269|PubMed:12773393, ECO:0000269|PubMed:9792677}.","ACT_SITE 161; /note=""Proton acceptor""; /evidence=""ECO:0000250""; ACT_SITE 530; /note=""Proton acceptor""; /evidence=""ECO:0000250""",,3-phosphoinositide-dependent protein kinase activity [GO:0004676]; AMP-activated protein kinase activity [GO:0004679]; ATP binding [GO:0005524]; DNA-dependent protein kinase activity [GO:0004677]; eukaryotic translation initiation factor 2alpha kinase activity [GO:0004694]; histone H2AS1 kinase activity [GO:0044024]; histone H2AS121 kinase activity [GO:0072371]; histone H2AT120 kinase activity [GO:1990244]; histone H2AXS139 kinase activity [GO:0035979]; histone H2BS14 kinase activity [GO:0044025]; histone H2BS36 kinase activity [GO:0140823]; histone H3S10 kinase activity [GO:0035175]; histone H3S28 kinase activity [GO:0044022]; histone H3S57 kinase activity [GO:0140855]; histone H3T11 kinase activity [GO:0035402]; histone H3T3 kinase activity [GO:0072354]; histone H3T45 kinase activity [GO:0140857]; histone H3T6 kinase activity [GO:0035403]; histone H4S1 kinase activity [GO:0044023]; magnesium ion binding [GO:0000287]; protein serine kinase activity [GO:0106310]; protein serine/threonine kinase activity [GO:0004674]; Rho-dependent protein serine/threonine kinase activity [GO:0072518]; ribosomal protein S6 kinase activity [GO:0004711],,CHEMBL3125;
MAPK3,P35236,Tyrosine-protein phosphatase non-receptor type 7 (EC 3.1.3.48) (Hematopoietic protein-tyrosine phosphatase) (HEPTP) (Protein-tyrosine phosphatase LC-PTP),,"FUNCTION: Protein phosphatase that acts preferentially on tyrosine-phosphorylated MAPK1. Plays a role in the regulation of T and B-lymphocyte development and signal transduction. {ECO:0000269|PubMed:10206983, ECO:0000269|PubMed:10559944, ECO:0000269|PubMed:10702794, ECO:0000269|PubMed:1510684, ECO:0000269|PubMed:1530918, ECO:0000269|PubMed:9624114}.","ACT_SITE 291; /note=""Phosphocysteine intermediate""; /evidence=""ECO:0000255|PROSITE-ProRule:PRU00160, ECO:0000255|PROSITE-ProRule:PRU10044, ECO:0000269|PubMed:9624114""",,"histone H2AXY142 phosphatase activity [GO:0140793]; non-membrane spanning protein tyrosine phosphatase activity [GO:0004726]; protein tyrosine phosphatase activity [GO:0004725]; protein tyrosine phosphatase activity, metal-dependent [GO:0030946]",,CHEMBL2219;
MAPK3,Q9NXV6,CDKN2A-interacting protein (Collaborator of ARF),CARF,"FUNCTION: Regulates DNA damage response in a dose-dependent manner through a number of signaling pathways involved in cell proliferation, apoptosis and senescence. {ECO:0000269|PubMed:15109303, ECO:0000269|PubMed:24825908}.",,,p53 binding [GO:0002039]; RNA binding [GO:0003723],,
MAPK3,Q9UK32,Ribosomal protein S6 kinase alpha-6 (S6K-alpha-6) (EC 2.7.11.1) (90 kDa ribosomal protein S6 kinase 6) (p90-RSK 6) (p90RSK6) (Ribosomal S6 kinase 4) (RSK-4) (pp90RSK4),RSK4,"FUNCTION: Constitutively active serine/threonine-protein kinase that exhibits growth-factor-independent kinase activity and that may participate in p53/TP53-dependent cell growth arrest signaling and play an inhibitory role during embryogenesis. {ECO:0000269|PubMed:15042092, ECO:0000269|PubMed:15632195}.","ACT_SITE 198; /note=""Proton acceptor""; /evidence=""ECO:0000250""; ACT_SITE 543; /note=""Proton acceptor""; /evidence=""ECO:0000250""",,3-phosphoinositide-dependent protein kinase activity [GO:0004676]; AMP-activated protein kinase activity [GO:0004679]; ATP binding [GO:0005524]; DNA-dependent protein kinase activity [GO:0004677]; eukaryotic translation initiation factor 2alpha kinase activity [GO:0004694]; histone H2AS1 kinase activity [GO:0044024]; histone H2AS121 kinase activity [GO:0072371]; histone H2AT120 kinase activity [GO:1990244]; histone H2AXS139 kinase activity [GO:0035979]; histone H2BS14 kinase activity [GO:0044025]; histone H2BS36 kinase activity [GO:0140823]; histone H3S10 kinase activity [GO:0035175]; histone H3S28 kinase activity [GO:0044022]; histone H3S57 kinase activity [GO:0140855]; histone H3T11 kinase activity [GO:0035402]; histone H3T3 kinase activity [GO:0072354]; histone H3T45 kinase activity [GO:0140857]; histone H3T6 kinase activity [GO:0035403]; histone H4S1 kinase activity [GO:0044023]; magnesium ion binding [GO:0000287]; protein kinase activity [GO:0004672]; protein serine kinase activity [GO:0106310]; Rho-dependent protein serine/threonine kinase activity [GO:0072518]; ribosomal protein S6 kinase activity [GO:0004711],,CHEMBL4924;
MAPK3,H0YDH9,mitogen-activated protein kinase (EC 2.7.11.24),,,,,ATP binding [GO:0005524]; MAP kinase activity [GO:0004707],,
MAPK3,Q14449,Growth factor receptor-bound protein 14 (GRB14 adapter protein),,"FUNCTION: Adapter protein which modulates coupling of cell surface receptor kinases with specific signaling pathways. Binds to, and suppresses signals from, the activated insulin receptor (INSR). Potent inhibitor of insulin-stimulated MAPK3 phosphorylation. Plays a critical role regulating PDPK1 membrane translocation in response to insulin stimulation and serves as an adapter protein to recruit PDPK1 to activated insulin receptor, thus promoting PKB/AKT1 phosphorylation and transduction of the insulin signal. {ECO:0000269|PubMed:15210700, ECO:0000269|PubMed:19648926}.",,,molecular adaptor activity [GO:0060090]; protein-macromolecule adaptor activity [GO:0030674]; receptor tyrosine kinase binding [GO:0030971],,
MAPK3,E9PRH7,mitogen-activated protein kinase (EC 2.7.11.24),,,,,ATP binding [GO:0005524]; MAP kinase activity [GO:0004707],,
MAPK3,Q6Q0C0,E3 ubiquitin-protein ligase TRAF7 (EC 2.3.2.-) (EC 2.3.2.27) (RING finger and WD repeat-containing protein 1) (RING finger protein 119) (RING-type E3 ubiquitin transferase TRAF7) (TNF receptor-associated factor 7),RFWD1 RNF119,"FUNCTION: E3 ubiquitin and SUMO-protein ligase that plays a role in different biological processes such as innate immunity, inflammation or apoptosis (PubMed:15001576, PubMed:37086853). Potentiates MAP3K3-mediated activation of JUN/AP1 and DDIT3 transcriptional regulators (PubMed:14743216). Negatively regulates MYB transcriptional activity by sequestering it to the cytosol via SUMOylation (By similarity). Plays a role in the phosphorylation of MAPK1 and/or MAPK3, probably via its interaction with MAP3K3. Negatively regulates RLR-mediated innate immunity by promoting 'Lys-48'-linked ubiquitination of TBK1 through its RING domain to inhibit the cellular antiviral response (PubMed:37086853). Promotes 'Lys-29'-linked polyubiquitination of NEMO/IKBKG and RELA leading to targeting these two proteins to lysosomal degradative pathways, reducing the transcriptional activity of NF-kappa-B (PubMed:21518757). {ECO:0000250|UniProtKB:Q922B6, ECO:0000269|PubMed:14743216, ECO:0000269|PubMed:15001576, ECO:0000269|PubMed:21518757, ECO:0000269|PubMed:29961569, ECO:0000269|PubMed:37086853}.",,PATHWAY: Protein modification; protein ubiquitination.,ubiquitin protein ligase activity [GO:0061630]; ubiquitin-protein transferase activity [GO:0004842]; zinc ion binding [GO:0008270],"DISEASE: Cardiac, facial, and digital anomalies with developmental delay (CAFDADD) [MIM:618164]: An autosomal dominant disorder characterized by delayed motor and speech development, developmental regression, congenital heart defects, limb and digital anomalies, and dysmorphic features. Cardiac features include pulmonary stenosis, patent ductus arteriosus, aortic coarctation, valvular defects, hypoplastic left heart, double outlet right ventricle, and conduction abnormalities. Dysmorphic facial features include multiple hair whorls or hairline abnormalities, ptosis, epicanthal folds, and low-set or dysplastic ears. {ECO:0000269|PubMed:29961569}. Note=The disease is caused by variants affecting the gene represented in this entry.",
MAPK3,P78543,Protein BTG2 (BTG family member 2) (NGF-inducible anti-proliferative protein PC3),PC3,"FUNCTION: Anti-proliferative protein; the function is mediated by association with deadenylase subunits of the CCR4-NOT complex. Activates mRNA deadenylation in a CNOT6 and CNOT7-dependent manner. In vitro can inhibit deadenylase activity of CNOT7 and CNOT8. Involved in cell cycle regulation. Could be involved in the growth arrest and differentiation of the neuronal precursors (By similarity). Modulates transcription regulation mediated by ESR1. Involved in mitochondrial depolarization and neurite outgrowth. {ECO:0000250, ECO:0000269|PubMed:12771185, ECO:0000269|PubMed:15788397, ECO:0000269|PubMed:18337750, ECO:0000269|PubMed:18773938, ECO:0000269|PubMed:23236473}.",,,transcription corepressor activity [GO:0003714],,
MAPK3,Q15349,Ribosomal protein S6 kinase alpha-2 (S6K-alpha-2) (EC 2.7.11.1) (90 kDa ribosomal protein S6 kinase 2) (p90-RSK 2) (p90RSK2) (MAP kinase-activated protein kinase 1c) (MAPK-activated protein kinase 1c) (MAPKAP kinase 1c) (MAPKAPK-1c) (Ribosomal S6 kinase 3) (RSK-3) (pp90RSK3),MAPKAPK1C RSK3,"FUNCTION: Serine/threonine-protein kinase that acts downstream of ERK (MAPK1/ERK2 and MAPK3/ERK1) signaling and mediates mitogenic and stress-induced activation of transcription factors, regulates translation, and mediates cellular proliferation, survival, and differentiation. May function as tumor suppressor in epithelial ovarian cancer cells. {ECO:0000269|PubMed:16878154, ECO:0000269|PubMed:7623830}.","ACT_SITE 184; /note=""Proton acceptor""; /evidence=""ECO:0000250""; ACT_SITE 532; /note=""Proton acceptor""; /evidence=""ECO:0000250""",,3-phosphoinositide-dependent protein kinase activity [GO:0004676]; AMP-activated protein kinase activity [GO:0004679]; ATP binding [GO:0005524]; DNA-dependent protein kinase activity [GO:0004677]; eukaryotic translation initiation factor 2alpha kinase activity [GO:0004694]; histone H2AS1 kinase activity [GO:0044024]; histone H2AS121 kinase activity [GO:0072371]; histone H2AT120 kinase activity [GO:1990244]; histone H2AXS139 kinase activity [GO:0035979]; histone H2BS14 kinase activity [GO:0044025]; histone H2BS36 kinase activity [GO:0140823]; histone H3S10 kinase activity [GO:0035175]; histone H3S28 kinase activity [GO:0044022]; histone H3S57 kinase activity [GO:0140855]; histone H3T11 kinase activity [GO:0035402]; histone H3T3 kinase activity [GO:0072354]; histone H3T45 kinase activity [GO:0140857]; histone H3T6 kinase activity [GO:0035403]; histone H4S1 kinase activity [GO:0044023]; magnesium ion binding [GO:0000287]; protein serine kinase activity [GO:0106310]; protein serine/threonine kinase activity [GO:0004674]; protein serine/threonine/tyrosine kinase activity [GO:0004712]; Rho-dependent protein serine/threonine kinase activity [GO:0072518]; ribosomal protein S6 kinase activity [GO:0004711],,CHEMBL3906;
MAPK3,P28562,Dual specificity protein phosphatase 1 (EC 3.1.3.16) (EC 3.1.3.48) (Dual specificity protein phosphatase hVH1) (Mitogen-activated protein kinase phosphatase 1) (MAP kinase phosphatase 1) (MKP-1) (Protein-tyrosine phosphatase CL100),CL100 MKP1 PTPN10 VH1,"FUNCTION: Dual specificity phosphatase that dephosphorylates MAP kinase MAPK1/ERK2 on both 'Thr-183' and 'Tyr-185', regulating its activity during the meiotic cell cycle. {ECO:0000250|UniProtKB:P28563}.","ACT_SITE 258; /note=""Phosphocysteine intermediate""; /evidence=""ECO:0000255|PROSITE-ProRule:PRU00160""",,"calmodulin-dependent protein phosphatase activity [GO:0033192]; histone H2AXS140 phosphatase activity [GO:0140791]; histone H2AXY142 phosphatase activity [GO:0140793]; MAP kinase serine/threonine phosphatase activity [GO:1990439]; MAP kinase tyrosine phosphatase activity [GO:0033550]; MAP kinase tyrosine/serine/threonine phosphatase activity [GO:0017017]; mitogen-activated protein kinase binding [GO:0051019]; myosin phosphatase activity [GO:0017018]; non-membrane spanning protein tyrosine phosphatase activity [GO:0004726]; protein serine/threonine phosphatase activity [GO:0004722]; protein tyrosine phosphatase activity [GO:0004725]; protein tyrosine phosphatase activity, metal-dependent [GO:0030946]; protein tyrosine/serine/threonine phosphatase activity [GO:0008138]; protein tyrosine/threonine phosphatase activity [GO:0008330]; RNA polymerase II CTD heptapeptide repeat S2 phosphatase activity [GO:0180006]; RNA polymerase II CTD heptapeptide repeat S5 phosphatase activity [GO:0180007]; RNA polymerase II CTD heptapeptide repeat S7 phosphatase activity [GO:0180008]; RNA polymerase II CTD heptapeptide repeat T4 phosphatase activity [GO:0180005]; RNA polymerase II CTD heptapeptide repeat Y1 phosphatase activity [GO:0180004]",,CHEMBL6026;
MAPK3,Q15121,Astrocytic phosphoprotein PEA-15 (15 kDa phosphoprotein enriched in astrocytes) (Phosphoprotein enriched in diabetes) (PED),,"FUNCTION: Blocks Ras-mediated inhibition of integrin activation and modulates the ERK MAP kinase cascade. Inhibits RPS6KA3 activities by retaining it in the cytoplasm (By similarity). Inhibits both TNFRSF6- and TNFRSF1A-mediated CASP8 activity and apoptosis. Regulates glucose transport by controlling both the content of SLC2A1 glucose transporters on the plasma membrane and the insulin-dependent trafficking of SLC2A4 from the cell interior to the surface. {ECO:0000250, ECO:0000269|PubMed:10442631, ECO:0000269|PubMed:9670003}.",,,,,
MAPK3,Q8WUJ0,Serine/threonine/tyrosine-interacting protein (Inactive tyrosine-protein phosphatase STYX) (Phosphoserine/threonine/tyrosine interaction protein),,"FUNCTION: Catalytically inactive phosphatase (PubMed:23847209). Acts as a nuclear anchor for MAPK1/MAPK3 (ERK1/ERK2) (PubMed:23847209). Modulates cell-fate decisions and cell migration by spatiotemporal regulation of MAPK1/MAPK3 (ERK1/ERK2) (PubMed:23847209). By binding to the F-box of FBXW7, prevents the assembly of FBXW7 into the SCF E3 ubiquitin-protein ligase complex, and thereby inhibits degradation of its substrates (PubMed:28007894). Plays a role in spermatogenesis (By similarity). {ECO:0000250|UniProtKB:Q60969, ECO:0000269|PubMed:23847209, ECO:0000269|PubMed:28007894}.",,,F-box domain binding [GO:1990444]; pseudophosphatase activity [GO:0001691],,
ADRB1,P08588,Beta-1 adrenergic receptor (Beta-1 adrenoreceptor) (Beta-1 adrenoceptor),ADRB1R B1AR,"FUNCTION: Beta-adrenergic receptors mediate the catecholamine-induced activation of adenylate cyclase through the action of G proteins. This receptor binds epinephrine and norepinephrine with approximately equal affinity. Mediates Ras activation through G(s)-alpha- and cAMP-mediated signaling. Involved in the regulation of sleep/wake behaviors (PubMed:31473062). {ECO:0000269|PubMed:12391161, ECO:0000269|PubMed:31473062}.",,,alpha-2A adrenergic receptor binding [GO:0031694]; beta-adrenergic receptor activity [GO:0004939]; beta1-adrenergic receptor activity [GO:0004940]; G protein-coupled neurotransmitter receptor activity involved in regulation of postsynaptic membrane potential [GO:0099579]; PDZ domain binding [GO:0030165]; protein heterodimerization activity [GO:0046982],,CHEMBL213;
ADRB1,Q9HD26,Golgi-associated PDZ and coiled-coil motif-containing protein (CFTR-associated ligand) (Fused in glioblastoma) (PDZ protein interacting specifically with TC10) (PIST),CAL FIG,"FUNCTION: Plays a role in intracellular protein trafficking and degradation (PubMed:11707463, PubMed:14570915, PubMed:15358775). May regulate CFTR chloride currents and acid-induced ASIC3 currents by modulating cell surface expression of both channels (By similarity). May also regulate the intracellular trafficking of the ADR1B receptor (PubMed:15358775). May play a role in autophagy (By similarity). Together with MARCHF2 mediates the ubiquitination and lysosomal degradation of CFTR (PubMed:23818989). Overexpression results in CFTR intracellular retention and lysosomaldegradation in the lysosomes (PubMed:11707463, PubMed:14570915). {ECO:0000250|UniProtKB:Q8BH60, ECO:0000269|PubMed:11707463, ECO:0000269|PubMed:14570915, ECO:0000269|PubMed:15358775, ECO:0000269|PubMed:23818989}.",,,identical protein binding [GO:0042802]; molecular sequestering activity [GO:0140313]; transmembrane transporter binding [GO:0044325],DISEASE: Note=A chromosomal aberration involving GOPC is found in a glioblastoma multiforme sample. An intra-chromosomal deletion del(6)(q21q21) is responsible for the formation of GOPC-ROS1 chimeric protein which has a constitutive receptor tyrosine kinase activity. {ECO:0000269|PubMed:12661006}.,CHEMBL1741218;
