Gene,Entry,Protein names,Gene Names (synonym),Function [CC],Active site,Pathway,Gene Ontology (molecular function),Involvement in disease,ChEMBL
SEMG1,P04279,Semenogelin-1 (Cancer/testis antigen 103) (Semenogelin I) (SGI) [Cleaved into: Alpha-inhibin-92; Alpha-inhibin-31; Seminal basic protein],SEMG,"FUNCTION: Predominant protein in semen. It participates in the formation of a gel matrix entrapping the accessory gland secretions and ejaculated spermatozoa. Fragments of semenogelin and/or fragments of the related proteins may contribute to the activation of progressive sperm movements as the gel-forming proteins are fragmented by KLK3/PSA. {ECO:0000269|PubMed:19889947}.; FUNCTION: Alpha-inhibin-92 and alpha-inhibin-31, derived from the proteolytic degradation of semenogelin, inhibit the secretion of pituitary follicle-stimulating hormone. {ECO:0000269|PubMed:19889947}.",,,zinc ion binding [GO:0008270],,
SEMG1,O95925,Eppin (Cancer/testis antigen 71) (CT71) (Epididymal protease inhibitor) (Protease inhibitor WAP7) (Serine protease inhibitor-like with Kunitz and WAP domains 1) (WAP four-disulfide core domain protein 7),SPINLW1 WAP7 WFDC7,"FUNCTION: Serine protease inhibitor that plays an essential role in male reproduction and fertility. Modulates the hydrolysis of SEMG1 by KLK3/PSA (a serine protease), provides antimicrobial protection for spermatozoa in the ejaculate coagulum, and binds SEMG1 thereby inhibiting sperm motility. {ECO:0000269|PubMed:15229136, ECO:0000269|PubMed:17644992}.",,,serine-type endopeptidase inhibitor activity [GO:0004867],,
SEMG1,P02788,Lactotransferrin (Lactoferrin) (EC 3.4.21.-) (Growth-inhibiting protein 12) (Talalactoferrin) [Cleaved into: Lactoferricin-H (Lfcin-H); Kaliocin-1; Lactoferroxin-A; Lactoferroxin-B; Lactoferroxin-C],GIG12 LF,"FUNCTION: Transferrins are iron binding transport proteins which can bind two Fe(3+) ions in association with the binding of an anion, usually bicarbonate. {ECO:0000269|PubMed:22900286}.; FUNCTION: [Lactotransferrin]: Major iron-binding and multifunctional protein found in exocrine fluids such as breast milk and mucosal secretions (PubMed:11179314, PubMed:12693969, PubMed:14573629, PubMed:1599934, PubMed:3169987, PubMed:6802759). Has antimicrobial activity, which depends on the extracellular cation concentration (PubMed:6802759). Antimicrobial properties include bacteriostasis, which is related to its ability to sequester free iron and thus inhibit microbial growth, as well as direct bactericidal properties leading to the release of lipopolysaccharides from the bacterial outer membrane (PubMed:11179314, PubMed:12693969, PubMed:14573629, PubMed:1599934, PubMed:3169987, PubMed:6802759). Can also prevent bacterial biofilm development in P.aeruginosa infection (PubMed:12037568). Has weak antifungal activity against C.albicans (PubMed:11083624). Has anabolic, differentiating and anti-apoptotic effects on osteoblasts and can also inhibit osteoclastogenesis, possibly playing a role in the regulation of bone growth (PubMed:15166119). Promotes binding of species C adenoviruses to epithelial cells, promoting adenovirus infection (PubMed:17079302). Can inhibit papillomavirus infections (PubMed:17481742). Stimulates the TLR4 signaling pathway leading to NF-kappa-B activation and subsequent pro-inflammatory cytokine production while also interfering with the lipopolysaccharide (LPS)-stimulated TLR4 signaling (PubMed:20345905). Inhibits neutrophil granulocyte migration to sites of apoptosis, when secreted by apoptotic cells (PubMed:19033648). Stimulates VEGFA-mediated endothelial cell migration and proliferation (PubMed:16842782). Binds heparin, chondroitin sulfate and possibly other glycosaminoglycans (GAGs) (PubMed:9359845). Also binds specifically to pneumococcal surface protein A (PspA), the lipid A portion of bacterial lipopolysaccharide (LPS), lysozyme and DNA (PubMed:9359845). {ECO:0000269|PubMed:11083624, ECO:0000269|PubMed:11179314, ECO:0000269|PubMed:12037568, ECO:0000269|PubMed:12693969, ECO:0000269|PubMed:14573629, ECO:0000269|PubMed:15166119, ECO:0000269|PubMed:1599934, ECO:0000269|PubMed:16842782, ECO:0000269|PubMed:17079302, ECO:0000269|PubMed:17481742, ECO:0000269|PubMed:19033648, ECO:0000269|PubMed:20345905, ECO:0000269|PubMed:3169987, ECO:0000269|PubMed:6802759, ECO:0000269|PubMed:9359845}.; FUNCTION: Lactoferricin binds to the bacterial surface and is crucial for the bactericidal functions. Has some antiviral activity against papillomavirus infection (PubMed:17481742). N-terminal region shows strong antifungal activity against C.albicans (PubMed:11083624). Contains two BBXB heparin-binding consensus sequences that appear to form the predominate functional GAG-binding site. {ECO:0000269|PubMed:11083624, ECO:0000269|PubMed:17481742}.; FUNCTION: [Kaliocin-1]: Has antimicrobial activity and is able to permeabilize different ions through liposomal membranes. {ECO:0000269|PubMed:12693969}.; FUNCTION: [Lactoferroxin-A]: Has opioid antagonist activity (PubMed:1369293). Shows preference for mu-receptor (PubMed:1369293). {ECO:0000269|PubMed:1369293}.; FUNCTION: [Lactoferroxin-B]: Has opioid antagonist activity (PubMed:1369293). Shows higher degrees of preference for kappa-receptors than for mu-receptors (PubMed:1369293). {ECO:0000269|PubMed:1369293}.; FUNCTION: [Lactoferroxin-C]: Has opioid antagonist activity (PubMed:1369293). Shows higher degrees of preference for kappa-receptors than for mu-receptors (PubMed:1369293). {ECO:0000269|PubMed:1369293}.; FUNCTION: The lactotransferrin transferrin-like domain 1 functions as a serine protease of the peptidase S60 family that cuts arginine rich regions (PubMed:12535064). This function contributes to the antimicrobial activity (PubMed:12535064). Shows a preferential cleavage at -Arg-Ser-Arg-Arg-|- and -Arg-Arg-Ser-Arg-|-, and of Z-Phe-Arg-|-aminomethylcoumarin sites (PubMed:12535064). {ECO:0000269|PubMed:12535064}.; FUNCTION: [Isoform DeltaLf]: Transcription factor with antiproliferative properties and ability to induce cell cycle arrest (PubMed:15222485). Binds to the DeltaLf response element found in the SKP1, BAX, DCPS, and SELENOH promoters (PubMed:22320386). {ECO:0000269|PubMed:15222485, ECO:0000269|PubMed:22320386}.","ACT_SITE 92; /evidence=""ECO:0000305|PubMed:12535064""; ACT_SITE 278; /note=""Nucleophile""; /evidence=""ECO:0000305|PubMed:12535064""",,cysteine-type endopeptidase inhibitor activity [GO:0004869]; DNA binding [GO:0003677]; heparin binding [GO:0008201]; iron ion binding [GO:0005506]; lipopolysaccharide binding [GO:0001530]; membrane destabilizing activity [GO:0140912]; protein serine/threonine kinase activator activity [GO:0043539]; serine-type endopeptidase activity [GO:0004252],,CHEMBL4523161;
SEMG1,P10909,"Clusterin (Aging-associated gene 4 protein) (Apolipoprotein J) (Apo-J) (Complement cytolysis inhibitor) (CLI) (Complement-associated protein SP-40,40) (Ku70-binding protein 1) (NA1/NA2) (Sulfated glycoprotein 2) (SGP-2) (Testosterone-repressed prostate message 2) (TRPM-2) [Cleaved into: Clusterin beta chain (ApoJalpha) (Complement cytolysis inhibitor a chain) (SP-40,40 beta-chain); Clusterin alpha chain (ApoJbeta) (Complement cytolysis inhibitor b chain) (SP-40,40 alpha-chain)]",APOJ CLI KUB1,"FUNCTION: [Isoform 1]: Functions as extracellular chaperone that prevents aggregation of non native proteins (PubMed:11123922, PubMed:19535339). Prevents stress-induced aggregation of blood plasma proteins (PubMed:11123922, PubMed:12176985, PubMed:17260971, PubMed:19996109). Inhibits formation of amyloid fibrils by APP, APOC2, B2M, CALCA, CSN3, SNCA and aggregation-prone LYZ variants (in vitro) (PubMed:12047389, PubMed:17407782, PubMed:17412999). Does not require ATP (PubMed:11123922). Maintains partially unfolded proteins in a state appropriate for subsequent refolding by other chaperones, such as HSPA8/HSC70 (PubMed:11123922). Does not refold proteins by itself (PubMed:11123922). Binding to cell surface receptors triggers internalization of the chaperone-client complex and subsequent lysosomal or proteasomal degradation (PubMed:21505792). Protects cells against apoptosis and against cytolysis by complement (PubMed:2780565). Intracellular forms interact with ubiquitin and SCF (SKP1-CUL1-F-box protein) E3 ubiquitin-protein ligase complexes and promote the ubiquitination and subsequent proteasomal degradation of target proteins (PubMed:20068069). Promotes proteasomal degradation of COMMD1 and IKBKB (PubMed:20068069). Modulates NF-kappa-B transcriptional activity (PubMed:12882985). A mitochondrial form suppresses BAX-dependent release of cytochrome c into the cytoplasm and inhibit apoptosis (PubMed:16113678, PubMed:17689225). Plays a role in the regulation of cell proliferation (PubMed:19137541). An intracellular form suppresses stress-induced apoptosis by stabilizing mitochondrial membrane integrity through interaction with HSPA5 (PubMed:22689054). Secreted form does not affect caspase or BAX-mediated intrinsic apoptosis and TNF-induced NF-kappa-B-activity (PubMed:24073260). Secreted form act as an important modulator during neuronal differentiation through interaction with STMN3 (By similarity). Plays a role in the clearance of immune complexes that arise during cell injury (By similarity). {ECO:0000250|UniProtKB:P05371, ECO:0000250|UniProtKB:Q06890, ECO:0000269|PubMed:11123922, ECO:0000269|PubMed:12047389, ECO:0000269|PubMed:12176985, ECO:0000269|PubMed:12882985, ECO:0000269|PubMed:16113678, ECO:0000269|PubMed:17260971, ECO:0000269|PubMed:17407782, ECO:0000269|PubMed:17412999, ECO:0000269|PubMed:17689225, ECO:0000269|PubMed:19137541, ECO:0000269|PubMed:19535339, ECO:0000269|PubMed:19996109, ECO:0000269|PubMed:20068069, ECO:0000269|PubMed:21505792, ECO:0000269|PubMed:22689054, ECO:0000269|PubMed:24073260, ECO:0000269|PubMed:2780565}.; FUNCTION: [Isoform 6]: Does not affect caspase or BAX-mediated intrinsic apoptosis and TNF-induced NF-kappa-B-activity. {ECO:0000269|PubMed:24073260}.; FUNCTION: [Isoform 4]: Does not affect caspase or BAX-mediated intrinsic apoptosis and TNF-induced NF-kappa-B-activity (PubMed:24073260). Promotes cell death through interaction with BCL2L1 that releases and activates BAX (PubMed:21567405). {ECO:0000269|PubMed:21567405, ECO:0000269|PubMed:24073260}.",,,amyloid-beta binding [GO:0001540]; low-density lipoprotein particle receptor binding [GO:0050750]; misfolded protein binding [GO:0051787]; protein carrier chaperone [GO:0140597]; protein-containing complex binding [GO:0044877]; protein-folding chaperone binding [GO:0051087]; receptor ligand activity [GO:0048018]; signaling receptor binding [GO:0005102]; tau protein binding [GO:0048156]; ubiquitin protein ligase binding [GO:0031625]; unfolded protein binding [GO:0051082],,
SEMG1,Q8IYK4,Procollagen galactosyltransferase 2 (EC 2.4.1.50) (Collagen beta(1-O)galactosyltransferase 2) (ColGalT 2) (Glycosyltransferase 25 family member 2) (Hydroxylysine galactosyltransferase 2),C1orf17 GLT25D2 KIAA0584,FUNCTION: Beta-galactosyltransferase that transfers beta-galactose to hydroxylysine residues of collagen. {ECO:0000269|PubMed:19075007}.,,,procollagen galactosyltransferase activity [GO:0050211],,
SEMG1,Q9P0G3,Kallikrein-14 (hK14) (EC 3.4.21.-) (Kallikrein-like protein 6) (KLK-L6),KLKL6,"FUNCTION: Serine-type endopeptidase with a dual trypsin-like and chymotrypsin-like substrate specificity. May activate/inactivate the proteinase-activated receptors F2R, F2RL1 and F2RL3 and other kallikreins including KLK1, KLK3, KLK5 and KLK11. May function in seminal clot liquefaction through direct cleavage of the semenogelin SEMG1 and SEMG2 and activation of KLK3. May function through desmoglein DSG1 cleavage in epidermal desquamation a process by which the most superficial corneocytes are shed from the skin surface. May be involved in several aspects of tumor progression including growth, invasion and angiogenesis. {ECO:0000269|PubMed:15654974, ECO:0000269|PubMed:16885167, ECO:0000269|PubMed:17158887, ECO:0000269|PubMed:17625593, ECO:0000269|PubMed:18056261, ECO:0000269|PubMed:18482984}.","ACT_SITE 83; /note=""Charge relay system""; /evidence=""ECO:0000250""; ACT_SITE 127; /note=""Charge relay system""; /evidence=""ECO:0000250""; ACT_SITE 220; /note=""Charge relay system""; /evidence=""ECO:0000250""",,serine-type endopeptidase activity [GO:0004252],,CHEMBL2641;
SEMG1,A0JLP2,SEMG1 protein,,,,,,,
SEMG1,Q96JC9,ELL-associated factor 1,,"FUNCTION: Acts as a transcriptional transactivator of ELL and ELL2 elongation activities. {ECO:0000269|PubMed:11418481, ECO:0000269|PubMed:16006523}.",,,transcription elongation factor activity [GO:0003711],,
SEMG1,P05154,Plasma serine protease inhibitor (Acrosomal serine protease inhibitor) (Plasminogen activator inhibitor 3) (PAI-3) (PAI3) (Protein C inhibitor) (PCI) (Serpin A5),PCI PLANH3 PROCI,"FUNCTION: Heparin-dependent serine protease inhibitor acting in body fluids and secretions. Inactivates serine proteases by binding irreversibly to their serine activation site. Involved in the regulation of intravascular and extravascular proteolytic activities. Plays hemostatic roles in the blood plasma. Acts as a procoagulant and pro-inflammatory factor by inhibiting the anticoagulant activated protein C factor as well as the generation of activated protein C factor by the thrombin/thrombomodulin complex. Acts as an anticoagulant factor by inhibiting blood coagulation factors like prothrombin, factor XI, factor Xa, plasma kallikrein and fibrinolytic enzymes such as tissue- and urinary-type plasminogen activators. In seminal plasma, inactivates several serine proteases implicated in the reproductive system. Inhibits the serpin acrosin; indirectly protects component of the male genital tract from being degraded by excessive released acrosin. Inhibits tissue- and urinary-type plasminogen activator, prostate-specific antigen and kallikrein activities; has a control on the sperm motility and fertilization. Inhibits the activated protein C-catalyzed degradation of SEMG1 and SEMG2; regulates the degradation of semenogelin during the process of transfer of spermatozoa from the male reproductive tract into the female tract. In urine, inhibits urinary-type plasminogen activator and kallikrein activities. Inactivates membrane-anchored serine proteases activities such as MPRSS7 and TMPRSS11E. Inhibits urinary-type plasminogen activator-dependent tumor cell invasion and metastasis. May also play a non-inhibitory role in seminal plasma and urine as a hydrophobic hormone carrier by its binding to retinoic acid. {ECO:0000269|PubMed:10340997, ECO:0000269|PubMed:11722589, ECO:0000269|PubMed:14696115, ECO:0000269|PubMed:15140131, ECO:0000269|PubMed:15328353, ECO:0000269|PubMed:15853774, ECO:0000269|PubMed:1725227, ECO:0000269|PubMed:18467335, ECO:0000269|PubMed:2844223, ECO:0000269|PubMed:3501295, ECO:0000269|PubMed:6323392, ECO:0000269|PubMed:7521127, ECO:0000269|PubMed:7548057, ECO:0000269|PubMed:8536714, ECO:0000269|PubMed:8665956, ECO:0000269|PubMed:9473218, ECO:0000269|PubMed:9510955, ECO:0000269|PubMed:9556620}.",,,acrosin binding [GO:0032190]; glycosaminoglycan binding [GO:0005539]; heparin binding [GO:0008201]; phosphatidylcholine binding [GO:0031210]; protease binding [GO:0002020]; retinoic acid binding [GO:0001972]; serine-type endopeptidase inhibitor activity [GO:0004867],,
SEMG1,Q6N021,Methylcytosine dioxygenase TET2 (EC 1.14.11.80),KIAA1546,"FUNCTION: Dioxygenase that catalyzes the conversion of the modified genomic base 5-methylcytosine (5mC) into 5-hydroxymethylcytosine (5hmC) and plays a key role in active DNA demethylation. Has a preference for 5-hydroxymethylcytosine in CpG motifs. Also mediates subsequent conversion of 5hmC into 5-formylcytosine (5fC), and conversion of 5fC to 5-carboxylcytosine (5caC). Conversion of 5mC into 5hmC, 5fC and 5caC probably constitutes the first step in cytosine demethylation. Methylation at the C5 position of cytosine bases is an epigenetic modification of the mammalian genome which plays an important role in transcriptional regulation. In addition to its role in DNA demethylation, also involved in the recruitment of the O-GlcNAc transferase OGT to CpG-rich transcription start sites of active genes, thereby promoting histone H2B GlcNAcylation by OGT. {ECO:0000269|PubMed:19483684, ECO:0000269|PubMed:21057493, ECO:0000269|PubMed:21817016, ECO:0000269|PubMed:23222540, ECO:0000269|PubMed:23353889, ECO:0000269|PubMed:24315485, ECO:0000269|PubMed:32518946}.",,,5-methylcytosine dioxygenase activity [GO:0070579]; DNA binding [GO:0003677]; ferrous iron binding [GO:0008198]; zinc ion binding [GO:0008270],"DISEASE: Note=TET2 is frequently mutated in myeloproliferative disorders (MPD). These constitute a heterogeneous group of disorders, also known as myeloproliferative diseases or myeloproliferative neoplasms (MPN), characterized by cellular proliferation of one or more hematologic cell lines in the peripheral blood, distinct from acute leukemia. Included diseases are: essential thrombocythemia, polycythemia vera, primary myelofibrosis (chronic idiopathic myelofibrosis). Bone marrow samples from patients display uniformly low levels of hmC in genomic DNA compared to bone marrow samples from healthy controls as well as hypomethylation relative to controls at the majority of differentially methylated CpG sites.; DISEASE: Polycythemia vera (PV) [MIM:263300]: A myeloproliferative disorder characterized by abnormal proliferation of all hematopoietic bone marrow elements, erythroid hyperplasia, an absolute increase in total blood volume, but also by myeloid leukocytosis, thrombocytosis and splenomegaly. Note=The disease is caused by variants affecting the gene represented in this entry.; DISEASE: Note=TET2 is frequently mutated in systemic mastocytosis; also known as systemic mast cell disease. A condition with features in common with myeloproliferative diseases. It is a clonal disorder of the mast cell and its precursor cells. The clinical symptoms and signs of systemic mastocytosis are due to accumulation of clonally derived mast cells in different tissues, including bone marrow, skin, the gastrointestinal tract, the liver, and the spleen.; DISEASE: Myelodysplastic syndrome (MDS) [MIM:614286]: A heterogeneous group of closely related clonal hematopoietic disorders. All are characterized by a hypercellular or hypocellular bone marrow with impaired morphology and maturation, dysplasia of the myeloid, megakaryocytic and/or erythroid lineages, and peripheral blood cytopenias resulting from ineffective blood cell production. Included diseases are: refractory anemia (RA), refractory anemia with ringed sideroblasts (RARS), refractory anemia with excess blasts (RAEB), refractory cytopenia with multilineage dysplasia and ringed sideroblasts (RCMD-RS); chronic myelomonocytic leukemia (CMML) is a myelodysplastic/myeloproliferative disease. MDS is considered a premalignant condition in a subgroup of patients that often progresses to acute myeloid leukemia (AML). {ECO:0000269|PubMed:19372255, ECO:0000269|PubMed:19483684, ECO:0000269|PubMed:21057493}. Note=The disease is caused by variants affecting the gene represented in this entry. Bone marrow samples from patients display uniformly low levels of hmC in genomic DNA compared to bone marrow samples from healthy controls as well as hypomethylation relative to controls at the majority of differentially methylated CpG sites.; DISEASE: Immunodeficiency 75 with lymphoproliferation (IMD75) [MIM:619126]: An autosomal recessive immunologic disorder characterized by recurrent infections, mainly viral and affecting the respiratory tract, immunodeficieny, immune dysregulation, and the development of lymphoproliferative disorders, including lymphoma. {ECO:0000269|PubMed:32518946}. Note=The disease is caused by variants affecting the gene represented in this entry.",CHEMBL4523344;
SEMG1,Q9UHD9,Ubiquilin-2 (Chap1) (DSK2 homolog) (Protein linking IAP with cytoskeleton 2) (PLIC-2) (hPLIC-2) (Ubiquitin-like product Chap1/Dsk2),N4BP4 PLIC2,"FUNCTION: Plays an important role in the regulation of different protein degradation mechanisms and pathways including ubiquitin-proteasome system (UPS), autophagy and the endoplasmic reticulum-associated protein degradation (ERAD) pathway. Mediates the proteasomal targeting of misfolded or accumulated proteins for degradation by binding (via UBA domain) to their polyubiquitin chains and by interacting (via ubiquitin-like domain) with the subunits of the proteasome (PubMed:10983987). Plays a role in the ERAD pathway via its interaction with ER-localized proteins FAF2/UBXD8 and HERPUD1 and may form a link between the polyubiquitinated ERAD substrates and the proteasome (PubMed:18307982, PubMed:24215460). Involved in the regulation of macroautophagy and autophagosome formation; required for maturation of autophagy-related protein LC3 from the cytosolic form LC3-I to the membrane-bound form LC3-II and may assist in the maturation of autophagosomes to autolysosomes by mediating autophagosome-lysosome fusion (PubMed:19148225, PubMed:20529957). Negatively regulates the endocytosis of GPCR receptors: AVPR2 and ADRB2, by specifically reducing the rate at which receptor-arrestin complexes concentrate in clathrin-coated pits (CCPs) (PubMed:18199683). {ECO:0000269|PubMed:10983987, ECO:0000269|PubMed:18199683, ECO:0000269|PubMed:18307982, ECO:0000269|PubMed:19148225, ECO:0000269|PubMed:20529957, ECO:0000269|PubMed:24215460}.",,,identical protein binding [GO:0042802]; molecular condensate scaffold activity [GO:0140693]; polyubiquitin modification-dependent protein binding [GO:0031593],"DISEASE: Amyotrophic lateral sclerosis 15, with or without frontotemporal dementia (ALS15) [MIM:300857]: A neurodegenerative disorder affecting upper motor neurons in the brain and lower motor neurons in the brain stem and spinal cord, resulting in fatal paralysis. Sensory abnormalities are absent. The pathologic hallmarks of the disease include pallor of the corticospinal tract due to loss of motor neurons, presence of ubiquitin-positive inclusions within surviving motor neurons, and deposition of pathologic aggregates. The etiology of amyotrophic lateral sclerosis is likely to be multifactorial, involving both genetic and environmental factors. The disease is inherited in 5-10% of the cases. Patients with ALS15 may develop frontotemporal dementia. {ECO:0000269|PubMed:21857683, ECO:0000269|PubMed:22560112, ECO:0000269|PubMed:22717235, ECO:0000269|PubMed:22892309, ECO:0000269|PubMed:24215460, ECO:0000269|PubMed:25616961}. Note=The disease is caused by variants affecting the gene represented in this entry.",
SEMG1,Q6Y806,Semenogelin I,,,,,,,
SEMG1,Q6Y808,Semenogelin I,,,,,,,
