REN,P02545,Prelamin-A/C [Cleaved into: Lamin-A/C (70 kDa lamin) (Renal carcinoma antigen NY-REN-32)],LMN1,"FUNCTION: [Lamin-A/C]: Lamins are intermediate filament proteins that assemble into a filamentous meshwork, and which constitute the major components of the nuclear lamina, a fibrous layer on the nucleoplasmic side of the inner nuclear membrane (PubMed:10080180, PubMed:10580070, PubMed:10587585, PubMed:10814726, PubMed:11799477, PubMed:12075506, PubMed:12927431, PubMed:15317753, PubMed:18551513, PubMed:18611980, PubMed:2188730, PubMed:22431096, PubMed:2344612, PubMed:23666920, PubMed:24741066, PubMed:31434876, PubMed:31548606, PubMed:37788673, PubMed:37832547). Lamins provide a framework for the nuclear envelope, bridging the nuclear envelope and chromatin, thereby playing an important role in nuclear assembly, chromatin organization, nuclear membrane and telomere dynamics (PubMed:10080180, PubMed:10580070, PubMed:10587585, PubMed:10814726, PubMed:11799477, PubMed:12075506, PubMed:12927431, PubMed:15317753, PubMed:18551513, PubMed:18611980, PubMed:22431096, PubMed:23666920, PubMed:24741066, PubMed:31548606, PubMed:37788673, PubMed:37832547). Lamin A and C also regulate matrix stiffness by conferring nuclear mechanical properties (PubMed:23990565, PubMed:25127216). The structural integrity of the lamina is strictly controlled by the cell cycle, as seen by the disintegration and formation of the nuclear envelope in prophase and telophase, respectively (PubMed:2188730, PubMed:2344612). Lamin A and C are present in equal amounts in the lamina of mammals (PubMed:10080180, PubMed:10580070, PubMed:10587585, PubMed:10814726, PubMed:11799477, PubMed:12075506, PubMed:12927431, PubMed:15317753, PubMed:18551513, PubMed:18611980, PubMed:22431096, PubMed:23666920, PubMed:31548606). Also invoved in DNA repair: recruited by DNA repair proteins XRCC4 and IFFO1 to the DNA double-strand breaks (DSBs) to prevent chromosome translocation by immobilizing broken DNA ends (PubMed:31548606). Required for normal development of peripheral nervous system and skeletal muscle and for muscle satellite cell proliferation (PubMed:10080180, PubMed:10814726, PubMed:11799477, PubMed:18551513, PubMed:22431096). Required for osteoblastogenesis and bone formation (PubMed:12075506, PubMed:15317753, PubMed:18611980). Also prevents fat infiltration of muscle and bone marrow, helping to maintain the volume and strength of skeletal muscle and bone (PubMed:10587585). Required for cardiac homeostasis (PubMed:10580070, PubMed:12927431, PubMed:18611980, PubMed:23666920). {ECO:0000269|PubMed:10080180, ECO:0000269|PubMed:10580070, ECO:0000269|PubMed:10587585, ECO:0000269|PubMed:10814726, ECO:0000269|PubMed:11799477, ECO:0000269|PubMed:12075506, ECO:0000269|PubMed:12927431, ECO:0000269|PubMed:15317753, ECO:0000269|PubMed:18551513, ECO:0000269|PubMed:18611980, ECO:0000269|PubMed:2188730, ECO:0000269|PubMed:22431096, ECO:0000269|PubMed:2344612, ECO:0000269|PubMed:23666920, ECO:0000269|PubMed:23990565, ECO:0000269|PubMed:24741066, ECO:0000269|PubMed:25127216, ECO:0000269|PubMed:31434876, ECO:0000269|PubMed:31548606, ECO:0000269|PubMed:37788673, ECO:0000269|PubMed:37832547}.; FUNCTION: [Prelamin-A/C]: Prelamin-A/C can accelerate smooth muscle cell senescence (PubMed:20458013). It acts to disrupt mitosis and induce DNA damage in vascular smooth muscle cells (VSMCs), leading to mitotic failure, genomic instability, and premature senescence (PubMed:20458013). {ECO:0000269|PubMed:20458013}.",,,identical protein binding [GO:0042802]; structural constituent of cytoskeleton [GO:0005200]; structural constituent of nuclear lamina [GO:0160123]; structural molecule activity [GO:0005198],"DISEASE: Emery-Dreifuss muscular dystrophy 2, autosomal dominant (EDMD2) [MIM:181350]: A form of Emery-Dreifuss muscular dystrophy, a degenerative myopathy characterized by weakness and atrophy of muscle without involvement of the nervous system, early contractures of the elbows, Achilles tendons and spine, and cardiomyopathy associated with cardiac conduction defects. {ECO:0000269|PubMed:22431096, ECO:0000269|PubMed:27234031}. Note=The disease is caused by variants affecting the gene represented in this entry.; DISEASE: Emery-Dreifuss muscular dystrophy 3, autosomal recessive (EDMD3) [MIM:616516]: A form of Emery-Dreifuss muscular dystrophy, a degenerative myopathy characterized by weakness and atrophy of muscle without involvement of the nervous system, early contractures of the elbows, Achilles tendons and spine, and cardiomyopathy associated with cardiac conduction defects. {ECO:0000269|PubMed:22431096, ECO:0000269|PubMed:27234031}. Note=The disease is caused by variants affecting the gene represented in this entry.; DISEASE: Cardiomyopathy, dilated, 1A (CMD1A) [MIM:115200]: A disorder characterized by ventricular dilation and impaired systolic function, resulting in congestive heart failure and arrhythmia. Patients are at risk of premature death. {ECO:0000269|PubMed:10580070, ECO:0000269|PubMed:11561226, ECO:0000269|PubMed:11792809, ECO:0000269|PubMed:11897440, ECO:0000269|PubMed:12486434, ECO:0000269|PubMed:12628721, ECO:0000269|PubMed:12920062, ECO:0000269|PubMed:14675861, ECO:0000269|PubMed:14684700, ECO:0000269|PubMed:15140538, ECO:0000269|PubMed:15219508, ECO:0000269|PubMed:15372542, ECO:0000269|PubMed:16061563, ECO:0000269|PubMed:16156025, ECO:0000269|PubMed:18606848, ECO:0000269|PubMed:19167105, ECO:0000269|PubMed:20160190, ECO:0000269|PubMed:21846512}. Note=The disease is caused by variants affecting the gene represented in this entry.; DISEASE: Lipodystrophy, familial partial, 2 (FPLD2) [MIM:151660]: A disorder characterized by the loss of subcutaneous adipose tissue in the lower parts of the body (limbs, buttocks, trunk). It is accompanied by an accumulation of adipose tissue in the face and neck causing a double chin, fat neck, or cushingoid appearance. Adipose tissue may also accumulate in the axillae, back, labia majora, and intraabdominal region. Affected patients are insulin-resistant and may develop glucose intolerance and diabetes mellitus after age 20 years, hypertriglyceridemia, and low levels of high density lipoprotein cholesterol. {ECO:0000269|PubMed:10587585, ECO:0000269|PubMed:10655060, ECO:0000269|PubMed:10739751, ECO:0000269|PubMed:11792809, ECO:0000269|PubMed:12015247, ECO:0000269|PubMed:12196663, ECO:0000269|PubMed:12629077, ECO:0000269|PubMed:15372542, ECO:0000269|PubMed:17250669, ECO:0000269|PubMed:19220582, ECO:0000269|PubMed:24485160}. Note=The disease is caused by variants affecting the gene represented in this entry.; DISEASE: Charcot-Marie-Tooth disease, axonal, 2B1 (CMT2B1) [MIM:605588]: A recessive axonal form of Charcot-Marie-Tooth disease, a disorder of the peripheral nervous system, characterized by progressive weakness and atrophy, initially of the peroneal muscles and later of the distal muscles of the arms. Charcot-Marie-Tooth disease is classified in two main groups on the basis of electrophysiologic properties and histopathology: primary peripheral demyelinating neuropathies (designated CMT1 when they are dominantly inherited) and primary peripheral axonal neuropathies (CMT2). Neuropathies of the CMT2 group are characterized by signs of axonal degeneration in the absence of obvious myelin alterations, normal or slightly reduced nerve conduction velocities, and progressive distal muscle weakness and atrophy. {ECO:0000269|PubMed:11799477}. Note=The disease is caused by variants affecting the gene represented in this entry.; DISEASE: Hutchinson-Gilford progeria syndrome (HGPS) [MIM:176670]: Rare genetic disorder characterized by features reminiscent of marked premature aging. {ECO:0000269|PubMed:12714972, ECO:0000269|PubMed:12768443, ECO:0000269|PubMed:12927431, ECO:0000269|PubMed:15060110, ECO:0000269|PubMed:15286156, ECO:0000269|PubMed:15622532, ECO:0000269|PubMed:19933576, ECO:0000269|PubMed:21791255, ECO:0000269|PubMed:22355414, ECO:0000269|PubMed:23666920}. Note=The disease is caused by variants affecting the gene represented in this entry. HGPS is caused by the toxic accumulation of a truncated form of lamin-A/C. This mutant protein, called progerin (isoform 6), acts to deregulate mitosis and DNA damage signaling, leading to premature cell death and senescence. The mutant form is mainly generated by a silent or missense mutation at codon 608 of prelamin A that causes activation of a cryptic splice donor site, resulting in production of isoform 6 with a deletion of 50 amino acids near the C terminus. Progerin lacks the conserved ZMPSTE24/FACE1 cleavage site and therefore remains permanently farnesylated. Thus, although it can enter the nucleus and associate with the nuclear envelope, it cannot incorporate normally into the nuclear lamina (PubMed:12714972). {ECO:0000269|PubMed:12714972}.; DISEASE: Cardiomyopathy, dilated, with hypergonadotropic hypogonadism (CMDHH) [MIM:212112]: A disorder characterized by the association of genital anomalies, hypergonadotropic hypogonadism and dilated cardiomyopathy. Patients can present other variable clinical manifestations including intellectual disability, skeletal anomalies, scleroderma-like skin, graying and thinning of hair, osteoporosis. Dilated cardiomyopathy is characterized by ventricular dilation and impaired systolic function, resulting in congestive heart failure and arrhythmia. {ECO:0000269|PubMed:12927431, ECO:0000269|PubMed:17150192, ECO:0000269|PubMed:19283854}. Note=The disease is caused by variants affecting the gene represented in this entry.; DISEASE: Mandibuloacral dysplasia with type A lipodystrophy (MADA) [MIM:248370]: A form of mandibuloacral dysplasia, a rare progeroid disorder with clinical and genetic heterogeneity, characterized by growth retardation, craniofacial dysmorphic features due to distal bone resorption, musculoskeletal and skin abnormalities associated with lipodystrophy. MADA is an autosomal recessive disease characterized by mandibular and clavicular hypoplasia, acroosteolysis, delayed closure of the cranial suture, progeroid appearance, partial alopecia, soft tissue calcinosis, joint contractures, and partial lipodystrophy with loss of subcutaneous fat from the extremities. Adipose tissue in the face, neck and trunk is normal or increased. {ECO:0000269|PubMed:12075506, ECO:0000269|PubMed:15998779, ECO:0000269|PubMed:16278265}. Note=The disease is caused by variants affecting the gene represented in this entry.; DISEASE: Restrictive dermopathy 2 (RSDM2) [MIM:619793]: An autosomal dominant form of restrictive dermopathy, a genodermatosis mainly characterized by intrauterine growth retardation, tight and rigid skin with erosions, prominent superficial vasculature and epidermal hyperkeratosis, facial dysmorphism, sparse/absent eyelashes and eyebrows, mineralization defects of the skull, thin dysplastic clavicles, pulmonary hypoplasia, multiple joint contractures and an early neonatal lethal course. Liveborn children usually die within the first week of life. {ECO:0000269|PubMed:15317753}. Note=The disease is caused by variants affecting the gene represented in this entry.; DISEASE: Heart-hand syndrome Slovenian type (HHS-Slovenian) [MIM:610140]: Heart-hand syndrome (HHS) is a clinically and genetically heterogeneous disorder characterized by the co-occurrence of a congenital cardiac disease and limb malformations. {ECO:0000269|PubMed:18611980}. Note=The disease is caused by variants affecting the gene represented in this entry.; DISEASE: Muscular dystrophy congenital LMNA-related (MDCL) [MIM:613205]: A form of congenital muscular dystrophy. Patients present at birth, or within the first few months of life, with hypotonia, muscle weakness and often with joint contractures. {ECO:0000269|PubMed:18551513}. Note=The disease is caused by variants affecting the gene represented in this entry.; DISEASE: Note=Defects in LMNA may cause a late-onset cardiocutaneous progeria syndrome characterized by cutaneous manifestations of aging appearing in the third decade of life, cardiac valve calcification and dysfunction, prominent atherosclerosis, and cardiomyopathy, leading to death on average in the fourth decade. {ECO:0000269|PubMed:23666920}.",CHEMBL1293235;
REN,P05387,Large ribosomal subunit protein P2 (60S acidic ribosomal protein P2) (Renal carcinoma antigen NY-REN-44),D11S2243E RPP2,FUNCTION: Plays an important role in the elongation step of protein synthesis.,,,structural constituent of ribosome [GO:0003735],,CHEMBL4295698;
REN,P07195,L-lactate dehydrogenase B chain (LDH-B) (EC 1.1.1.27) (LDH heart subunit) (LDH-H) (Renal carcinoma antigen NY-REN-46),,FUNCTION: Interconverts simultaneously and stereospecifically pyruvate and lactate with concomitant interconversion of NADH and NAD(+). {ECO:0000269|PubMed:27618187}.,"ACT_SITE 194; /note=""Proton acceptor""",PATHWAY: Fermentation; pyruvate fermentation to lactate; (S)-lactate from pyruvate: step 1/1. {ECO:0000305|PubMed:27618187}.,identical protein binding [GO:0042802]; kinase binding [GO:0019900]; L-lactate dehydrogenase activity [GO:0004459]; NAD binding [GO:0051287],"DISEASE: Lactate dehydrogenase B deficiency (LDHBD) [MIM:614128]: A condition with no deleterious effects on health. LDHBD is of interest to laboratory medicine mainly because it can cause misdiagnosis in those disorders in which elevation of serum LDH is expected. {ECO:0000269|PubMed:10211631, ECO:0000269|PubMed:10509905, ECO:0000269|PubMed:11509017, ECO:0000269|PubMed:1587525, ECO:0000269|PubMed:2334429, ECO:0000269|PubMed:8314553, ECO:0000269|PubMed:8462975, ECO:0000269|PubMed:8611651, ECO:0000269|PubMed:9929983, ECO:0000269|Ref.23}. Note=The disease is caused by variants affecting the gene represented in this entry.",CHEMBL4940;
REN,Q15831,Serine/threonine-protein kinase STK11 (EC 2.7.11.1) (Liver kinase B1) (LKB1) (hLKB1) (Renal carcinoma antigen NY-REN-19),LKB1 PJS,"FUNCTION: Tumor suppressor serine/threonine-protein kinase that controls the activity of AMP-activated protein kinase (AMPK) family members, thereby playing a role in various processes such as cell metabolism, cell polarity, apoptosis and DNA damage response. Acts by phosphorylating the T-loop of AMPK family proteins, thus promoting their activity: phosphorylates PRKAA1, PRKAA2, BRSK1, BRSK2, MARK1, MARK2, MARK3, MARK4, NUAK1, NUAK2, SIK1, SIK2, SIK3 and SNRK but not MELK. Also phosphorylates non-AMPK family proteins such as STRADA, PTEN and possibly p53/TP53. Acts as a key upstream regulator of AMPK by mediating phosphorylation and activation of AMPK catalytic subunits PRKAA1 and PRKAA2 and thereby regulates processes including: inhibition of signaling pathways that promote cell growth and proliferation when energy levels are low, glucose homeostasis in liver, activation of autophagy when cells undergo nutrient deprivation, and B-cell differentiation in the germinal center in response to DNA damage. Also acts as a regulator of cellular polarity by remodeling the actin cytoskeleton. Required for cortical neuron polarization by mediating phosphorylation and activation of BRSK1 and BRSK2, leading to axon initiation and specification. Involved in DNA damage response: interacts with p53/TP53 and recruited to the CDKN1A/WAF1 promoter to participate in transcription activation. Able to phosphorylate p53/TP53; the relevance of such result in vivo is however unclear and phosphorylation may be indirect and mediated by downstream STK11/LKB1 kinase NUAK1. Also acts as a mediator of p53/TP53-dependent apoptosis via interaction with p53/TP53: translocates to the mitochondrion during apoptosis and regulates p53/TP53-dependent apoptosis pathways. Regulates UV radiation-induced DNA damage response mediated by CDKN1A. In association with NUAK1, phosphorylates CDKN1A in response to UV radiation and contributes to its degradation which is necessary for optimal DNA repair (PubMed:25329316). {ECO:0000269|PubMed:11430832, ECO:0000269|PubMed:12805220, ECO:0000269|PubMed:14517248, ECO:0000269|PubMed:14976552, ECO:0000269|PubMed:15016379, ECO:0000269|PubMed:15733851, ECO:0000269|PubMed:15987703, ECO:0000269|PubMed:17108107, ECO:0000269|PubMed:21317932, ECO:0000269|PubMed:25329316}.; FUNCTION: [Isoform 2]: Has a role in spermiogenesis. {ECO:0000250}.","ACT_SITE 176; /note=""Proton acceptor""",,3-phosphoinositide-dependent protein kinase activity [GO:0004676]; AMP-activated protein kinase activity [GO:0004679]; ATP binding [GO:0005524]; DNA-dependent protein kinase activity [GO:0004677]; eukaryotic translation initiation factor 2alpha kinase activity [GO:0004694]; histone H2AS1 kinase activity [GO:0044024]; histone H2AS121 kinase activity [GO:0072371]; histone H2AT120 kinase activity [GO:1990244]; histone H2AXS139 kinase activity [GO:0035979]; histone H2BS14 kinase activity [GO:0044025]; histone H2BS36 kinase activity [GO:0140823]; histone H3S10 kinase activity [GO:0035175]; histone H3S28 kinase activity [GO:0044022]; histone H3S57 kinase activity [GO:0140855]; histone H3T11 kinase activity [GO:0035402]; histone H3T3 kinase activity [GO:0072354]; histone H3T45 kinase activity [GO:0140857]; histone H3T6 kinase activity [GO:0035403]; histone H4S1 kinase activity [GO:0044023]; LRR domain binding [GO:0030275]; magnesium ion binding [GO:0000287]; p53 binding [GO:0002039]; protein kinase activator activity [GO:0030295]; protein serine kinase activity [GO:0106310]; protein serine/threonine kinase activity [GO:0004674]; protein-containing complex binding [GO:0044877]; Rho-dependent protein serine/threonine kinase activity [GO:0072518]; ribosomal protein S6 kinase activity [GO:0004711],"DISEASE: Peutz-Jeghers syndrome (PJS) [MIM:175200]: An autosomal dominant disorder characterized by melanocytic macules of the lips, multiple gastrointestinal hamartomatous polyps and an increased risk for various neoplasms, including gastrointestinal cancer. {ECO:0000269|PubMed:10408777, ECO:0000269|PubMed:12372054, ECO:0000269|PubMed:15987703, ECO:0000269|PubMed:21411391, ECO:0000269|PubMed:9425897, ECO:0000269|PubMed:9428765, ECO:0000269|PubMed:9760200, ECO:0000269|PubMed:9837816}. Note=The disease is caused by variants affecting the gene represented in this entry.; DISEASE: Testicular germ cell tumor (TGCT) [MIM:273300]: A common malignancy in males representing 95% of all testicular neoplasms. TGCTs have various pathologic subtypes including: unclassified intratubular germ cell neoplasia, seminoma (including cases with syncytiotrophoblastic cells), spermatocytic seminoma, embryonal carcinoma, yolk sac tumor, choriocarcinoma, and teratoma. {ECO:0000269|PubMed:9605748, ECO:0000269|PubMed:9887330}. Note=The gene represented in this entry may be involved in disease pathogenesis.; DISEASE: Note=Defects in STK11 are associated with some sporadic cancers, especially lung cancers. Frequently mutated and inactivated in non-small cell lung cancer (NSCLC). Defects promote lung cancerigenesis process, especially lung cancer progression and metastasis. Confers lung adenocarcinoma the ability to trans-differentiate into squamous cell carcinoma. Also able to promote lung cancer metastasis, via both cancer-cell autonomous and non-cancer-cell autonomous mechanisms.",CHEMBL5606;
REN,Q9UK97,F-box only protein 9 (Cross-immune reaction antigen 1) (Renal carcinoma antigen NY-REN-57),FBX9 VCIA1,"FUNCTION: Substrate recognition component of a SCF (SKP1-CUL1-F-box protein) E3 ubiquitin-protein ligase complex which mediates the ubiquitination and subsequent proteasomal degradation of target proteins and plays a role in several biological processes such as cell cycle, cell proliferation, or maintenance of chromosome stability (PubMed:23263282, PubMed:34480022). Ubiquitinates mTORC1-bound TTI1 and TELO2 when they are phosphorylated by CK2 following growth factor deprivation, leading to their degradation. In contrast, does not mediate ubiquitination of TTI1 and TELO2 when they are part of the mTORC2 complex. As a consequence, mTORC1 is inactivated to restrain cell growth and protein translation, while mTORC2 is the activated due to the relief of feedback inhibition by mTORC1 (PubMed:23263282). Plays a role in maintaining epithelial cell survival by regulating the turn-over of chromatin modulator PRMT4 through ubiquitination and degradation by the proteasomal pathway (PubMed:34480022). Regulates also PPARgamma stability by facilitating PPARgamma/PPARG ubiquitination and thereby plays a role in adipocyte differentiation (By similarity). {ECO:0000250|UniProtKB:Q8BK06, ECO:0000269|PubMed:23263282, ECO:0000269|PubMed:34480022}.",,PATHWAY: Protein modification; protein ubiquitination.,ubiquitin-like ligase-substrate adaptor activity [GO:1990756]; ubiquitin-protein transferase activity [GO:0004842],,
REN,Q9Y5A7,NEDD8 ultimate buster 1 (Negative regulator of ubiquitin-like proteins 1) (Renal carcinoma antigen NY-REN-18),NYREN18,"FUNCTION: Specific down-regulator of the NEDD8 conjugation system. Recruits NEDD8, UBD, and their conjugates to the proteasome for degradation. Isoform 1 promotes the degradation of NEDD8 more efficiently than isoform 2. {ECO:0000269|PubMed:16707496}.",,,,,
