FST,P03950,Angiogenin (EC 3.1.27.-) (Ribonuclease 5) (RNase 5),RNASE5,"FUNCTION: Secreted ribonuclease that can either promote or restrict cell proliferation of target cells, depending on the context (PubMed:12051708, PubMed:1400510, PubMed:19332886, PubMed:20129916, PubMed:21855800, PubMed:23047679, PubMed:23843625, PubMed:2424496, PubMed:2459697, PubMed:2730651, PubMed:27518564, PubMed:28176817, PubMed:29100074, PubMed:29748193, PubMed:3122207, PubMed:32510170, PubMed:38718836, PubMed:8159680, PubMed:8570639, PubMed:8622921, PubMed:9578571). Endocytosed in target cells via its receptor PLXNB2 and translocates to the cytoplasm or nucleus (PubMed:29100074, PubMed:32510170). Under stress conditions, localizes to the cytoplasm and promotes the assembly of stress granules (SGs): specifically cleaves a subset of tRNAs within anticodon loops to produce tRNA-derived stress-induced fragments (tiRNAs), resulting in translation repression and inhibition of cell proliferation (PubMed:1400510, PubMed:19332886, PubMed:20129916, PubMed:21855800, PubMed:23047679, PubMed:27518564, PubMed:29100074, PubMed:29748193, PubMed:32510170, PubMed:38718836). tiRNas also prevent formation of apoptosome, thereby promoting cell survival (By similarity). Preferentially cleaves RNAs between a pyrimidine and an adenosine residue, suggesting that it cleaves the anticodon loop of tRNA(Ala) (32-UUAGCAU-38) after positions 33 and 36 (PubMed:3289612, PubMed:38718836). Cleaves a subset of tRNAs, including tRNA(Ala), tRNA(Glu), tRNA(Gly), tRNA(Lys), tRNA(Val), tRNA(His), tRNA(Asp) and tRNA(Sec) (PubMed:31582561). Under growth conditions and in differentiated cells, translocates to the nucleus and stimulates ribosomal RNA (rRNA) transcription, including that containing the initiation site sequences of 45S rRNA, thereby promoting cell growth and proliferation (PubMed:12051708, PubMed:15735021, PubMed:27518564, PubMed:29100074, PubMed:8127865). Angiogenin induces vascularization of normal and malignant tissues via its ability to promote rRNA transcription (PubMed:19354288, PubMed:4074709, PubMed:8448182). Involved in hematopoietic stem and progenitor cell (HSPC) growth and survival by promoting rRNA transcription in growth conditions and inhibiting translation in response to stress, respectively (PubMed:27518564). Mediates the crosstalk between myeloid and intestinal epithelial cells to protect the intestinal epithelial barrier integrity: secreted by myeloid cells and promotes intestinal epithelial cells proliferation and survival (PubMed:32510170). Also mediates osteoclast-endothelial cell crosstalk in growing bone: produced by osteoclasts and protects the neighboring vascular cells against senescence by promoting rRNA transcription (By similarity). {ECO:0000250|UniProtKB:P21570, ECO:0000269|PubMed:12051708, ECO:0000269|PubMed:1400510, ECO:0000269|PubMed:15735021, ECO:0000269|PubMed:19332886, ECO:0000269|PubMed:19354288, ECO:0000269|PubMed:20129916, ECO:0000269|PubMed:21855800, ECO:0000269|PubMed:23047679, ECO:0000269|PubMed:23843625, ECO:0000269|PubMed:2424496, ECO:0000269|PubMed:2459697, ECO:0000269|PubMed:2730651, ECO:0000269|PubMed:27518564, ECO:0000269|PubMed:28176817, ECO:0000269|PubMed:29100074, ECO:0000269|PubMed:29748193, ECO:0000269|PubMed:3122207, ECO:0000269|PubMed:31582561, ECO:0000269|PubMed:32510170, ECO:0000269|PubMed:3289612, ECO:0000269|PubMed:38718836, ECO:0000269|PubMed:4074709, ECO:0000269|PubMed:8127865, ECO:0000269|PubMed:8159680, ECO:0000269|PubMed:8448182, ECO:0000269|PubMed:8570639, ECO:0000269|PubMed:8622921, ECO:0000269|PubMed:9578571}.","ACT_SITE 37; /note=""Proton acceptor""; /evidence=""ECO:0000269|PubMed:11468363, ECO:0000269|PubMed:38718836, ECO:0000269|PubMed:9918722""; ACT_SITE 138; /note=""Proton donor""; /evidence=""ECO:0000269|PubMed:11468363, ECO:0000269|PubMed:38718836, ECO:0000269|PubMed:9918722""",,actin binding [GO:0003779]; copper ion binding [GO:0005507]; DNA binding [GO:0003677]; endonuclease activity [GO:0004519]; heparin binding [GO:0008201]; peptide binding [GO:0042277]; protein homodimerization activity [GO:0042803]; receptor ligand activity [GO:0048018]; ribosome binding [GO:0043022]; RNA endonuclease activity [GO:0004521]; RNA nuclease activity [GO:0004540]; rRNA binding [GO:0019843]; signaling receptor binding [GO:0005102]; tRNA-specific ribonuclease activity [GO:0004549],"DISEASE: Amyotrophic lateral sclerosis 9 (ALS9) [MIM:611895]: A neurodegenerative disorder affecting upper motor neurons in the brain and lower motor neurons in the brain stem and spinal cord, resulting in fatal paralysis. Sensory abnormalities are absent. The pathologic hallmarks of the disease include pallor of the corticospinal tract due to loss of motor neurons, presence of ubiquitin-positive inclusions within surviving motor neurons, and deposition of pathologic aggregates. The etiology of amyotrophic lateral sclerosis is likely to be multifactorial, involving both genetic and environmental factors. The disease is inherited in 5-10% of the cases. {ECO:0000269|PubMed:15557516, ECO:0000269|PubMed:16501576, ECO:0000269|PubMed:17703939, ECO:0000269|PubMed:17886298, ECO:0000269|PubMed:17900154, ECO:0000269|PubMed:18087731, ECO:0000269|PubMed:18852347, ECO:0000269|PubMed:19153377, ECO:0000269|PubMed:19332886, ECO:0000269|PubMed:19363631, ECO:0000269|PubMed:22190368, ECO:0000269|PubMed:22292798, ECO:0000269|PubMed:22292843, ECO:0000269|PubMed:25372031, ECO:0000269|PubMed:29748193, ECO:0000269|PubMed:38718836}. Note=Disease susceptibility is associated with variants affecting the gene represented in this entry.",CHEMBL5829;
FST,Q02930,Cyclic AMP-responsive element-binding protein 5 (CREB-5) (cAMP-responsive element-binding protein 5) (cAMP-response element-binding protein A) (CRE-BPa),CREBPA,FUNCTION: Binds to the cAMP response element and activates transcription. {ECO:0000269|PubMed:8378084}.,,,"cAMP response element binding [GO:0035497]; DNA-binding transcription factor activity [GO:0003700]; DNA-binding transcription factor activity, RNA polymerase II-specific [GO:0000981]; identical protein binding [GO:0042802]; metal ion binding [GO:0046872]; sequence-specific double-stranded DNA binding [GO:1990837]",,
FST,Q8NEC5,Cation channel sperm-associated protein 1 (CatSper1) (hCatSper),,"FUNCTION: Pore-forming subunit of the CatSper complex, a sperm-specific voltage-gated calcium channel that plays a central role in calcium-dependent physiological responses essential for successful fertilization, such as sperm hyperactivation, acrosome reaction and chemotaxis towards the oocyte. {ECO:0000269|PubMed:21412338, ECO:0000269|PubMed:21412339}.",,,calcium-activated cation channel activity [GO:0005227]; voltage-gated calcium channel activity [GO:0005245],"DISEASE: Spermatogenic failure 7 (SPGF7) [MIM:612997]: An infertility disorder characterized by non-motile sperm or sperm motility below the normal threshold, low sperm count, increased abnormally structured spermatozoa, and reduced semen volume. {ECO:0000269|PubMed:19344877}. Note=The disease is caused by variants affecting the gene represented in this entry.",CHEMBL1628462;
FST,Q8TAU3,Zinc finger protein 417,,FUNCTION: May be involved in transcriptional regulation.,,,"DNA-binding transcription factor activity, RNA polymerase II-specific [GO:0000981]; metal ion binding [GO:0046872]; RNA polymerase II cis-regulatory region sequence-specific DNA binding [GO:0000978]",,
FST,P49639,Homeobox protein Hox-A1 (Homeobox protein Hox-1F),HOX1F,"FUNCTION: Sequence-specific transcription factor (By similarity). Regulates multiple developmental processes including brainstem, inner and outer ear, abducens nerve and cardiovascular development and morphogenesis as well as cognition and behavior (PubMed:16155570). Also part of a developmental regulatory system that provides cells with specific positional identities on the anterior-posterior axis. Acts on the anterior body structures. Seems to act in the maintenance and/or generation of hindbrain segments (By similarity). Activates transcription in the presence of PBX1A and PKNOX1 (By similarity). {ECO:0000250|UniProtKB:P09022, ECO:0000250|UniProtKB:Q90423, ECO:0000269|PubMed:16155570}.",,,"DNA-binding transcription activator activity, RNA polymerase II-specific [GO:0001228]; DNA-binding transcription factor activity, RNA polymerase II-specific [GO:0000981]; identical protein binding [GO:0042802]; RNA polymerase II cis-regulatory region sequence-specific DNA binding [GO:0000978]; sequence-specific DNA binding [GO:0043565]; sequence-specific double-stranded DNA binding [GO:1990837]","DISEASE: Athabaskan brainstem dysgenesis syndrome (ABDS) [MIM:601536]: Characterized by horizontal gaze palsy, sensorineural deafness, central hypoventilation, and developmental delay. Some patients had swallowing dysfunction, vocal cord paralysis, facial paresis, seizures, and cardiac outflow tract anomalies. {ECO:0000269|PubMed:16155570}. Note=The disease is caused by variants affecting the gene represented in this entry.; DISEASE: Bosley-Salih-Alorainy syndrome (BSAS) [MIM:601536]: A disease characterized by horizontal gaze abnormalities, deafness, facial weakness, vascular malformations of the internal carotid arteries and cardiac outflow trac. Some patients manifest intellectual disability and autism spectrum disorder. Affected individuals do not suffer from central hypoventilation. Note=The disease is caused by variants affecting the gene represented in this entry.",
FST,Q6FHE1,FST protein,,,,,,,
FST,H0YA75,Follistatin,,,,,,,
FST,H0YAF9,Follistatin,,,,,,,
HTR2B,P41595,5-hydroxytryptamine receptor 2B (5-HT-2B) (5-HT2B) (Serotonin receptor 2B),,"FUNCTION: G-protein coupled receptor for 5-hydroxytryptamine (serotonin) (PubMed:18703043, PubMed:23519210, PubMed:7926008, PubMed:8078486, PubMed:8143856, PubMed:8882600). Also functions as a receptor for various ergot alkaloid derivatives and psychoactive substances (PubMed:12970106, PubMed:18703043, PubMed:23519210, PubMed:23519215, PubMed:24357322, PubMed:28129538, PubMed:30127358, PubMed:36087581, PubMed:7926008, PubMed:8078486, PubMed:8143856). Ligand binding causes a conformation change that triggers signaling via guanine nucleotide-binding proteins (G proteins) and modulates the activity of downstream effectors (PubMed:23519215, PubMed:28129538, PubMed:8078486, PubMed:8143856, PubMed:8882600). HTR2B is coupled to G(q)/G(11) G alpha proteins and activates phospholipase C-beta, releasing diacylglycerol (DAG) and inositol 1,4,5-trisphosphate (IP3) second messengers that modulate the activity of phosphatidylinositol 3-kinase and promote the release of Ca(2+) ions from intracellular stores, respectively (PubMed:18703043, PubMed:23519215, PubMed:28129538, PubMed:30127358, PubMed:36087581, PubMed:8078486, PubMed:8143856, PubMed:8882600). Beta-arrestin family members inhibit signaling via G proteins and mediate activation of alternative signaling pathways (PubMed:23519215, PubMed:28129538, PubMed:30127358, PubMed:36087581). Plays a role in the regulation of dopamine and 5-hydroxytryptamine release, 5-hydroxytryptamine uptake and in the regulation of extracellular dopamine and 5-hydroxytryptamine levels, and thereby affects neural activity. May play a role in the perception of pain (By similarity). Plays a role in the regulation of behavior, including impulsive behavior (PubMed:21179162). Required for normal proliferation of embryonic cardiac myocytes and normal heart development (By similarity). Protects cardiomyocytes against apoptosis (By similarity). Plays a role in the adaptation of pulmonary arteries to chronic hypoxia (By similarity). Plays a role in vasoconstriction (By similarity). Required for normal osteoblast function and proliferation, and for maintaining normal bone density (By similarity). Required for normal proliferation of the interstitial cells of Cajal in the intestine (By similarity). {ECO:0000250|UniProtKB:Q02152, ECO:0000269|PubMed:12970106, ECO:0000269|PubMed:18703043, ECO:0000269|PubMed:21179162, ECO:0000269|PubMed:23519210, ECO:0000269|PubMed:23519215, ECO:0000269|PubMed:24357322, ECO:0000269|PubMed:28129538, ECO:0000269|PubMed:30127358, ECO:0000269|PubMed:36087581, ECO:0000269|PubMed:7926008, ECO:0000269|PubMed:8078486, ECO:0000269|PubMed:8143856, ECO:0000269|PubMed:8882600}.",,,G protein-coupled serotonin receptor activity [GO:0004993]; G-protein alpha-subunit binding [GO:0001965]; Gq/11-coupled serotonin receptor activity [GO:0001587]; GTPase activator activity [GO:0005096]; neurotransmitter receptor activity [GO:0030594]; serotonin binding [GO:0051378]; serotonin receptor activity [GO:0099589],,CHEMBL1833;
HTR2B,O75970,Multiple PDZ domain protein (Multi-PDZ domain protein 1),MUPP1,"FUNCTION: Member of the NMDAR signaling complex that may play a role in control of AMPAR potentiation and synaptic plasticity in excitatory synapses (PubMed:11150294, PubMed:15312654). Promotes clustering of HT2RC at the cell surface (By similarity). {ECO:0000250|UniProtKB:O55164, ECO:0000269|PubMed:11150294, ECO:0000269|PubMed:15312654}.",,,,"DISEASE: Hydrocephalus, congenital, 2, with or without brain or eye anomalies (HYC2) [MIM:615219]: A form of congenital hydrocephalus, a disease characterized by onset in utero of enlarged ventricles due to accumulation of ventricular cerebrospinal fluid. HYC2 affected individuals have variable neurologic impairment. Some individuals have other brain abnormalities, including lissencephaly, thinning of the corpus callosum, and neuronal heterotopia. Most patients have delayed motor development and some have delayed intellectual development and/or seizures. Additional congenital features, including cardiac septal defects, iris coloboma, and non-specific dysmorphic features, may be observed. HYC2 inheritance is autosomal recessive. {ECO:0000269|PubMed:23240096, ECO:0000269|PubMed:28556411}. Note=The disease is caused by variants affecting the gene represented in this entry.",
HTR2B,P59768,Guanine nucleotide-binding protein G(I)/G(S)/G(O) subunit gamma-2 (G gamma-I),,"FUNCTION: Guanine nucleotide-binding proteins (G proteins) are involved as a modulator or transducer in various transmembrane signaling systems (PubMed:29925951, PubMed:33762731, PubMed:34239069, PubMed:35610220, PubMed:35714614, PubMed:35835867, PubMed:36087581, PubMed:36989299, PubMed:37327704, PubMed:37935376, PubMed:37935377, PubMed:37963465, PubMed:38168118, PubMed:38552625). The beta and gamma chains are required for the GTPase activity, for replacement of GDP by GTP, and for G protein-effector interaction (PubMed:29925951, PubMed:33762731, PubMed:34239069, PubMed:35610220, PubMed:35714614, PubMed:35835867, PubMed:36087581, PubMed:36989299, PubMed:37327704, PubMed:37935376, PubMed:37935377, PubMed:37963465, PubMed:38168118, PubMed:38552625). {ECO:0000269|PubMed:29925951, ECO:0000269|PubMed:33762731, ECO:0000269|PubMed:34239069, ECO:0000269|PubMed:35610220, ECO:0000269|PubMed:35714614, ECO:0000269|PubMed:35835867, ECO:0000269|PubMed:36087581, ECO:0000269|PubMed:36989299, ECO:0000269|PubMed:37327704, ECO:0000269|PubMed:37935376, ECO:0000269|PubMed:37935377, ECO:0000269|PubMed:37963465, ECO:0000269|PubMed:38168118, ECO:0000269|PubMed:38552625}.",,,G-protein beta-subunit binding [GO:0031681],,CHEMBL3883319;
HTR2B,P62873,Guanine nucleotide-binding protein G(I)/G(S)/G(T) subunit beta-1 (Transducin beta chain 1),,"FUNCTION: Guanine nucleotide-binding proteins (G proteins) are involved as a modulator or transducer in various transmembrane signaling systems (PubMed:29925951, PubMed:33762731, PubMed:34239069, PubMed:35610220, PubMed:35714614, PubMed:35835867, PubMed:36087581, PubMed:36989299, PubMed:37327704, PubMed:37935376, PubMed:37935377, PubMed:37963465, PubMed:37991948, PubMed:38168118, PubMed:38552625). The beta and gamma chains are required for the GTPase activity, for replacement of GDP by GTP, and for G protein-effector interaction (PubMed:29925951, PubMed:33762731, PubMed:34239069, PubMed:35610220, PubMed:35714614, PubMed:35835867, PubMed:36087581, PubMed:36989299, PubMed:37327704, PubMed:37935376, PubMed:37935377, PubMed:37963465, PubMed:38168118, PubMed:38552625). {ECO:0000269|PubMed:29925951, ECO:0000269|PubMed:33762731, ECO:0000269|PubMed:34239069, ECO:0000269|PubMed:35610220, ECO:0000269|PubMed:35714614, ECO:0000269|PubMed:35835867, ECO:0000269|PubMed:36087581, ECO:0000269|PubMed:36989299, ECO:0000269|PubMed:37327704, ECO:0000269|PubMed:37935376, ECO:0000269|PubMed:37935377, ECO:0000269|PubMed:37963465, ECO:0000269|PubMed:37991948, ECO:0000269|PubMed:38168118, ECO:0000269|PubMed:38552625}.",,,GTPase activity [GO:0003924]; GTPase binding [GO:0051020]; protein-containing complex binding [GO:0044877]; signaling receptor complex adaptor activity [GO:0030159],"DISEASE: Intellectual developmental disorder, autosomal dominant 42 (MRD42) [MIM:616973]: A disorder characterized by significantly below average general intellectual functioning associated with impairments in adaptive behavior and manifested during the developmental period. MRD42 patients manifest global developmental delay commonly accompanied by hypotonia, seizures of various types, ophthalmological manifestations, and poor growth. {ECO:0000269|PubMed:25485910, ECO:0000269|PubMed:27108799, ECO:0000269|PubMed:27668284, ECO:0000269|PubMed:28087732}. Note=The disease is caused by variants affecting the gene represented in this entry.",CHEMBL3883319;
HTR2B,P28335,5-hydroxytryptamine receptor 2C (5-HT-2C) (5-HT2C) (5-HTR2C) (5-hydroxytryptamine receptor 1C) (5-HT-1C) (5-HT1C) (Serotonin receptor 2C),HTR1C,"FUNCTION: G-protein coupled receptor for 5-hydroxytryptamine (serotonin) (PubMed:12970106, PubMed:18703043, PubMed:19057895, PubMed:29398112, PubMed:7895773). Also functions as a receptor for various drugs and psychoactive substances, including ergot alkaloid derivatives, 1-2,5,-dimethoxy-4-iodophenyl-2-aminopropane (DOI) and lysergic acid diethylamide (LSD) (PubMed:19057895, PubMed:29398112). Ligand binding causes a conformation change that triggers signaling via guanine nucleotide-binding proteins (G proteins) and modulates the activity of downstream effectors (PubMed:18703043, PubMed:29398112). HTR2C is coupled to G(q)/G(11) G alpha proteins and activates phospholipase C-beta, releasing diacylglycerol (DAG) and inositol 1,4,5-trisphosphate (IP3) second messengers that modulate the activity of phosphatidylinositol 3-kinase and promote the release of Ca(2+) ions from intracellular stores, respectively (PubMed:18703043, PubMed:29398112). Beta-arrestin family members inhibit signaling via G proteins and mediate activation of alternative signaling pathways (PubMed:29398112). Regulates neuronal activity via the activation of short transient receptor potential calcium channels in the brain, and thereby modulates the activation of pro-opiomelanocortin neurons and the release of CRH that then regulates the release of corticosterone (By similarity). Plays a role in the regulation of appetite and eating behavior, responses to anxiogenic stimuli and stress (By similarity). Plays a role in insulin sensitivity and glucose homeostasis (By similarity). {ECO:0000250|UniProtKB:P34968, ECO:0000269|PubMed:12970106, ECO:0000269|PubMed:18703043, ECO:0000269|PubMed:19057895, ECO:0000269|PubMed:29398112, ECO:0000269|PubMed:7895773}.",,,"1-(4-iodo-2,5-dimethoxyphenyl)propan-2-amine binding [GO:0071886]; G protein-coupled serotonin receptor activity [GO:0004993]; Gq/11-coupled serotonin receptor activity [GO:0001587]; identical protein binding [GO:0042802]; neurotransmitter receptor activity [GO:0030594]; serotonin binding [GO:0051378]; serotonin receptor activity [GO:0099589]",,CHEMBL225;
HTR2B,P21728,D(1A) dopamine receptor (Dopamine D1 receptor),,FUNCTION: Dopamine receptor whose activity is mediated by G proteins which activate adenylyl cyclase.,,,"arrestin family protein binding [GO:1990763]; dopamine binding [GO:0035240]; dopamine neurotransmitter receptor activity [GO:0004952]; dopamine neurotransmitter receptor activity, coupled via Gs [GO:0001588]; G protein-coupled receptor activity [GO:0004930]; G-protein alpha-subunit binding [GO:0001965]; heterotrimeric G-protein binding [GO:0032795]",,CHEMBL2056;
HTR2B,O95264,5-hydroxytryptamine receptor 3B (5-HT3-B) (5-HT3B) (Serotonin receptor 3B),,"FUNCTION: Forms serotonin (5-hydroxytryptamine/5-HT3)-activated cation-selective channel complexes, which when activated cause fast, depolarizing responses in neurons. {ECO:0000269|PubMed:10521471, ECO:0000269|PubMed:12867984, ECO:0000269|PubMed:17392525, ECO:0000269|PubMed:9950429}.",,,excitatory extracellular ligand-gated monoatomic ion channel activity [GO:0005231]; serotonin-gated monoatomic cation channel activity [GO:0022850]; transmitter-gated monoatomic ion channel activity involved in regulation of postsynaptic membrane potential [GO:1904315],,CHEMBL3895;
HTR2B,P28223,5-hydroxytryptamine receptor 2A (5-HT-2) (5-HT-2A) (Serotonin receptor 2A),HTR2,"FUNCTION: G-protein coupled receptor for 5-hydroxytryptamine (serotonin) (PubMed:1330647, PubMed:18703043, PubMed:19057895, PubMed:21645528, PubMed:22300836, PubMed:35084960, PubMed:38552625). Also functions as a receptor for various drugs and psychoactive substances, including mescaline, psilocybin, 1-(2,5-dimethoxy-4-iodophenyl)-2-aminopropane (DOI) and lysergic acid diethylamide (LSD) (PubMed:28129538, PubMed:35084960). Ligand binding causes a conformation change that triggers signaling via guanine nucleotide-binding proteins (G proteins) and modulates the activity of downstream effectors (PubMed:28129538, PubMed:35084960). HTR2A is coupled to G(q)/G(11) G alpha proteins and activates phospholipase C-beta, releasing diacylglycerol (DAG) and inositol 1,4,5-trisphosphate (IP3) second messengers that modulate the activity of phosphatidylinositol 3-kinase and promote the release of Ca(2+) ions from intracellular stores, respectively (PubMed:18703043, PubMed:28129538, PubMed:35084960). Beta-arrestin family members inhibit signaling via G proteins and mediate activation of alternative signaling pathways (PubMed:28129538, PubMed:35084960). Affects neural activity, perception, cognition and mood (PubMed:18297054). Plays a role in the regulation of behavior, including responses to anxiogenic situations and psychoactive substances. Plays a role in intestinal smooth muscle contraction, and may play a role in arterial vasoconstriction (By similarity). {ECO:0000250|UniProtKB:P35363, ECO:0000269|PubMed:1330647, ECO:0000269|PubMed:18297054, ECO:0000269|PubMed:18703043, ECO:0000269|PubMed:19057895, ECO:0000269|PubMed:21645528, ECO:0000269|PubMed:22300836, ECO:0000269|PubMed:28129538, ECO:0000269|PubMed:35084960, ECO:0000269|PubMed:38552625}.; FUNCTION: (Microbial infection) Acts as a receptor for human JC polyomavirus/JCPyV. {ECO:0000269|PubMed:24089568}.",,,"1-(4-iodo-2,5-dimethoxyphenyl)propan-2-amine binding [GO:0071886]; G protein-coupled serotonin receptor activity [GO:0004993]; Gq/11-coupled serotonin receptor activity [GO:0001587]; identical protein binding [GO:0042802]; neurotransmitter receptor activity [GO:0030594]; protein tyrosine kinase activator activity [GO:0030296]; protein-containing complex binding [GO:0044877]; serotonin binding [GO:0051378]; serotonin receptor activity [GO:0099589]; virus receptor activity [GO:0001618]",,CHEMBL224;
HTR2B,P21397,Amine oxidase [flavin-containing] A (EC 1.4.3.21) (EC 1.4.3.4) (Monoamine oxidase type A) (MAO-A),,"FUNCTION: Catalyzes the oxidative deamination of primary and some secondary amine such as neurotransmitters, with concomitant reduction of oxygen to hydrogen peroxide and has important functions in the metabolism of neuroactive and vasoactive amines in the central nervous system and peripheral tissues (PubMed:18391214, PubMed:20493079, PubMed:24169519, PubMed:8316221). Preferentially oxidizes serotonin (PubMed:20493079, PubMed:24169519). Also catalyzes the oxidative deamination of kynuramine to 3-(2-aminophenyl)-3-oxopropanal that can spontaneously condense to 4-hydroxyquinoline (By similarity). {ECO:0000250|UniProtKB:P21396, ECO:0000269|PubMed:18391214, ECO:0000269|PubMed:20493079, ECO:0000269|PubMed:24169519, ECO:0000269|PubMed:8316221}.",,,aliphatic amine oxidase activity [GO:0052595]; flavin adenine dinucleotide binding [GO:0050660]; monoamine oxidase activity [GO:0097621]; primary methylamine oxidase activity [GO:0008131],"DISEASE: Brunner syndrome (BRNRS) [MIM:300615]: A form of X-linked non-dysmorphic mild intellectual disability. Male patients are affected by borderline intellectual deficit and exhibit abnormal behavior, including disturbed regulation of impulsive aggression. Obligate female carriers have normal intelligence and behavior. {ECO:0000269|PubMed:8211186}. Note=The disease is caused by variants affecting the gene represented in this entry.",CHEMBL1951;
