STAR,Q9Y5P4,Ceramide transfer protein (hCERT) (Collagen type IV alpha-3-binding protein) (Goodpasture antigen-binding protein) (GPBP) (START domain-containing protein 11) (StARD11) (StAR-related lipid transfer protein 11),CERT COL4A3BP STARD11,"FUNCTION: Shelters ceramides and diacylglycerol lipids inside its START domain and mediates the intracellular trafficking of ceramides and diacylglycerol lipids in a non-vesicular manner. {ECO:0000269|PubMed:14685229, ECO:0000269|PubMed:17591919, ECO:0000269|PubMed:18184806, ECO:0000269|PubMed:20036255}.",,,ceramide 1-phosphate binding [GO:1902387]; ceramide 1-phosphate transfer activity [GO:1902388]; ceramide binding [GO:0097001]; ceramide transfer activity [GO:0120017]; identical protein binding [GO:0042802]; kinase activity [GO:0016301]; phosphatidylinositol-4-phosphate binding [GO:0070273],"DISEASE: Intellectual developmental disorder, autosomal dominant 34 (MRD34) [MIM:616351]: A disorder characterized by significantly below average general intellectual functioning associated with impairments in adaptive behavior and manifested during the developmental period. {ECO:0000269|PubMed:25356899, ECO:0000269|PubMed:25533962}. Note=The disease is caused by variants affecting the gene represented in this entry.",CHEMBL3399913;
STAR,Q96QB1,Rho GTPase-activating protein 7 (Deleted in liver cancer 1 protein) (DLC-1) (HP protein) (Rho-type GTPase-activating protein 7) (START domain-containing protein 12) (StARD12) (StAR-related lipid transfer protein 12),ARHGAP7 KIAA1723 STARD12,"FUNCTION: Functions as a GTPase-activating protein for the small GTPases RHOA, RHOB, RHOC and CDC42, terminating their downstream signaling. This induces morphological changes and detachment through cytoskeletal reorganization, playing a critical role in biological processes such as cell migration and proliferation. Also functions in vivo as an activator of the phospholipase PLCD1. Active DLC1 increases cell migration velocity but reduces directionality. Required for growth factor-induced epithelial cell migration; in resting cells, interacts with TNS3 while PTEN interacts with the p85 regulatory subunit of the PI3K kinase complex but growth factor stimulation induces phosphorylation of TNS3 and PTEN, causing them to change their binding preference so that PTEN interacts with DLC1 and TNS3 interacts with p85 (PubMed:26166433). The PTEN-DLC1 complex translocates to the posterior of migrating cells to activate RHOA while the TNS3-p85 complex translocates to the leading edge of migrating cells to promote RAC1 activation (PubMed:26166433). {ECO:0000269|PubMed:18786931, ECO:0000269|PubMed:19170769, ECO:0000269|PubMed:19710422, ECO:0000269|PubMed:26166433}.",,,GTPase activator activity [GO:0005096]; lipid binding [GO:0008289]; SH2 domain binding [GO:0042169],,
STAR,Q3KR37,Protein Aster-B (GRAM domain-containing protein 1B),KIAA1201,"FUNCTION: Cholesterol transporter that mediates non-vesicular transport of cholesterol from the plasma membrane (PM) to the endoplasmic reticulum (ER) (By similarity). Contains unique domains for binding cholesterol and the PM, thereby serving as a molecular bridge for the transfer of cholesterol from the PM to the ER (By similarity). Plays a crucial role in cholesterol homeostasis in the adrenal gland and has the unique ability to localize to the PM based on the level of membrane cholesterol (By similarity). In lipid-poor conditions localizes to the ER membrane and in response to excess cholesterol in the PM is recruited to the endoplasmic reticulum-plasma membrane contact sites (EPCS) which is mediated by the GRAM domain (By similarity). At the EPCS, the sterol-binding VASt/ASTER domain binds to the cholesterol in the PM and facilitates its transfer from the PM to ER (By similarity). {ECO:0000250|UniProtKB:Q80TI0}.",,,cholesterol binding [GO:0015485]; cholesterol transfer activity [GO:0120020]; phosphatidic acid binding [GO:0070300]; phosphatidylserine binding [GO:0001786],,
STAR,Q96CP6,Protein Aster-A (GRAM domain-containing protein 1A),KIAA1533,"FUNCTION: Cholesterol transporter that mediates non-vesicular transport of cholesterol from the plasma membrane (PM) to the endoplasmic reticulum (ER) (By similarity). Contains unique domains for binding cholesterol and the PM, thereby serving as a molecular bridge for the transfer of cholesterol from the PM to the ER (By similarity). Plays a crucial role in cholesterol homeostasis and has the unique ability to localize to the PM based on the level of membrane cholesterol (By similarity). In lipid-poor conditions localizes to the ER membrane and in response to excess cholesterol in the PM is recruited to the endoplasmic reticulum-plasma membrane contact sites (EPCS) which is mediated by the GRAM domain (By similarity). At the EPCS, the sterol-binding VASt/ASTER domain binds to the cholesterol in the PM and facilitates its transfer from the PM to ER (By similarity). May play a role in tumor progression (By similarity). Plays a role in autophagy regulation and is required for biogenesis of the autophagosome (PubMed:31222192). This function in autophagy requires its cholesterol-transfer activity (PubMed:31222192). {ECO:0000250|UniProtKB:Q8VEF1, ECO:0000269|PubMed:31222192}.",,,cholesterol binding [GO:0015485]; cholesterol transfer activity [GO:0120020],,
STAR,P0DJD4,"RNA-binding motif protein, Y chromosome, family 1 member C",,FUNCTION: RNA-binding protein involved in pre-mRNA splicing. Required for sperm development. Acts additively with TRA2B to promote exon 7 inclusion of the survival motor neuron SMN. Binds non-specifically to mRNAs.,,,identical protein binding [GO:0042802]; RNA binding [GO:0003723],,
STAR,Q8IZR5,CKLF-like MARVEL transmembrane domain-containing protein 4 (Chemokine-like factor superfamily member 4),CKLFSF4,"FUNCTION: Acts as a backup for CMTM6 to regulate plasma membrane expression of PD-L1/CD274, an immune inhibitory ligand critical for immune tolerance to self and antitumor immunity. May protect PD-L1/CD274 from being polyubiquitinated and targeted for degradation. {ECO:0000269|PubMed:28813410}.",,,,,
STAR,P51843,Nuclear receptor subfamily 0 group B member 1 (DSS-AHC critical region on the X chromosome protein 1) (Nuclear receptor DAX-1),AHC DAX1,"FUNCTION: Nuclear receptor that lacks a DNA-binding domain and acts as a corepressor that inhibits the transcriptional activity of other nuclear receptors through heterodimeric interactions (PubMed:12482977, PubMed:32433991). Component of a cascade required for the development of the hypothalamic-pituitary-adrenal-gonadal axis (PubMed:7990953, PubMed:8675564). May also have a role in the development of the embryo and in the maintenance of embryonic stem cell pluripotency (By similarity). {ECO:0000250|UniProtKB:Q61066, ECO:0000269|PubMed:12482977, ECO:0000269|PubMed:32433991, ECO:0000269|PubMed:7990953, ECO:0000269|PubMed:8675564}.",,,AF-2 domain binding [GO:0050682]; DNA hairpin binding [GO:0032448]; nuclear receptor binding [GO:0016922]; protein domain specific binding [GO:0019904]; protein homodimerization activity [GO:0042803]; RNA binding [GO:0003723]; RNA polymerase II-specific DNA-binding transcription factor binding [GO:0061629]; transcription corepressor activity [GO:0003714],"DISEASE: Adrenal hypoplasia, congenital (AHC) [MIM:300200]: A disorder of adrenal gland development characterized by absence of the permanent zone of the adrenal cortex, structural disorganization of the adrenal glands, adrenal insufficiency and profound hormonal deficiencies. AHC patients manifest primary adrenal failure usually in early infancy, and hypogonadotropic hypogonadism leading to absent or incomplete sexual maturation. AHC can be inherited in an X-linked or autosomal recessive pattern. {ECO:0000269|PubMed:10323730, ECO:0000269|PubMed:10341858, ECO:0000269|PubMed:10675358, ECO:0000269|PubMed:10848616, ECO:0000269|PubMed:11113848, ECO:0000269|PubMed:11443184, ECO:0000269|PubMed:11748852, ECO:0000269|PubMed:11788621, ECO:0000269|PubMed:12629128, ECO:0000269|PubMed:15800903, ECO:0000269|PubMed:7990958, ECO:0000269|PubMed:9003500, ECO:0000269|PubMed:9063431, ECO:0000269|PubMed:9360549, ECO:0000269|PubMed:9415399, ECO:0000269|PubMed:9529340}. Note=The disease is caused by variants affecting the gene represented in this entry.; DISEASE: 46,XY sex reversal 2 (SRXY2) [MIM:300018]: A condition characterized by male-to-female sex reversal in the presence of a normal 46,XY karyotype. {ECO:0000269|PubMed:9486644}. Note=The disease is caused by variants affecting the gene represented in this entry. XY individuals with a duplication of part of the short arm of the X chromosome and an intact SRY gene develop as females. The single X chromosome in these individuals does not undergo X-chromosome inactivation; therefore, these individuals presumably carry 2 active copies of genes, including the NR0B1 gene, in the duplicated region. Individuals with deletion of this region develop as males. Genes within the dosage-sensitive sex reversal region are, therefore, not essential for testis development, but, when present in a double dose, interfere with testis formation.",CHEMBL1795094;
STAR,O43896,Kinesin-like protein KIF1C,KIAA0706,FUNCTION: Motor required for the retrograde transport of Golgi vesicles to the endoplasmic reticulum. Has a microtubule plus end-directed motility. {ECO:0000269|PubMed:9685376}.,,,ATP binding [GO:0005524]; ATP hydrolysis activity [GO:0016887]; cytoskeletal motor activity [GO:0003774]; microtubule binding [GO:0008017]; plus-end-directed microtubule motor activity [GO:0008574]; RNA binding [GO:0003723],"DISEASE: Spastic ataxia 2, autosomal recessive (SPAX2) [MIM:611302]: A neurologic disorder characterized by cerebellar ataxia, dysarthria, and variable spasticity of the lower limbs. Cognition is not affected. {ECO:0000269|PubMed:24319291, ECO:0000269|PubMed:24482476}. Note=The disease is caused by variants affecting the gene represented in this entry.",
STAR,P08949,Neuromedin-B [Cleaved into: Neuromedin-B-32; Neuromedin-B],,"FUNCTION: Stimulates smooth muscle contraction (By similarity). Induces sighing by acting directly on the pre-Botzinger complex, a cluster of several thousand neurons in the ventrolateral medulla responsible for inspiration during respiratory activity (By similarity). Contributes to the induction of sneezing following exposure to chemical irritants or allergens which causes release of NMB by nasal sensory neurons and activation of NMBR-expressing neurons in the sneeze-evoking region of the brainstem (By similarity). These in turn activate neurons of the caudal ventral respiratory group, giving rise to the sneezing response (By similarity). Contributes to induction of acute itch, possibly through activation of the NMBR receptor on dorsal root ganglion neurons (By similarity). Increases expression of NMBR and steroidogenic mediators STAR, CYP11A1 and HSD3B1 in Leydig cells, induces secretion of testosterone by Leydig cells and also promotes Leydig cell proliferation (By similarity). Plays a role in the innate immune response to influenza A virus infection by enhancing interferon alpha expression and reducing expression of IL6 (PubMed:31601264). Plays a role in CSF1-induced proliferation of osteoclast precursors by contributing to the positive regulation of the expression of the CSF1 receptor CSF1R (By similarity). {ECO:0000250|UniProtKB:P01297, ECO:0000250|UniProtKB:Q9CR53, ECO:0000269|PubMed:31601264}.",,,hormone activity [GO:0005179]; neuromedin B receptor binding [GO:0031710]; neuropeptide hormone activity [GO:0005184],,
FST,P19883,Follistatin (FS) (Activin-binding protein),,FUNCTION: Binds directly to activin and functions as an activin antagonist. Specific inhibitor of the biosynthesis and secretion of pituitary follicle stimulating hormone (FSH).,,,activin binding [GO:0048185]; activin receptor antagonist activity [GO:0038102]; heparan sulfate proteoglycan binding [GO:0043395],,
FST,O95390,Growth/differentiation factor 11 (GDF-11) (Bone morphogenetic protein 11) (BMP-11),BMP11,"FUNCTION: Secreted signal that acts globally to regulate anterior/posterior axial patterning during development. May play critical roles in patterning both mesodermal and neural tissues (By similarity). It is required for proper vertebral patterning and orofacial development (PubMed:31215115). Signals through activin receptors type-2, ACVR2A and ACVR2B, and activin receptors type-1, ACVR1B, ACVR1C and TGFBR1 leading to the phosphorylation of SMAD2 and SMAD3 (PubMed:28257634). {ECO:0000250|UniProtKB:Q9Z1W4, ECO:0000269|PubMed:28257634, ECO:0000269|PubMed:31215115}.",,,cytokine activity [GO:0005125]; growth factor activity [GO:0008083],"DISEASE: Vertebral hypersegmentation and orofacial anomalies (VHO) [MIM:619122]: An autosomal dominant disease characterized by supernumerary ribs, supernumerary cervical, thoracic and/or lumbar vertebrae, and orofacial anomalies such as cleft lip with or without cleft palate in most patients. {ECO:0000269|PubMed:31215115}. Note=The disease may be caused by variants affecting the gene represented in this entry.",
FST,P08476,Inhibin beta A chain (Activin beta-A chain) (Erythroid differentiation protein) (EDF),,"FUNCTION: Inhibins and activins inhibit and activate, respectively, the secretion of follitropin by the pituitary gland. Inhibins/activins are involved in regulating a number of diverse functions such as hypothalamic and pituitary hormone secretion, gonadal hormone secretion, germ cell development and maturation, erythroid differentiation, insulin secretion, nerve cell survival, embryonic axial development or bone growth, depending on their subunit composition. Inhibins appear to oppose the functions of activins.",,,cytokine activity [GO:0005125]; growth factor activity [GO:0008083]; hormone activity [GO:0005179]; identical protein binding [GO:0042802]; peptide hormone binding [GO:0017046]; protein-containing complex binding [GO:0044877]; type II activin receptor binding [GO:0070699],,CHEMBL3588735;
FST,P09529,Inhibin beta B chain (Activin beta-B chain),,"FUNCTION: Inhibins and activins inhibit and activate, respectively, the secretion of follitropin by the pituitary gland. Inhibins/activins are involved in regulating a number of diverse functions such as hypothalamic and pituitary hormone secretion, gonadal hormone secretion, germ cell development and maturation, erythroid differentiation, insulin secretion, nerve cell survival, embryonic axial development or bone growth, depending on their subunit composition. Inhibins appear to oppose the functions of activins.",,,cytokine activity [GO:0005125]; growth factor activity [GO:0008083]; hormone activity [GO:0005179]; host cell surface receptor binding [GO:0046789]; protein homodimerization activity [GO:0042803],,
FST,O95633,Follistatin-related protein 3 (Follistatin-like protein 3) (Follistatin-related gene protein),FLRG,"FUNCTION: Isoform 1 or the secreted form is a binding and antagonizing protein for members of the TGF-beta family, such as activin, BMP2 and MSTN. Inhibits activin A-, activin B-, BMP2- and MSDT-induced cellular signaling; more effective on activin A than on activin B. Involved in bone formation; inhibits osteoclast differentiation. Involved in hematopoiesis; involved in differentiation of hemopoietic progenitor cells, increases hematopoietic cell adhesion to fibronectin and seems to contribute to the adhesion of hematopoietic precursor cells to the bone marrow stroma. Isoform 2 or the nuclear form is probably involved in transcriptional regulation via interaction with MLLT10. {ECO:0000269|PubMed:11948405, ECO:0000269|PubMed:15451575, ECO:0000269|PubMed:15574124, ECO:0000269|PubMed:16336961, ECO:0000269|PubMed:17868029, ECO:0000269|PubMed:17878677}.",,,activin binding [GO:0048185]; fibronectin binding [GO:0001968],DISEASE: Note=A chromosomal aberration involving FSTL3 is found in a case of B-cell chronic lymphocytic leukemia. Translocation t(11;19)(q13;p13) with CCDN1. {ECO:0000269|PubMed:9671416}.,
FST,O60383,Growth/differentiation factor 9 (GDF-9),,"FUNCTION: Required for ovarian folliculogenesis. Promotes primordial follicle development. Stimulates granulosa cell proliferation. Promotes cell transition from G0/G1 to S and G2/M phases, through an increase of CCND1 and CCNE1 expression, and RB1 phosphorylation. It regulates STAR expression and cAMP-dependent progesterone release in granulosa and thecal cells. Attenuates the suppressive effects of activin A on STAR expression and progesterone production by increasing the expression of inhibin B. It suppresses FST and FSTL3 production in granulosa-lutein cells. {ECO:0000269|PubMed:12050262, ECO:0000269|PubMed:19366876, ECO:0000269|PubMed:20660033, ECO:0000269|PubMed:21632818, ECO:0000269|PubMed:21829661}.",,,cytokine activity [GO:0005125]; growth factor activity [GO:0008083],"DISEASE: Note=Altered GDF9 function may be involved in ovarian disorders and contribute to the likelihood of dizygotic twinning. {ECO:0000269|PubMed:16954162}.; DISEASE: Premature ovarian failure 14 (POF14) [MIM:618014]: An ovarian disorder defined as the cessation of ovarian function under the age of 40 years. It is characterized by oligomenorrhea or amenorrhea, in the presence of elevated levels of serum gonadotropins and low estradiol. {ECO:0000269|PubMed:16278619, ECO:0000269|PubMed:16645022, ECO:0000269|PubMed:16954162, ECO:0000269|PubMed:17156781, ECO:0000269|PubMed:17482612, ECO:0000269|PubMed:19438907, ECO:0000269|PubMed:29044499}. Note=The disease is caused by variants affecting the gene represented in this entry.",
FST,Q14689,Disco-interacting protein 2 homolog A (DIP2 homolog A) (EC 6.2.1.1),C21orf106 DIP2 KIAA0184,"FUNCTION: Catalyzes the de novo synthesis of acetyl-CoA in vitro (By similarity). Promotes acetylation of CTTN, possibly by providing the acetyl donor, ensuring correct dendritic spine morphology and synaptic transmission (By similarity). Binds to follistatin-related protein FSTL1 and may act as a cell surface receptor for FSTL1, contributing to AKT activation and subsequent FSTL1-induced survival and function of endothelial cells and cardiac myocytes (PubMed:20054002). {ECO:0000250|UniProtKB:Q8BWT5, ECO:0000269|PubMed:20054002}.",,,acetate-CoA ligase activity [GO:0003987],,
FST,P58012,Forkhead box protein L2,,"FUNCTION: Transcriptional regulator. Critical factor essential for ovary differentiation and maintenance, and repression of the genetic program for somatic testis determination. Prevents trans-differentiation of ovary to testis through transcriptional repression of the Sertoli cell-promoting gene SOX9 (By similarity). Has apoptotic activity in ovarian cells. Suppresses ESR1-mediated transcription of PTGS2/COX2 stimulated by tamoxifen (By similarity). Is a regulator of CYP19 expression (By similarity). Participates in SMAD3-dependent transcription of FST via the intronic SMAD-binding element (By similarity). Is a transcriptional repressor of STAR. Activates SIRT1 transcription under cellular stress conditions. Activates transcription of OSR2. {ECO:0000250, ECO:0000269|PubMed:16153597, ECO:0000269|PubMed:19010791, ECO:0000269|PubMed:19429596, ECO:0000269|PubMed:19744555}.",,,"cysteine-type endopeptidase regulator activity involved in apoptotic process [GO:0043028]; DNA binding [GO:0003677]; DNA-binding transcription activator activity, RNA polymerase II-specific [GO:0001228]; DNA-binding transcription factor activity [GO:0003700]; DNA-binding transcription factor activity, RNA polymerase II-specific [GO:0000981]; nuclear estrogen receptor binding [GO:0030331]; RNA polymerase II cis-regulatory region sequence-specific DNA binding [GO:0000978]; sequence-specific double-stranded DNA binding [GO:1990837]; ubiquitin conjugating enzyme binding [GO:0031624]","DISEASE: Blepharophimosis, ptosis, and epicanthus inversus syndrome (BPES) [MIM:110100]: A disorder characterized by eyelid dysplasia, small palpebral fissures, drooping eyelids and a skin fold curving in the mediolateral direction, inferior to the inner canthus. In type I BPSE (BPES1) eyelid abnormalities are associated with female infertility. Affected females show an ovarian deficit due to primary amenorrhea or to premature ovarian failure (POF). In type II BPSE (BPES2) affected individuals show only the eyelid defects. {ECO:0000269|PubMed:11175783, ECO:0000269|PubMed:11468277, ECO:0000269|PubMed:12400065, ECO:0000269|PubMed:12529855, ECO:0000269|PubMed:12630957, ECO:0000269|PubMed:12938087, ECO:0000269|PubMed:15257268, ECO:0000269|PubMed:16454982, ECO:0000269|PubMed:17089161, ECO:0000269|PubMed:18372316, ECO:0000269|PubMed:18484667, ECO:0000269|PubMed:18642388, ECO:0000269|PubMed:22159675, ECO:0000269|Ref.2}. Note=The disease is caused by variants affecting the gene represented in this entry. There is a mutational hotspot in the region coding for the poly-Ala domain, since 30% of all mutations in the ORF lead to poly-Ala expansions, resulting mainly in BPES type II.; DISEASE: Premature ovarian failure 3 (POF3) [MIM:608996]: An ovarian disorder defined as the cessation of ovarian function under the age of 40 years. It is characterized by oligomenorrhea or amenorrhea, in the presence of elevated levels of serum gonadotropins and low estradiol. {ECO:0000269|PubMed:12149404, ECO:0000269|PubMed:19429596}. Note=The disease is caused by variants affecting the gene represented in this entry.",
FST,Q9BXY8,Protein BEX2 (Brain-expressed X-linked protein 2) (hBex2),,"FUNCTION: Regulator of mitochondrial apoptosis and G1 cell cycle in breast cancer (PubMed:19711341). Protects the breast cancer cells against mitochondrial apoptosis and this effect is mediated through the modulation of BCL2 protein family, which involves the positive regulation of anti-apoptotic member BCL2 and the negative regulation of pro-apoptotic members BAD, BAK1 and PUMA (PubMed:19711341). Required for the normal cell cycle progression during G1 in breast cancer cells through the regulation of CCND1 and CDKN1A (PubMed:19711341). Regulates the level of PP2A regulatory subunit B and PP2A phosphatase activity (PubMed:19711341). In absence of reductive stress, acts as a pseudosubstrate for the CRL2(FEM1B) complex: associates with FEM1B via zinc, thereby preventing association between FEM1B and its substrates (By similarity). {ECO:0000250|UniProtKB:Q9WTZ8, ECO:0000269|PubMed:19711341}.",,,metal ion binding [GO:0046872]; molecular function inhibitor activity [GO:0140678]; signaling receptor binding [GO:0005102],,
FST,P10599,Thioredoxin (Trx) (ATL-derived factor) (ADF) (Surface-associated sulphydryl protein) (SASP) (allergen Hom s Trx),TRDX TRX TRX1,"FUNCTION: Participates in various redox reactions through the reversible oxidation of its active center dithiol to a disulfide and catalyzes dithiol-disulfide exchange reactions (PubMed:17182577, PubMed:19032234, PubMed:2176490). Plays a role in the reversible S-nitrosylation of cysteine residues in target proteins, and thereby contributes to the response to intracellular nitric oxide. Nitrosylates the active site Cys of CASP3 in response to nitric oxide (NO), and thereby inhibits caspase-3 activity (PubMed:16408020, PubMed:17606900). Induces the FOS/JUN AP-1 DNA-binding activity in ionizing radiation (IR) cells through its oxidation/reduction status and stimulates AP-1 transcriptional activity (PubMed:11118054, PubMed:9108029). {ECO:0000269|PubMed:11118054, ECO:0000269|PubMed:16408020, ECO:0000269|PubMed:17182577, ECO:0000269|PubMed:17606900, ECO:0000269|PubMed:19032234, ECO:0000269|PubMed:2176490, ECO:0000269|PubMed:9108029}.; FUNCTION: ADF augments the expression of the interleukin-2 receptor TAC (IL2R/P55).","ACT_SITE 32; /note=""Nucleophile""; /evidence=""ECO:0000269|PubMed:9108029""; ACT_SITE 35; /note=""Nucleophile""; /evidence=""ECO:0000269|PubMed:9108029""",,protein homodimerization activity [GO:0042803]; protein-disulfide reductase (NAD(P)H) activity [GO:0047134]; protein-disulfide reductase activity [GO:0015035]; RNA binding [GO:0003723]; thioredoxin-disulfide reductase (NADPH) activity [GO:0004791],,CHEMBL2010624;
FST,Q96SQ5,Zinc finger protein 587,,FUNCTION: May be involved in transcriptional regulation.,,,"DNA-binding transcription factor activity, RNA polymerase II-specific [GO:0000981]; metal ion binding [GO:0046872]; RNA polymerase II cis-regulatory region sequence-specific DNA binding [GO:0000978]",,
