SELP,Q9NY15,"Stabilin-1 (Fasciclin, EGF-like, laminin-type EGF-like and link domain-containing scavenger receptor 1) (FEEL-1) (MS-1 antigen)",FEEL1 KIAA0246,"FUNCTION: Acts as a scavenger receptor for acetylated low density lipoprotein. Binds to both Gram-positive and Gram-negative bacteria and may play a role in defense against bacterial infection. When inhibited in endothelial tube formation assays, there is a marked decrease in cell-cell interactions, suggesting a role in angiogenesis. Involved in the delivery of newly synthesized CHID1/SI-CLP from the biosynthetic compartment to the endosomal/lysosomal system. {ECO:0000269|PubMed:12077138, ECO:0000269|PubMed:16357325}.",,,calcium ion binding [GO:0005509]; hyaluronic acid binding [GO:0005540]; low-density lipoprotein particle binding [GO:0030169]; low-density lipoprotein particle receptor activity [GO:0005041]; protein-disulfide reductase activity [GO:0015035]; scavenger receptor activity [GO:0005044],DISEASE: Hyperferritinemia (HRFT) [MIM:620729]: An autosomal recessive condition characterized by increased serum ferritin levels in the absence of iron overload or other clinical symptoms. {ECO:0000269|PubMed:37490907}. Note=The disease may be caused by variants affecting the gene represented in this entry.,
SELP,Q9Y5Y7,Lymphatic vessel endothelial hyaluronic acid receptor 1 (LYVE-1) (Cell surface retention sequence-binding protein 1) (CRSBP-1) (Extracellular link domain-containing protein 1) (Hyaluronic acid receptor),CRSBP1 HAR XLKD1,"FUNCTION: Ligand-specific transporter trafficking between intracellular organelles (TGN) and the plasma membrane. Plays a role in autocrine regulation of cell growth mediated by growth regulators containing cell surface retention sequence binding (CRS). May act as a hyaluronan (HA) transporter, either mediating its uptake for catabolism within lymphatic endothelial cells themselves, or its transport into the lumen of afferent lymphatic vessels for subsequent re-uptake and degradation in lymph nodes (PubMed:10037799). Binds to pericelluar hyaluronan matrices deposited on the surface of leukocytes and facilitates cell adhesion and migration through lymphatic endothelium (PubMed:26823460). {ECO:0000269|PubMed:10037799, ECO:0000269|PubMed:26823460}.",,,cargo receptor activity [GO:0038024]; hyaluronic acid binding [GO:0005540]; signaling receptor activity [GO:0038023]; transmembrane signaling receptor activity [GO:0004888],,
SELP,O75093,Slit homolog 1 protein (Slit-1) (Multiple epidermal growth factor-like domains protein 4) (Multiple EGF-like domains protein 4),KIAA0813 MEGF4 SLIL1,"FUNCTION: Thought to act as molecular guidance cue in cellular migration, and function appears to be mediated by interaction with roundabout homolog receptors. During neural development involved in axonal navigation at the ventral midline of the neural tube and projection of axons to different regions (By similarity). SLIT1 and SLIT2 together seem to be essential for midline guidance in the forebrain by acting as repulsive signal preventing inappropriate midline crossing by axons projecting from the olfactory bulb. {ECO:0000250}.",,,calcium ion binding [GO:0005509]; heparan sulfate proteoglycan binding [GO:0043395]; heparin binding [GO:0008201]; Roundabout binding [GO:0048495],,
SELP,P49767,Vascular endothelial growth factor C (VEGF-C) (Flt4 ligand) (Flt4-L) (Vascular endothelial growth factor-related protein) (VRP),,"FUNCTION: Growth factor active in angiogenesis, and endothelial cell growth, stimulating their proliferation and migration and also has effects on the permeability of blood vessels. May function in angiogenesis of the venous and lymphatic vascular systems during embryogenesis, and also in the maintenance of differentiated lymphatic endothelium in adults. Binds and activates KDR/VEGFR2 and FLT4/VEGFR3 receptors. {ECO:0000269|PubMed:20145116}.",,,chemoattractant activity [GO:0042056]; growth factor activity [GO:0008083]; vascular endothelial growth factor receptor 3 binding [GO:0043185],"DISEASE: Lymphatic malformation 4 (LMPHM4) [MIM:615907]: A form of primary lymphedema, a disease characterized by swelling of body parts due to developmental anomalies and functional defects of the lymphatic system. Patients with lymphedema may suffer from recurrent local infections. LMPHM4 is an autosomal dominant form with onset at birth or in early childhood. Affected individuals manifest lymphedema of lower limbs with prominent veins, and impaired lymphatic uptake and drainage. Additional features are nail dysplasia, skin hyperkeratosis and papillomatosis. {ECO:0000269|PubMed:23410910, ECO:0000269|PubMed:24744435}. Note=The disease is caused by variants affecting the gene represented in this entry.",CHEMBL3714157;
SELP,A2VEC9,SCO-spondin (SCO-spondin pseudogene),KIAA2036 SSPO,FUNCTION: Involved in the modulation of neuronal aggregation (By similarity). May be involved in developmental events during the formation of the central nervous system (By similarity). {ECO:0000250|UniProtKB:P98167}.,,,peptidase inhibitor activity [GO:0030414],,
SELP,P08962,CD63 antigen (Granulophysin) (Lysosomal-associated membrane protein 3) (LAMP-3) (Lysosome integral membrane protein 1) (Limp1) (Melanoma-associated antigen ME491) (OMA81H) (Ocular melanoma-associated antigen) (Tetraspanin-30) (Tspan-30) (CD antigen CD63),MLA1 TSPAN30,"FUNCTION: Functions as a cell surface receptor for TIMP1 and plays a role in the activation of cellular signaling cascades. Plays a role in the activation of ITGB1 and integrin signaling, leading to the activation of AKT, FAK/PTK2 and MAP kinases. Promotes cell survival, reorganization of the actin cytoskeleton, cell adhesion, spreading and migration, via its role in the activation of AKT and FAK/PTK2. Plays a role in VEGFA signaling via its role in regulating the internalization of KDR/VEGFR2. Plays a role in intracellular vesicular transport processes, and is required for normal trafficking of the PMEL luminal domain that is essential for the development and maturation of melanocytes. Plays a role in the adhesion of leukocytes onto endothelial cells via its role in the regulation of SELP trafficking. May play a role in mast cell degranulation in response to Ms4a2/FceRI stimulation, but not in mast cell degranulation in response to other stimuli. {ECO:0000269|PubMed:16917503, ECO:0000269|PubMed:21803846, ECO:0000269|PubMed:21962903, ECO:0000269|PubMed:23632027, ECO:0000269|PubMed:24635319}.",,,,,CHEMBL3713303;
SELP,Q9NT68,"Teneurin-2 (Ten-2) (Protein Odd Oz/ten-m homolog 2) (Tenascin-M2) (Ten-m2) (Teneurin transmembrane protein 2) [Cleaved into: Ten-2, soluble form; Ten-2 intracellular domain (Ten-2 ICD)]",KIAA1127 ODZ2 TNM2,"FUNCTION: Involved in neural development, regulating the establishment of proper connectivity within the nervous system. Promotes the formation of filopodia and enlarged growth cone in neuronal cells. Induces homophilic cell-cell adhesion (By similarity). May function as a cellular signal transducer. {ECO:0000250, ECO:0000269|PubMed:21724987}.; FUNCTION: [Isoform 2]: Acts as a ligand of the ADGRL1 receptor. Mediates axon guidance and heterophilic cell-cell adhesion. {ECO:0000269|PubMed:21724987}.; FUNCTION: [Ten-2 intracellular domain]: Induces gene transcription inhibition. {ECO:0000250}.",,,calcium ion binding [GO:0005509]; cell adhesion molecule binding [GO:0050839]; protein heterodimerization activity [GO:0046982]; protein homodimerization activity [GO:0042803]; signaling receptor binding [GO:0005102],,
SELP,O75443,Alpha-tectorin,,"FUNCTION: One of the major non-collagenous components of the tectorial membrane (By similarity). The tectorial membrane is an extracellular matrix of the inner ear that covers the neuroepithelium of the cochlea and contacts the stereocilia bundles of specialized sensory hair cells. Sound induces movement of these hair cells relative to the tectorial membrane, deflects the stereocilia and leads to fluctuations in hair-cell membrane potential, transducing sound into electrical signals. {ECO:0000250}.",,,extracellular matrix structural constituent [GO:0005201],"DISEASE: Deafness, autosomal dominant, 12 (DFNA12) [MIM:601543]: A form of non-syndromic sensorineural hearing loss. Sensorineural deafness results from damage to the neural receptors of the inner ear, the nerve pathways to the brain, or the area of the brain that receives sound information. {ECO:0000269|PubMed:12746400, ECO:0000269|PubMed:9949200}. Note=The disease is caused by variants affecting the gene represented in this entry.; DISEASE: Deafness, autosomal recessive, 21 (DFNB21) [MIM:603629]: A form of non-syndromic sensorineural hearing loss. Sensorineural deafness results from damage to the neural receptors of the inner ear, the nerve pathways to the brain, or the area of the brain that receives sound information. {ECO:0000269|PubMed:12746400, ECO:0000269|PubMed:9949200}. Note=The disease is caused by variants affecting the gene represented in this entry.",
ADRA2C,P18825,Alpha-2C adrenergic receptor (Alpha-2 adrenergic receptor subtype C4) (Alpha-2C adrenoreceptor) (Alpha-2C adrenoceptor) (Alpha-2CAR),ADRA2L2 ADRA2RL2,FUNCTION: Alpha-2 adrenergic receptors mediate the catecholamine-induced inhibition of adenylate cyclase through the action of G proteins.,,,alpha-2A adrenergic receptor binding [GO:0031694]; alpha2-adrenergic receptor activity [GO:0004938]; epinephrine binding [GO:0051379]; guanyl-nucleotide exchange factor activity [GO:0005085]; protein heterodimerization activity [GO:0046982]; protein homodimerization activity [GO:0042803],,CHEMBL1916;
ADRA2C,Q9Y2B0,Protein canopy homolog 2 (MIR-interacting saposin-like protein) (Putative secreted protein Zsig9) (Transmembrane protein 4),MSAP TMEM4 ZSIG9,FUNCTION: Positive regulator of neurite outgrowth by stabilizing myosin regulatory light chain (MRLC). It prevents MIR-mediated MRLC ubiquitination and its subsequent proteasomal degradation.,,,,,
ADRA2C,Q96SB3,Neurabin-2 (Neurabin-II) (Protein phosphatase 1 regulatory subunit 9B) (Spinophilin),PPP1R6,"FUNCTION: Seems to act as a scaffold protein in multiple signaling pathways. Modulates excitatory synaptic transmission and dendritic spine morphology. Binds to actin filaments (F-actin) and shows cross-linking activity. Binds along the sides of the F-actin. May play an important role in linking the actin cytoskeleton to the plasma membrane at the synaptic junction. Believed to target protein phosphatase 1/PP1 to dendritic spines, which are rich in F-actin, and regulates its specificity toward ion channels and other substrates, such as AMPA-type and NMDA-type glutamate receptors. Plays a role in regulation of G-protein coupled receptor signaling, including dopamine D2 receptors and alpha-adrenergic receptors. May establish a signaling complex for dopaminergic neurotransmission through D2 receptors by linking receptors downstream signaling molecules and the actin cytoskeleton. Binds to ADRA1B and RGS2 and mediates regulation of ADRA1B signaling. May confer to Rac signaling specificity by binding to both, RacGEFs and Rac effector proteins. Probably regulates p70 S6 kinase activity by forming a complex with TIAM1 (By similarity). Required for hepatocyte growth factor (HGF)-induced cell migration. {ECO:0000250, ECO:0000269|PubMed:19151759}.",,,actin filament binding [GO:0051015]; D2 dopamine receptor binding [GO:0031749]; kinase binding [GO:0019900]; protein kinase activity [GO:0004672]; protein phosphatase 1 binding [GO:0008157]; protein phosphatase inhibitor activity [GO:0004864]; transmembrane transporter binding [GO:0044325],,
ADRA2C,Q8N4L8,Coiled-coil domain-containing protein 24,,,,,,,
ADRA2C,Q9Y6H1,Coiled-coil-helix-coiled-coil-helix domain-containing protein 2 (Aging-associated gene 10 protein) (HCV NS2 trans-regulated protein) (NS2TP),C7orf17,"FUNCTION: Transcription factor. Binds to the oxygen responsive element of COX4I2 and activates its transcription under hypoxia conditions (4% oxygen), as well as normoxia conditions (20% oxygen) (PubMed:23303788). {ECO:0000269|PubMed:23303788}.",,,DNA-binding transcription factor binding [GO:0140297]; sequence-specific DNA binding [GO:0043565],"DISEASE: Parkinson disease 22 (PARK22) [MIM:616710]: An autosomal dominant form of Parkinson disease, a complex neurodegenerative disorder characterized by bradykinesia, resting tremor, muscular rigidity and postural instability, as well as by a clinically significant response to treatment with levodopa. The pathology involves the loss of dopaminergic neurons in the substantia nigra and the presence of Lewy bodies (intraneuronal accumulations of aggregated proteins), in surviving neurons in various areas of the brain. {ECO:0000269|PubMed:25662902}. Note=The gene represented in this entry may be involved in disease pathogenesis.",
ADRA2C,Q7Z4N8,"Prolyl 4-hydroxylase subunit alpha-3 (4-PH alpha-3) (EC 1.14.11.2) (Procollagen-proline,2-oxoglutarate-4-dioxygenase subunit alpha-3)",,"FUNCTION: Catalyzes the post-translational formation of 4-hydroxyproline in -Xaa-Pro-Gly- sequences in collagens and other proteins. {ECO:0000269|PubMed:12874193, ECO:0000269|PubMed:14500733}.",,,iron ion binding [GO:0005506]; L-ascorbic acid binding [GO:0031418]; procollagen-proline 4-dioxygenase activity [GO:0004656],,
ADRA2C,Q2WGJ6,Kelch-like protein 38,C8orfK36,,,,ubiquitin-like ligase-substrate adaptor activity [GO:1990756],,
ADRA2C,O14770,Homeobox protein Meis2 (Meis1-related protein 1),MRG1,"FUNCTION: Involved in transcriptional regulation. Binds to HOX or PBX proteins to form dimers, or to a DNA-bound dimer of PBX and HOX proteins and thought to have a role in stabilization of the homeoprotein-DNA complex. Isoform 3 is required for the activity of a PDX1:PBX1b:MEIS2b complex in pancreatic acinar cells involved in the transcriptional activation of the ELA1 enhancer; the complex binds to the enhancer B element and cooperates with the transcription factor 1 complex (PTF1) bound to the enhancer A element; MEIS2 is not involved in complex DNA-binding. Probably in complex with PBX1, is involved in transcriptional regulation by KLF4. Isoform 3 and isoform 4 can bind to a EPHA8 promoter sequence containing the DNA motif 5'-CGGTCA-3'; in cooperation with a PBX protein (such as PBX2) is proposed to be involved in the transcriptional activation of EPHA8 in the developing midbrain. May be involved in regulation of myeloid differentiation. Can bind to the DNA sequence 5'-TGACAG-3'in the activator ACT sequence of the D(1A) dopamine receptor (DRD1) promoter and activate DRD1 transcription; isoform 5 cannot activate DRD1 transcription. {ECO:0000269|PubMed:10764806, ECO:0000269|PubMed:11279116, ECO:0000269|PubMed:21746878}.",,,"DNA binding [GO:0003677]; DNA-binding transcription activator activity, RNA polymerase II-specific [GO:0001228]; DNA-binding transcription factor activity, RNA polymerase II-specific [GO:0000981]; RNA polymerase II cis-regulatory region sequence-specific DNA binding [GO:0000978]; sequence-specific DNA binding [GO:0043565]; sequence-specific double-stranded DNA binding [GO:1990837]; transcription factor binding [GO:0008134]","DISEASE: Cleft palate, cardiac defects, and impaired intellectual development (CPCMR) [MIM:600987]: An autosomal dominant disease characterized by multiple congenital malformations, mild-to-severe intellectual disability with poor speech, and delayed psychomotor development. Congenital malformations include heart defects, cleft lip/palate, distally-placed thumbs and toes, and cutaneous syndactyly between the second and third toes. {ECO:0000269|PubMed:24678003, ECO:0000269|PubMed:25712757, ECO:0000269|PubMed:27225850}. Note=The disease is caused by variants affecting the gene represented in this entry.",
ADRA2C,Q13064,E3 ubiquitin-protein ligase makorin-3 (EC 2.3.2.27) (RING finger protein 63) (RING-type E3 ubiquitin transferase makorin-3) (Zinc finger protein 127),D15S9 RNF63 ZNF127,"FUNCTION: E3 ubiquitin ligase catalyzing the covalent attachment of ubiquitin moieties onto substrate proteins. Acts as a key developmental timer that helps ensure puberty begins at the appropriate age, by inhibiting premature activation of the reproductive hormone cascade. Epigenetically regulates GNRH1 transcription by disrupting the binding of methyl-DNA binding protein 3/MBD3 to the promoter of GNRH1. Mechanistically, mediates the non-proteolytic ubiquitination of MBD3 at multiple sites with 'Lys27' ubiquitin linkages and thereby regulates the methylation status of the genome, including GNRH1 promoter (PubMed:34692086). Modulates the stability and translation of GNRH1 mRNA by mediating the non-proteolytic ubiquitination of PABP family members PABPC1, PABPC3 and PABPC4 at multiple sites (PubMed:33744966). Participates also in the maintenance of genomic and epigenomic stability by regulating the abundance of APEX2 via 'Lys-48'-linked ubiquitination (PubMed:38705397). {ECO:0000250|UniProtKB:Q60764, ECO:0000269|PubMed:19066619, ECO:0000269|PubMed:34692086, ECO:0000269|PubMed:38705397}.",,PATHWAY: Protein modification; protein ubiquitination.,identical protein binding [GO:0042802]; metal ion binding [GO:0046872]; RNA binding [GO:0003723]; ubiquitin protein ligase activity [GO:0061630],"DISEASE: Precocious puberty, central 2 (CPPB2) [MIM:615346]: A condition defined as the development of secondary sexual characteristics in boys and girls at a chronological age that is 2.5 standard deviations below the mean age at onset of puberty in the population. Central precocious puberty results from premature activation of the hypothalamic-pituitary-gonadal axis. {ECO:0000269|PubMed:23738509, ECO:0000269|PubMed:24438377, ECO:0000269|PubMed:24628548, ECO:0000269|PubMed:25011910, ECO:0000269|PubMed:25316453, ECO:0000269|PubMed:34692086, ECO:0000269|PubMed:38705397}. Note=The disease is caused by variants affecting the gene represented in this entry.",
ADRA2C,O76011,"Keratin, type I cuticular Ha4 (Hair keratin, type I Ha4) (Keratin-34) (K34)",HHA4 HKA4 KRTHA4,,,,structural molecule activity [GO:0005198],,
ADRA2C,Q9NZC7,WW domain-containing oxidoreductase (EC 1.1.1.-) (Fragile site FRA16D oxidoreductase) (Short chain dehydrogenase/reductase family 41C member 1),FOR SDR41C1 WOX1,"FUNCTION: Putative oxidoreductase. Acts as a tumor suppressor and plays a role in apoptosis. Required for normal bone development (By similarity). May function synergistically with p53/TP53 to control genotoxic stress-induced cell death. Plays a role in TGFB1 signaling and TGFB1-mediated cell death. May also play a role in tumor necrosis factor (TNF)-mediated cell death. Inhibits Wnt signaling, probably by sequestering DVL2 in the cytoplasm. {ECO:0000250, ECO:0000269|PubMed:11719429, ECO:0000269|PubMed:15070730, ECO:0000269|PubMed:15548692, ECO:0000269|PubMed:16061658, ECO:0000269|PubMed:16219768, ECO:0000269|PubMed:19366691, ECO:0000269|PubMed:19465938}.","ACT_SITE 293; /note=""Proton acceptor""; /evidence=""ECO:0000250""",,enzyme binding [GO:0019899]; identical protein binding [GO:0042802]; oxidoreductase activity [GO:0016491]; transcription coactivator activity [GO:0003713],"DISEASE: Note=Defects in WWOX may be involved in several cancer types. The gene spans the second most common chromosomal fragile site (FRA16D) which is frequently altered in cancers (PubMed:10861292). Alteration of the expression and expression of some isoforms is associated with cancers. However, it is still unclear if alteration of WWOX is directly implicated in cancerogenesis or if it corresponds to a secondary effect (PubMed:10861292, PubMed:11572989, PubMed:15073125, PubMed:15131042, PubMed:15266310). {ECO:0000269|PubMed:10861292, ECO:0000269|PubMed:11572989, ECO:0000269|PubMed:15073125, ECO:0000269|PubMed:15131042, ECO:0000269|PubMed:15266310}.; DISEASE: Esophageal cancer (ESCR) [MIM:133239]: A malignancy of the esophagus. The most common types are esophageal squamous cell carcinoma and adenocarcinoma. Cancer of the esophagus remains a devastating disease because it is usually not detected until it has progressed to an advanced incurable stage. {ECO:0000269|PubMed:11956080}. Note=The disease may be caused by variants affecting the gene represented in this entry.; DISEASE: Spinocerebellar ataxia, autosomal recessive, 12 (SCAR12) [MIM:614322]: A form of spinocerebellar ataxia, a clinically and genetically heterogeneous group of cerebellar disorders. Patients show progressive incoordination of gait and often poor coordination of hands, speech and eye movements, due to degeneration of the cerebellum with variable involvement of the brainstem and spinal cord. SCAR12 is additionally characterized by onset of generalized seizures in infancy, and delayed psychomotor development with intellectual disability. Some patients may also show spasticity. {ECO:0000269|PubMed:24369382, ECO:0000269|PubMed:24456803}. Note=The disease is caused by variants affecting the gene represented in this entry.; DISEASE: Developmental and epileptic encephalopathy 28 (DEE28) [MIM:616211]: A form of epileptic encephalopathy, a heterogeneous group of severe early-onset epilepsies characterized by refractory seizures, neurodevelopmental impairment, and poor prognosis. Development is normal prior to seizure onset, after which cognitive and motor delays become apparent. {ECO:0000269|PubMed:25411445}. Note=The disease is caused by variants affecting the gene represented in this entry.",
ADRA2C,O14964,Hepatocyte growth factor-regulated tyrosine kinase substrate (Hrs) (Protein pp110),HRS,"FUNCTION: Involved in intracellular signal transduction mediated by cytokines and growth factors. When associated with STAM, it suppresses DNA signaling upon stimulation by IL-2 and GM-CSF. Could be a direct effector of PI3-kinase in vesicular pathway via early endosomes and may regulate trafficking to early and late endosomes by recruiting clathrin. May concentrate ubiquitinated receptors within clathrin-coated regions. Involved in down-regulation of receptor tyrosine kinase via multivesicular body (MVBs) when complexed with STAM (ESCRT-0 complex). The ESCRT-0 complex binds ubiquitin and acts as a sorting machinery that recognizes ubiquitinated receptors and transfers them to further sequential lysosomal sorting/trafficking processes. May contribute to the efficient recruitment of SMADs to the activin receptor complex. Involved in receptor recycling via its association with the CART complex, a multiprotein complex required for efficient transferrin receptor recycling but not for EGFR degradation.",,,metal ion binding [GO:0046872]; phosphatidylinositol binding [GO:0035091]; protein domain specific binding [GO:0019904]; ubiquitin binding [GO:0043130]; ubiquitin-like protein ligase binding [GO:0044389],,
ADRA2C,Q99750,MyoD family inhibitor (Myogenic repressor I-mf),,"FUNCTION: Inhibits the transactivation activity of the Myod family of myogenic factors and represses myogenesis. Acts by associating with Myod family members and retaining them in the cytoplasm by masking their nuclear localization signals. Can also interfere with the DNA-binding activity of Myod family members. Plays an important role in trophoblast and chondrogenic differentiation. Regulates the transcriptional activity of TCF7L1/TCF3 by interacting directly with TCF7L1/TCF3 and preventing it from binding DNA. Binds to the axin complex, resulting in an increase in the level of free beta-catenin. Affects axin regulation of the WNT and JNK signaling pathways (By similarity). {ECO:0000250}.",,,identical protein binding [GO:0042802]; transcription regulator inhibitor activity [GO:0140416],,
ADRA2C,D6RGL0,Alpha-2C adrenergic receptor (Alpha-2C adrenoreceptor),,FUNCTION: Alpha-2 adrenergic receptors mediate the catecholamine-induced inhibition of adenylate cyclase through the action of G proteins. {ECO:0000256|ARBA:ARBA00003331}.,,,alpha2-adrenergic receptor activity [GO:0004938],,
ADRA2C,Q4W594,Alpha-2C adrenergic receptor (Alpha-2C adrenoreceptor),,FUNCTION: Alpha-2 adrenergic receptors mediate the catecholamine-induced inhibition of adenylate cyclase through the action of G proteins. {ECO:0000256|ARBA:ARBA00003331}.,,,alpha2-adrenergic receptor activity [GO:0004938],,
ADRA1B,P35368,Alpha-1B adrenergic receptor (Alpha-1B adrenoreceptor) (Alpha-1B adrenoceptor),,"FUNCTION: This alpha-adrenergic receptor mediates its action by association with G proteins that activate a phosphatidylinositol-calcium second messenger system. Its effect is mediated by G(q) and G(11) proteins. Nuclear ADRA1A-ADRA1B heterooligomers regulate phenylephrine (PE)-stimulated ERK signaling in cardiac myocytes. {ECO:0000269|PubMed:18802028, ECO:0000269|PubMed:22120526}.",,,alpha1-adrenergic receptor activity [GO:0004937]; protein heterodimerization activity [GO:0046982],,CHEMBL232;
