MCM5,Q53FG5,DNA replication licensing factor MCM5 (EC 3.6.4.12),,"FUNCTION: Acts as a component of the MCM2-7 complex (MCM complex) which is the replicative helicase essential for 'once per cell cycle' DNA replication initiation and elongation in eukaryotic cells. Core component of CDC45-MCM-GINS (CMG) helicase, the molecular machine that unwinds template DNA during replication, and around which the replisome is built. The active ATPase sites in the MCM2-7 ring are formed through the interaction surfaces of two neighboring subunits such that a critical structure of a conserved arginine finger motif is provided in trans relative to the ATP-binding site of the Walker A box of the adjacent subunit. The six ATPase active sites, however, are likely to contribute differentially to the complex helicase activity. {ECO:0000256|ARBA:ARBA00045440}.; FUNCTION: Acts as component of the MCM2-7 complex (MCM complex) which is the replicative helicase essential for 'once per cell cycle' DNA replication initiation and elongation in eukaryotic cells. The active ATPase sites in the MCM2-7 ring are formed through the interaction surfaces of two neighboring subunits such that a critical structure of a conserved arginine finger motif is provided in trans relative to the ATP-binding site of the Walker A box of the adjacent subunit. The six ATPase active sites, however, are likely to contribute differentially to the complex helicase activity. {ECO:0000256|RuleBase:RU368063}.",,,ATP binding [GO:0005524]; ATP hydrolysis activity [GO:0016887]; ATP-dependent H2AZ histone chaperone activity [GO:0140849]; ATP-dependent H3-H4 histone complex chaperone activity [GO:0140665]; chromatin extrusion motor activity [GO:0140584]; cohesin loader activity [GO:0061775]; DNA clamp loader activity [GO:0003689]; DNA replication origin binding [GO:0003688]; double-stranded DNA helicase activity [GO:0036121]; forked DNA-dependent helicase activity [GO:0061749]; four-way junction helicase activity [GO:0009378]; single-stranded 3'-5' DNA helicase activity [GO:1990518],,
MCM5,B4DVK5,DNA replication licensing factor MCM5 (EC 3.6.4.12),,"FUNCTION: Acts as a component of the MCM2-7 complex (MCM complex) which is the replicative helicase essential for 'once per cell cycle' DNA replication initiation and elongation in eukaryotic cells. Core component of CDC45-MCM-GINS (CMG) helicase, the molecular machine that unwinds template DNA during replication, and around which the replisome is built. The active ATPase sites in the MCM2-7 ring are formed through the interaction surfaces of two neighboring subunits such that a critical structure of a conserved arginine finger motif is provided in trans relative to the ATP-binding site of the Walker A box of the adjacent subunit. The six ATPase active sites, however, are likely to contribute differentially to the complex helicase activity. {ECO:0000256|ARBA:ARBA00045440}.; FUNCTION: Acts as component of the MCM2-7 complex (MCM complex) which is the replicative helicase essential for 'once per cell cycle' DNA replication initiation and elongation in eukaryotic cells. The active ATPase sites in the MCM2-7 ring are formed through the interaction surfaces of two neighboring subunits such that a critical structure of a conserved arginine finger motif is provided in trans relative to the ATP-binding site of the Walker A box of the adjacent subunit. The six ATPase active sites, however, are likely to contribute differentially to the complex helicase activity. {ECO:0000256|RuleBase:RU368063}.",,,ATP binding [GO:0005524]; DNA replication origin binding [GO:0003688]; double-stranded DNA helicase activity [GO:0036121]; forked DNA-dependent helicase activity [GO:0061749]; four-way junction helicase activity [GO:0009378]; hydrolase activity [GO:0016787]; single-stranded 3'-5' DNA helicase activity [GO:1990518],,
MCM5,B1AHB2,DNA helicase (EC 3.6.4.12),,,,,ATP binding [GO:0005524]; DNA binding [GO:0003677]; double-stranded DNA helicase activity [GO:0036121]; forked DNA-dependent helicase activity [GO:0061749]; four-way junction helicase activity [GO:0009378]; single-stranded 3'-5' DNA helicase activity [GO:1990518],,
SLC1A1,P43005,Excitatory amino acid transporter 3 (Excitatory amino-acid carrier 1) (Neuronal and epithelial glutamate transporter) (Sodium-dependent glutamate/aspartate transporter 3) (Solute carrier family 1 member 1),EAAC1 EAAT3 HEAAC1,"FUNCTION: Sodium-dependent, high-affinity amino acid transporter that mediates the uptake of L-glutamate and also L-aspartate and D-aspartate (PubMed:21123949, PubMed:26690923, PubMed:33658209, PubMed:7521911, PubMed:7914198, PubMed:8857541). Can also transport L-cysteine (PubMed:21123949). Functions as a symporter that transports one amino acid molecule together with two or three Na(+) ions and one proton, in parallel with the counter-transport of one K(+) ion (PubMed:26690923, PubMed:33658209, PubMed:7521911, PubMed:8857541). Mediates Cl(-) flux that is not coupled to amino acid transport; this avoids the accumulation of negative charges due to aspartate and Na(+) symport (PubMed:26690923, PubMed:8857541). Plays an important role in L-glutamate and L-aspartate reabsorption in renal tubuli (PubMed:21123949). Plays a redundant role in the rapid removal of released glutamate from the synaptic cleft, which is essential for terminating the postsynaptic action of glutamate (By similarity). Contributes to glutathione biosynthesis and protection against oxidative stress via its role in L-glutamate and L-cysteine transport (By similarity). Negatively regulated by ARL6IP5 (By similarity). {ECO:0000250|UniProtKB:P51906, ECO:0000250|UniProtKB:P51907, ECO:0000269|PubMed:21123949, ECO:0000269|PubMed:26690923, ECO:0000269|PubMed:33658209, ECO:0000269|PubMed:7521911, ECO:0000269|PubMed:7914198, ECO:0000269|PubMed:8857541}.",,,chloride transmembrane transporter activity [GO:0015108]; cysteine transmembrane transporter activity [GO:0033229]; D-aspartate transmembrane transporter activity [GO:0140010]; glutamate binding [GO:0016595]; glutamate:sodium symporter activity [GO:0015501]; high-affinity L-glutamate transmembrane transporter activity [GO:0005314]; identical protein binding [GO:0042802]; L-aspartate transmembrane transporter activity [GO:0015183]; L-glutamate transmembrane transporter activity [GO:0005313]; metal ion binding [GO:0046872]; monoatomic anion channel activity [GO:0005253],"DISEASE: Dicarboxylic aminoaciduria (DCBXA) [MIM:222730]: An autosomal recessive disorder characterized by abnormal excretion of urinary glutamate and aspartate, resulting from the incomplete reabsorption of anionic amino acids from the glomerular filtrate in the kidney. It can be associated with intellectual disability. {ECO:0000269|PubMed:21123949}. Note=The disease is caused by variants affecting the gene represented in this entry.; DISEASE: Schizophrenia 18 (SCZD18) [MIM:615232]: A complex, multifactorial psychotic disorder or group of disorders characterized by disturbances in the form and content of thought (e.g. delusions, hallucinations), in mood (e.g. inappropriate affect), in sense of self and relationship to the external world (e.g. loss of ego boundaries, withdrawal), and in behavior (e.g bizarre or apparently purposeless behavior). Although it affects emotions, it is distinguished from mood disorders in which such disturbances are primary. Similarly, there may be mild impairment of cognitive function, and it is distinguished from the dementias in which disturbed cognitive function is considered primary. Some patients manifest schizophrenic as well as bipolar disorder symptoms and are often given the diagnosis of schizoaffective disorder. {ECO:0000269|PubMed:21982423, ECO:0000269|PubMed:23341099}. Note=Disease susceptibility is associated with variants affecting the gene represented in this entry. A deletion at the chromosome 9p24.2 locus, including SLC1A1, has been identified in patients with psychotic disorders (PubMed:21982423). This 84 kb deletion is immediately upstream of the SLC1A1 gene in a regulatory region that contains the full native promoter sequence, extends through exon 1 of the SLC1A1 mRNA, co-segregates with disease in an extended 5-generation pedigree and increases disease risk more than 18-fold for family members (PubMed:23341099). {ECO:0000269|PubMed:21982423, ECO:0000269|PubMed:23341099}.",CHEMBL2721;
SLC1A1,O75915,PRA1 family protein 3 (ADP-ribosylation factor-like protein 6-interacting protein 5) (ARL-6-interacting protein 5) (Aip-5) (Cytoskeleton-related vitamin A-responsive protein) (Dermal papilla-derived protein 11) (GTRAP3-18) (Glutamate transporter EAAC1-interacting protein) (JM5) (Prenylated Rab acceptor protein 2) (Protein JWa) (Putative MAPK-activating protein PM27),DERP11 JWA PRA2 PRAF3,"FUNCTION: Regulates intracellular concentrations of taurine and glutamate. Negatively modulates SLC1A1/EAAC1 glutamate transport activity by decreasing its affinity for glutamate in a PKC activity-dependent manner. Plays a role in the retention of SLC1A1/EAAC1 in the endoplasmic reticulum. {ECO:0000250|UniProtKB:Q8R5J9, ECO:0000250|UniProtKB:Q9ES40}.",,,,,
SLC1A1,H0Y7R2,Amino acid transporter,,"FUNCTION: Sodium-dependent, high-affinity amino acid transporter that mediates the uptake of L-glutamate and also L-aspartate and D-aspartate. Can also transport L-cysteine. Functions as a symporter that transports one amino acid molecule together with two or three Na(+) ions and one proton, in parallel with the counter-transport of one K(+) ion. Mediates Cl(-) flux that is not coupled to amino acid transport; this avoids the accumulation of negative charges due to aspartate and Na(+) symport. Plays an important role in L-glutamate and L-aspartate reabsorption in renal tubuli. Plays a redundant role in the rapid removal of released glutamate from the synaptic cleft, which is essential for terminating the postsynaptic action of glutamate. Contributes to glutathione biosynthesis and protection against oxidative stress via its role in L-glutamate and L-cysteine transport. Negatively regulated by ARL6IP5. {ECO:0000256|ARBA:ARBA00045494}.",,,L-amino acid transmembrane transporter activity [GO:0015179]; symporter activity [GO:0015293],,
SLC1A1,O75298,Reticulon-2 (Neuroendocrine-specific protein-like 1) (NSP-like protein 1) (Neuroendocrine-specific protein-like I) (NSP-like protein I) (NSPLI),NSPL1,"FUNCTION: Inhibits amyloid precursor protein processing, probably by blocking BACE1 activity (PubMed:15286784). Enhances trafficking of the glutamate transporter SLC1A1/EAAC1 from the endoplasmic reticulum to the cell surface (By similarity). Plays a role in the translocation of SLC2A4/GLUT4 from intracellular membranes to the cell membrane which facilitates the uptake of glucose into the cell (By similarity). {ECO:0000250|UniProtKB:O70622, ECO:0000250|UniProtKB:Q6WN19, ECO:0000269|PubMed:15286784}.",,,,"DISEASE: Spastic paraplegia 12, autosomal dominant (SPG12) [MIM:604805]: A form of spastic paraplegia, a neurodegenerative disorder characterized by a slow, gradual, progressive weakness and spasticity of the lower limbs. Rate of progression and the severity of symptoms are quite variable. Initial symptoms may include difficulty with balance, weakness and stiffness in the legs, muscle spasms, and dragging the toes when walking. In some forms of the disorder, bladder symptoms (such as incontinence) may appear, or the weakness and stiffness may spread to other parts of the body. {ECO:0000269|PubMed:22232211, ECO:0000269|PubMed:35684947}. Note=The disease is caused by variants affecting the gene represented in this entry.; DISEASE: Neuronopathy, distal hereditary motor, autosomal recessive 11, with spasticity (HMNR11) [MIM:620854]: A form of distal hereditary motor neuronopathy, a heterogeneous group of neuromuscular diseases caused by selective degeneration of motor neurons in the anterior horn of the spinal cord, without sensory deficit in the posterior horn. HMNR11 is an autosomal recessive form characterized by slowly progressive muscle weakness in the distal upper and lower limbs, lower limb spasticity and hyperreflexia, with onset in the first decade of life. Affected individuals have difficulty walking, although ambulation is retained into adulthood. Nerve conduction studies reveal axonal motor neuropathy with neurogenic changes in the electromyography. {ECO:0000269|PubMed:38527963}. Note=The disease is caused by variants affecting the gene represented in this entry.",
SLC1A1,Q8TBG9,Synaptoporin,,FUNCTION: Intrinsic membrane protein of small synaptic vesicles. Probable vesicular channel protein (By similarity). {ECO:0000250}.,,,,,
SLC1A1,Q15041,ADP-ribosylation factor-like protein 6-interacting protein 1 (ARL-6-interacting protein 1) (Aip-1) (Apoptotic regulator in the membrane of the endoplasmic reticulum),ARL6IP ARMER KIAA0069,"FUNCTION: Positively regulates SLC1A1/EAAC1-mediated glutamate transport by increasing its affinity for glutamate in a PKC activity-dependent manner. Promotes the catalytic efficiency of SLC1A1/EAAC1 probably by reducing its interaction with ARL6IP5, a negative regulator of SLC1A1/EAAC1-mediated glutamate transport (By similarity). Plays a role in the formation and stabilization of endoplasmic reticulum tubules (PubMed:24262037). Negatively regulates apoptosis, possibly by modulating the activity of caspase-9 (CASP9). Inhibits cleavage of CASP9-dependent substrates and downstream markers of apoptosis but not CASP9 itself (PubMed:12754298). May be involved in protein transport, membrane trafficking, or cell signaling during hematopoietic maturation (PubMed:10995579). {ECO:0000250|UniProtKB:Q9JKW0, ECO:0000269|PubMed:12754298, ECO:0000269|PubMed:24262037, ECO:0000303|PubMed:10995579}.",,,identical protein binding [GO:0042802],"DISEASE: Spastic paraplegia 61, autosomal recessive (SPG61) [MIM:615685]: A complicated form of spastic paraplegia with polysensory and motor neuropathy. Spastic paraplegia is a neurodegenerative disorder characterized by a slow, gradual, progressive weakness and spasticity of the lower limbs. Rate of progression and the severity of symptoms are quite variable. Initial symptoms may include difficulty with balance, weakness and stiffness in the legs, muscle spasms, and dragging the toes when walking. In some forms of the disorder, bladder symptoms (such as incontinence) may appear, or the weakness and stiffness may spread to other parts of the body. {ECO:0000269|PubMed:24482476, ECO:0000269|PubMed:30237576}. Note=The disease is caused by variants affecting the gene represented in this entry.",
SLC1A1,Q96PQ0,VPS10 domain-containing receptor SorCS2 [Cleaved into: SorCS2 122 kDa chain; SorCS2 104 kDa chain; SorCS2 18 kDa chain],KIAA1329,"FUNCTION: The heterodimer formed by NGFR and SORCS2 functions as receptor for the precursor forms of NGF (proNGF) and BDNF (proBDNF) (PubMed:22155786, PubMed:24908487). ProNGF and proBDNF binding both promote axon growth cone collapse (in vitro) (PubMed:22155786, PubMed:24908487). Plays a role in the regulation of dendritic spine density in hippocampus neurons (By similarity). Required for normal neurite branching and extension in response to BDNF (PubMed:27457814). Plays a role in BDNF-dependent hippocampal synaptic plasticity. Together with NGFR and NTRK2, is required both for BDNF-mediated synaptic long-term depression and long-term potentiation (PubMed:27457814). ProNGF binding promotes dissociation of TRIO from the heterodimer, which leads to inactivation of RAC1 and/or RAC2 and subsequent reorganization of the actin cytoskeleton (PubMed:22155786). Together with the retromer complex subunit VPS35, required for normal expression of GRIN2A at synapses and dendritic cell membranes. Required for normal expression of the amino acid transporter SLC1A1 at the cell membrane, and thereby contributes to protect cells against oxidative stress (By similarity). {ECO:0000250|UniProtKB:Q9EPR5, ECO:0000269|PubMed:22155786, ECO:0000269|PubMed:24908487, ECO:0000269|PubMed:27457814}.; FUNCTION: [SorCS2 122 kDa chain]: Does not promote Schwann cell apoptosis in response to proBDNF. {ECO:0000269|PubMed:24908487}.; FUNCTION: SorCS2 104 kDa chain and SorCS2 18 kDa chain together promote Schwann cell apoptosis in response to proBDNF. {ECO:0000269|PubMed:24908487}.",,,neuropeptide receptor activity [GO:0008188],,
SLC1A1,Q5T700,Low-density lipoprotein receptor class A domain-containing protein 1,,,,,,,
SLC1A1,Q7Z7N9,Transmembrane protein 179B,,,,,,,
SLC1A1,P78382,CMP-sialic acid transporter (CMP-SA-Tr) (CMP-Sia-Tr) (CST) (Solute carrier family 35 member A1),,"FUNCTION: Transports CMP-sialic acid from the cytosol into the Golgi apparatus, functioning as an antiporter that exchanges CMP-sialic acid for CMP (PubMed:12682060, PubMed:15576474, PubMed:23873973). Binds both CMP-sialic acid and free CMP, but has higher affinity for free CMP (By similarity). Also able to exchange CMP-sialic acid for AMP and UMP (PubMed:12682060). Also mediates the transport of CDP-ribitol (By similarity). {ECO:0000250|UniProtKB:Q61420, ECO:0000269|PubMed:12682060, ECO:0000269|PubMed:15576474, ECO:0000269|PubMed:23873973}.",,,antiporter activity [GO:0015297]; CMP-N-acetylneuraminate transmembrane transporter activity [GO:0005456],"DISEASE: Congenital disorder of glycosylation 2F (CDG2F) [MIM:603585]: CDGs are a family of severe inherited diseases caused by a defect in protein N-glycosylation. They are characterized by under-glycosylated serum proteins. These multisystem disorders present with a wide variety of clinical features, such as disorders of the nervous system development, psychomotor retardation, dysmorphic features, hypotonia, coagulation disorders, and immunodeficiency. The broad spectrum of features reflects the critical role of N-glycoproteins during embryonic development, differentiation, and maintenance of cell functions. {ECO:0000269|PubMed:15576474, ECO:0000269|PubMed:23873973, ECO:0000269|PubMed:28856833}. Note=The disease is caused by variants affecting the gene represented in this entry.",
SLC1A1,Q99942,E3 ubiquitin-protein ligase RNF5 (EC 2.3.2.27) (RING finger protein 5) (Ram1 homolog) (HsRma1),G16 NG2 RMA1,"FUNCTION: Membrane-bound E3 ubiquitin-protein ligase that mediates ubiquitination of target proteins (PubMed:11329381, PubMed:12861019, PubMed:16176924, PubMed:19269966, PubMed:19285439). May function together with E2 ubiquitin-conjugating enzymes UBE2D1/UBCH5A and UBE2D2/UBC4 (PubMed:11329381). Mediates ubiquitination of PXN/paxillin,thereby regulating cell motility and localization of PXN/paxillin (PubMed:12861019). Catalyzes ubiquitination of Salmonella type III secreted protein sopA (PubMed:16176924). Mediates the 'Lys-63'-linked polyubiquitination of JKAMP thereby regulating JKAMP function by decreasing its association with components of the proteasome and ERAD; the ubiquitination appears to involve E2 ubiquitin-conjugating enzyme UBE2N (PubMed:19269966). Mediates the 'Lys-48'-linked polyubiquitination of STING1 at 'Lys-150' leading to its proteasomal degradation; the ubiquitination occurs in mitochondria after viral transfection and regulates antiviral responses (PubMed:19285439). Catalyzes ubiquitination and subsequent degradation of ATG4B, thereby inhibiting autophagy (PubMed:23093945). {ECO:0000269|PubMed:11329381, ECO:0000269|PubMed:12861019, ECO:0000269|PubMed:16176924, ECO:0000269|PubMed:19269966, ECO:0000269|PubMed:19285439, ECO:0000269|PubMed:23093945}.",,"PATHWAY: Protein modification; protein ubiquitination. {ECO:0000269|PubMed:19269966, ECO:0000269|PubMed:19285439, ECO:0000269|PubMed:23093945}.",identical protein binding [GO:0042802]; protein-containing complex binding [GO:0044877]; ubiquitin protein ligase activity [GO:0061630]; ubiquitin-like protein conjugating enzyme binding [GO:0044390]; ubiquitin-protein transferase activity [GO:0004842]; zinc ion binding [GO:0008270],,
SLC1A1,Q14802,FXYD domain-containing ion transport regulator 3 (Chloride conductance inducer protein Mat-8) (Mammary tumor 8 kDa protein) (Phospholemman-like) (Sodium/potassium-transporting ATPase subunit FXYD3),MAT8 PLML,"FUNCTION: Associates with and regulates the activity of the sodium/potassium-transporting ATPase (NKA) which transports Na(+) out of the cell and K(+) into the cell (PubMed:17077088). Reduces glutathionylation of the NKA beta-1 subunit ATP1B1, thus reversing glutathionylation-mediated inhibition of ATP1B1 (PubMed:21454534). Induces a hyperpolarization-activated chloride current when expressed in Xenopus oocytes (PubMed:7836447). {ECO:0000269|PubMed:17077088, ECO:0000269|PubMed:21454534, ECO:0000269|PubMed:7836447}.; FUNCTION: [Isoform 1]: Decreases the apparent K+ and Na+ affinity of the sodium/potassium-transporting ATPase over a large range of membrane potentials. {ECO:0000269|PubMed:17077088}.; FUNCTION: [Isoform 2]: Decreases the apparent K+ affinity of the sodium/potassium-transporting ATPase only at slightly negative and positive membrane potentials and increases the apparent Na+ affinity over a large range of membrane potentials. {ECO:0000269|PubMed:17077088}.",,,ATPase binding [GO:0051117]; chloride channel activity [GO:0005254]; sodium channel regulator activity [GO:0017080],,
