CHRNA2,Q15822,Neuronal acetylcholine receptor subunit alpha-2,,"FUNCTION: After binding acetylcholine, the AChR responds by an extensive change in conformation that affects all subunits and leads to opening of an ion-conducting channel across the plasma membrane.",,,acetylcholine receptor activity [GO:0015464]; acetylcholine-gated monoatomic cation-selective channel activity [GO:0022848]; heterocyclic compound binding [GO:1901363]; quaternary ammonium group binding [GO:0050997],"DISEASE: Epilepsy, nocturnal frontal lobe, 4 (ENFL4) [MIM:610353]: An autosomal dominant focal epilepsy characterized by nocturnal seizures associated with fear sensation, tongue movements, and nocturnal wandering, closely resembling nightmares and sleep walking. {ECO:0000269|PubMed:16826524}. Note=The disease is caused by variants affecting the gene represented in this entry.; DISEASE: Seizures, benign familial infantile, 6 (BFIS6) [MIM:610353]: A form of benign familial infantile epilepsy, a neurologic disorder characterized by afebrile seizures occurring in clusters during the first year of life, without neurologic sequelae. BFIS6 inheritance is autosomal dominant. {ECO:0000269|PubMed:25847220}. Note=The disease may be caused by variants affecting the gene represented in this entry.",CHEMBL2109230;CHEMBL2109236;
CHRNA2,P19957,Elafin (Elastase-specific inhibitor) (ESI) (Peptidase inhibitor 3) (PI-3) (Protease inhibitor WAP3) (Skin-derived antileukoproteinase) (SKALP) (WAP four-disulfide core domain protein 14),WAP3 WFDC14,FUNCTION: Neutrophil and pancreatic elastase-specific inhibitor of skin. It may prevent elastase-mediated tissue proteolysis. Has been shown to inhibit the alpha-4-beta-2/CHRNA2-CHRNB2 nicotinic acetylcholine receptor and to produce a weak inhibition on Kv11.1/KCNH2/ERG1 and on the transient receptor potential cation channel subfamily V member 1 (TRPV1) (PubMed:29483648). {ECO:0000269|PubMed:29483648}.,,,endopeptidase inhibitor activity [GO:0004866]; serine-type endopeptidase inhibitor activity [GO:0004867]; structural constituent of skin epidermis [GO:0030280],,
CHRNA2,A0A0X1KG79,Cholinergic receptor nicotinic alpha 2 subunit,,,,,acetylcholine-gated monoatomic cation-selective channel activity [GO:0022848]; transmembrane signaling receptor activity [GO:0004888],,
CHRNA2,E5RGT4,Cholinergic receptor nicotinic alpha 2 subunit,,,,,,,
CHRNA2,E5RGP6,Cholinergic receptor nicotinic alpha 2 subunit,,,,,,,
CHRNA2,A0A1B0GVX5,Cholinergic receptor nicotinic alpha 2 subunit,,,,,extracellular ligand-gated monoatomic ion channel activity [GO:0005230],,
CHRNA2,E5RHQ4,Cholinergic receptor nicotinic alpha 2 subunit,,,,,,,
CHRNA2,E5RJ54,Cholinergic receptor nicotinic alpha 2 subunit,,,,,acetylcholine-gated monoatomic cation-selective channel activity [GO:0022848]; transmembrane signaling receptor activity [GO:0004888],,
CHRNA2,E5RK67,Cholinergic receptor nicotinic alpha 2 subunit,,,,,extracellular ligand-gated monoatomic ion channel activity [GO:0005230],,
SETD1A,O15047,Histone-lysine N-methyltransferase SETD1A (EC 2.1.1.364) (Lysine N-methyltransferase 2F) (SET domain-containing protein 1A) (hSET1A) (Set1/Ash2 histone methyltransferase complex subunit SET1),KIAA0339 KMT2F SET1 SET1A,"FUNCTION: Histone methyltransferase that catalyzes methyl group transfer from S-adenosyl-L-methionine to the epsilon-amino group of 'Lys-4' of histone H3 (H3K4) via a non-processive mechanism (PubMed:12670868, PubMed:25561738). Part of chromatin remodeling machinery, forms H3K4me1, H3K4me2 and H3K4me3 methylation marks at active chromatin sites where transcription and DNA repair take place (PubMed:29937342, PubMed:31197650, PubMed:32346159). Responsible for H3K4me3 enriched promoters and transcriptional programming of inner mass stem cells and neuron progenitors during embryogenesis (By similarity) (PubMed:31197650). Required for H3K4me1 mark at stalled replication forks. Mediates FANCD2-dependent nucleosome remodeling and RAD51 nucleofilaments stabilization at reversed forks, protecting them from nucleolytic degradation (PubMed:29937342, PubMed:32346159). Does not methylate 'Lys-4' of histone H3 if the neighboring 'Lys-9' residue is already methylated (PubMed:12670868). Binds RNAs involved in RNA processing and the DNA damage response (PubMed:38003223). {ECO:0000250|UniProtKB:E9PYH6, ECO:0000269|PubMed:12670868, ECO:0000269|PubMed:25561738, ECO:0000269|PubMed:29937342, ECO:0000269|PubMed:31197650, ECO:0000269|PubMed:32346159, ECO:0000269|PubMed:38003223}.",,,beta-catenin binding [GO:0008013]; histone H3K4 methyltransferase activity [GO:0042800]; histone H3K4 monomethyltransferase activity [GO:0140945]; histone H3K4 trimethyltransferase activity [GO:0140999]; RNA binding [GO:0003723]; RNA polymerase II-specific DNA-binding transcription factor binding [GO:0061629],"DISEASE: Epilepsy, early-onset, 2, with or without developmental delay (EPEO2) [MIM:618832]: An autosomal dominant neurologic disorder characterized by early onset of generalized tonic-clonic seizures associated with sharp wave and sharp slow wave discharges on EEG. Some EPEO2 patients have normal psychomotor development and normal brain imaging, whereas others may show developmental delay associated with abnormalities on brain imaging. {ECO:0000269|PubMed:31197650}. Note=The disease is caused by variants affecting the gene represented in this entry.; DISEASE: Neurodevelopmental disorder with speech impairment and dysmorphic facies (NEDSID) [MIM:619056]: An autosomal dominant disorder characterized by global developmental delay, intellectual disability, speech delay, subtle facial dysmorphism, and behavioral and psychiatric problems. {ECO:0000269|PubMed:32346159}. Note=The disease is caused by variants affecting the gene represented in this entry.",CHEMBL4105954;
SETD1A,P61964,WD repeat-containing protein 5 (BMP2-induced 3-kb gene protein),BIG3,"FUNCTION: Contributes to histone modification (PubMed:16600877, PubMed:16829960, PubMed:19103755, PubMed:19131338, PubMed:19556245, PubMed:20018852). May position the N-terminus of histone H3 for efficient trimethylation at 'Lys-4' (PubMed:16829960). As part of the MLL1/MLL complex it is involved in methylation and dimethylation at 'Lys-4' of histone H3 (PubMed:19556245). H3 'Lys-4' methylation represents a specific tag for epigenetic transcriptional activation (PubMed:18840606). As part of the NSL complex it may be involved in acetylation of nucleosomal histone H4 on several lysine residues (PubMed:19103755, PubMed:20018852). May regulate osteoblasts differentiation (By similarity). In association with RBBP5 and ASH2L, stimulates the histone methyltransferase activities of KMT2A, KMT2B, KMT2C, KMT2D, SETD1A and SETD1B (PubMed:21220120, PubMed:22266653). {ECO:0000250|UniProtKB:P61965, ECO:0000269|PubMed:16600877, ECO:0000269|PubMed:16829960, ECO:0000269|PubMed:18840606, ECO:0000269|PubMed:19103755, ECO:0000269|PubMed:19131338, ECO:0000269|PubMed:19556245, ECO:0000269|PubMed:20018852, ECO:0000269|PubMed:21220120, ECO:0000269|PubMed:22266653}.",,,histone binding [GO:0042393]; histone H3K4 methyltransferase activity [GO:0042800]; methylated histone binding [GO:0035064],,CHEMBL1075317;
SETD1A,P51610,Host cell factor 1 (HCF) (HCF-1) (C1 factor) (CFF) (VCAF) (VP16 accessory protein) [Cleaved into: HCF N-terminal chain 1; HCF N-terminal chain 2; HCF N-terminal chain 3; HCF N-terminal chain 4; HCF N-terminal chain 5; HCF N-terminal chain 6; HCF C-terminal chain 1; HCF C-terminal chain 2; HCF C-terminal chain 3; HCF C-terminal chain 4; HCF C-terminal chain 5; HCF C-terminal chain 6],HCF1 HFC1,"FUNCTION: Transcriptional coregulator (By similarity). Serves as a scaffold protein, bridging interactions between transcription factors, including THAP11 and ZNF143, and transcriptional coregulators (PubMed:26416877). Involved in control of the cell cycle (PubMed:10629049, PubMed:10779346, PubMed:15190068, PubMed:16624878, PubMed:23629655). Also antagonizes transactivation by ZBTB17 and GABP2; represses ZBTB17 activation of the p15(INK4b) promoter and inhibits its ability to recruit p300 (PubMed:10675337, PubMed:12244100). Coactivator for EGR2 and GABP2 (PubMed:12244100, PubMed:14532282). Tethers the chromatin modifying Set1/Ash2 histone H3 'Lys-4' methyltransferase (H3K4me) and Sin3 histone deacetylase (HDAC) complexes (involved in the activation and repression of transcription, respectively) together (PubMed:12670868). Component of a THAP1/THAP3-HCFC1-OGT complex that is required for the regulation of the transcriptional activity of RRM1 (PubMed:20200153). As part of the NSL complex it may be involved in acetylation of nucleosomal histone H4 on several lysine residues (PubMed:20018852). Recruits KMT2E/MLL5 to E2F1 responsive promoters promoting transcriptional activation and thereby facilitates G1 to S phase transition (PubMed:23629655). Modulates expression of homeobox protein PDX1, perhaps acting in concert with transcription factor E2F1, thereby regulating pancreatic beta-cell growth and glucose-stimulated insulin secretion (By similarity). May negatively modulate transcriptional activity of FOXO3 (By similarity). {ECO:0000250|UniProtKB:D3ZN95, ECO:0000269|PubMed:10629049, ECO:0000269|PubMed:10675337, ECO:0000269|PubMed:10779346, ECO:0000269|PubMed:12244100, ECO:0000269|PubMed:12670868, ECO:0000269|PubMed:14532282, ECO:0000269|PubMed:15190068, ECO:0000269|PubMed:16624878, ECO:0000269|PubMed:20018852, ECO:0000269|PubMed:20200153, ECO:0000269|PubMed:23629655, ECO:0000269|PubMed:26416877}.; FUNCTION: (Microbial infection) In case of human herpes simplex virus (HSV) infection, HCFC1 forms a multiprotein-DNA complex with the viral transactivator protein VP16 and POU2F1 thereby enabling the transcription of the viral immediate early genes. {ECO:0000269|PubMed:10629049, ECO:0000269|PubMed:17578910}.",,,cadherin binding [GO:0045296]; chromatin binding [GO:0003682]; DNA-binding transcription factor binding [GO:0140297]; identical protein binding [GO:0042802]; protein-macromolecule adaptor activity [GO:0030674]; transcription coactivator activity [GO:0003713],"DISEASE: Methylmalonic aciduria and homocystinuria, cblX type (MAHCX) [MIM:309541]: An X-linked recessive metabolic disorder characterized by severely delayed psychomotor development apparent in infancy, failure to thrive, impaired intellectual development, and intractable epilepsy. Additional features may include microcephaly and choreoathetosis. {ECO:0000269|PubMed:23000143}. Note=The disease is caused by variants affecting the gene represented in this entry.",
SETD1A,Q6UXN9,WD repeat-containing protein 82,SWD2 TMEM113 WDR82A,"FUNCTION: Regulatory component of the SET1/COMPASS complex implicated in the tethering of this complex to transcriptional start sites of active genes (PubMed:17998332, PubMed:18838538, PubMed:20516061). Facilitates histone H3 'Lys-4' methylation (H3K4me) via recruitment of the SETD1A or SETD1B to the 'Ser-5' phosphorylated C-terminal domain (CTD) of RNA polymerase II large subunit (POLR2A) (PubMed:17998332, PubMed:18838538). Component of PTW/PP1 phosphatase complex, which plays a role in the control of chromatin structure and cell cycle progression during the transition from mitosis into interphase (PubMed:20516061). Together with ZC3H4, but independently of the SET1 complex, part of a transcription termination checkpoint that promotes transcription termination of long non-coding RNAs (lncRNAs) (PubMed:33767452, PubMed:33913806). The transcription termination checkpoint is activated by the inefficiently spliced first exon of lncRNAs and promotes transcription termination of lncRNAs and their subsequent degradation by the exosome (PubMed:33767452). {ECO:0000269|PubMed:17998332, ECO:0000269|PubMed:18838538, ECO:0000269|PubMed:20516061, ECO:0000269|PubMed:33767452, ECO:0000269|PubMed:33913806}.",,,chromatin binding [GO:0003682],,
SETD1A,Q15291,Retinoblastoma-binding protein 5 (RBBP-5) (Retinoblastoma-binding protein RBQ-3),RBQ3,"FUNCTION: In embryonic stem (ES) cells, plays a crucial role in the differentiation potential, particularly along the neural lineage, regulating gene induction and H3 'Lys-4' methylation at key developmental loci, including that mediated by retinoic acid (By similarity). Does not affect ES cell self-renewal (By similarity). Component or associated component of some histone methyltransferase complexes which regulates transcription through recruitment of those complexes to gene promoters (PubMed:19131338). As part of the MLL1/MLL complex, involved in mono-, di- and trimethylation at 'Lys-4' of histone H3 (PubMed:19556245). Histone H3 'Lys-4' methylation represents a specific tag for epigenetic transcriptional activation (PubMed:19556245). In association with ASH2L and WDR5, stimulates the histone methyltransferase activities of KMT2A, KMT2B, KMT2C, KMT2D, SETD1A and SETD1B (PubMed:21220120, PubMed:22266653). {ECO:0000250|UniProtKB:Q8BX09, ECO:0000269|PubMed:19131338, ECO:0000269|PubMed:19556245, ECO:0000269|PubMed:21220120, ECO:0000269|PubMed:22266653}.",,,histone binding [GO:0042393]; transcription cis-regulatory region binding [GO:0000976],,CHEMBL3137282;
SETD1A,Q9H4Z2,Zinc finger protein 335 (NRC-interacting factor 1) (NIF-1),,"FUNCTION: Component or associated component of some histone methyltransferase complexes may regulate transcription through recruitment of those complexes on gene promoters (PubMed:19131338, PubMed:23178126). Enhances ligand-dependent transcriptional activation by nuclear hormone receptors (PubMed:12215545, PubMed:18180299, PubMed:19131338). Plays an important role in neural progenitor cell proliferation and self-renewal through the regulation of specific genes involved brain development, including REST (PubMed:23178126). Also controls the expression of genes involved in somatic development and regulates, for instance, lymphoblast proliferation (PubMed:23178126). {ECO:0000269|PubMed:12215545, ECO:0000269|PubMed:18180299, ECO:0000269|PubMed:19131338, ECO:0000269|PubMed:23178126}.",,,histone methyltransferase binding [GO:1990226]; metal ion binding [GO:0046872]; RNA polymerase II cis-regulatory region sequence-specific DNA binding [GO:0000978]; transcription cis-regulatory region binding [GO:0000976],"DISEASE: Microcephaly 10, primary, autosomal recessive (MCPH10) [MIM:615095]: A form of microcephaly, a disease defined as a head circumference more than 3 standard deviations below the age-related mean. Brain weight is markedly reduced and the cerebral cortex is disproportionately small. MCPH10 is characterized by extremely small head size and death usually by 1 year of age. Neuropathologic examination shows severe loss of neurons as well as neuronal loss of polarity and abnormal dendritic maturation. {ECO:0000269|PubMed:23178126}. Note=The disease is caused by variants affecting the gene represented in this entry.",
SETD1A,Q8NFC6,Biorientation of chromosomes in cell division protein 1-like 1,BOD1L FAM44A KIAA1327,"FUNCTION: Component of the fork protection machinery required to protect stalled/damaged replication forks from uncontrolled DNA2-dependent resection. Acts by stabilizing RAD51 at stalled replication forks and protecting RAD51 nucleofilaments from the antirecombinogenic activities of FBH1 and BLM (PubMed:26166705, PubMed:29937342). Does not regulate spindle orientation (PubMed:26166705). {ECO:0000269|PubMed:26166705, ECO:0000269|PubMed:29937342}.",,,,,
SETD1A,Q8NI51,Transcriptional repressor CTCFL (Brother of the regulator of imprinted sites) (CCCTC-binding factor) (CTCF paralog) (CTCF-like protein) (Cancer/testis antigen 27) (CT27) (Zinc finger protein CTCF-T),BORIS,"FUNCTION: Testis-specific DNA binding protein responsible for insulator function, nuclear architecture and transcriptional control, which probably acts by recruiting epigenetic chromatin modifiers. Plays a key role in gene imprinting in male germline, by participating in the establishment of differential methylation at the IGF2/H19 imprinted control region (ICR). Directly binds the unmethylated H19 ICR and recruits the PRMT7 methyltransferase, leading to methylate histone H4 'Arg-3' to form H4R3sme2. This probably leads to recruit de novo DNA methyltransferases at these sites (By similarity). Seems to act as tumor suppressor. In association with DNMT1 and DNMT3B, involved in activation of BAG1 gene expression by binding to its promoter. Required for dimethylation of H3 lysine 4 (H3K4me2) of MYC and BRCA1 promoters. {ECO:0000250, ECO:0000269|PubMed:12011441, ECO:0000269|PubMed:18413740, ECO:0000269|PubMed:18765639}.",,,"chromatin insulator sequence binding [GO:0043035]; DNA binding [GO:0003677]; DNA-binding transcription activator activity, RNA polymerase II-specific [GO:0001228]; histone binding [GO:0042393]; metal ion binding [GO:0046872]; RNA polymerase II cis-regulatory region sequence-specific DNA binding [GO:0000978]; sequence-specific DNA binding [GO:0043565]; transcription cis-regulatory region binding [GO:0000976]",,
SETD1A,Q9P0U4,CXXC-type zinc finger protein 1 (CpG-binding protein) (PHD finger and CXXC domain-containing protein 1),CFP1 CGBP PCCX1 PHF18,FUNCTION: Transcriptional activator that exhibits a unique DNA binding specificity for CpG unmethylated motifs with a preference for CpGG. {ECO:0000269|PubMed:21407193}.,,,cis-regulatory region sequence-specific DNA binding [GO:0000987]; methylated histone binding [GO:0035064]; unmethylated CpG binding [GO:0045322]; zinc ion binding [GO:0008270],,CHEMBL5169201;
SETD1A,Q9UBL3,Set1/Ash2 histone methyltransferase complex subunit ASH2 (ASH2-like protein),ASH2L1,"FUNCTION: Transcriptional regulator (PubMed:12670868). Component or associated component of some histone methyltransferase complexes which regulates transcription through recruitment of those complexes to gene promoters (PubMed:19131338). Component of the Set1/Ash2 histone methyltransferase (HMT) complex, a complex that specifically methylates 'Lys-4' of histone H3, but not if the neighboring 'Lys-9' residue is already methylated (PubMed:19556245). As part of the MLL1/MLL complex it is involved in methylation and dimethylation at 'Lys-4' of histone H3 (PubMed:19556245). May play a role in hematopoiesis (PubMed:12670868). In association with RBBP5 and WDR5, stimulates the histone methyltransferase activities of KMT2A, KMT2B, KMT2C, KMT2D, SETD1A and SETD1B (PubMed:21220120, PubMed:22266653). {ECO:0000269|PubMed:12670868, ECO:0000269|PubMed:19131338, ECO:0000269|PubMed:19556245, ECO:0000269|PubMed:21220120, ECO:0000269|PubMed:22266653}.",,,beta-catenin binding [GO:0008013]; metal ion binding [GO:0046872]; transcription cis-regulatory region binding [GO:0000976],,CHEMBL3137282;
SETD1A,Q9UPS6,Histone-lysine N-methyltransferase SETD1B (EC 2.1.1.364) (Lysine N-methyltransferase 2G) (SET domain-containing protein 1B) (hSET1B),KIAA1076 KMT2G SET1B,"FUNCTION: Histone methyltransferase that catalyzes methyl group transfer from S-adenosyl-L-methionine to the epsilon-amino group of 'Lys-4' of histone H3 (H3K4) via a non-processive mechanism (PubMed:17355966, PubMed:25561738). Part of chromatin remodeling machinery, forms H3K4me1, H3K4me2 and H3K4me3 methylation marks at active chromatin sites where transcription and DNA repair take place (PubMed:17355966, PubMed:25561738). Plays an essential role in regulating the transcriptional programming of multipotent hematopoietic progenitor cells and lymphoid lineage specification during hematopoiesis (By similarity). {ECO:0000250|UniProtKB:Q8CFT2, ECO:0000269|PubMed:17355966, ECO:0000269|PubMed:25561738}.",,,histone H3 methyltransferase activity [GO:0140938]; histone H3K4 monomethyltransferase activity [GO:0140945]; histone H3K4 trimethyltransferase activity [GO:0140999]; RNA binding [GO:0003723],"DISEASE: Intellectual developmental disorder with seizures and language delay (IDDSELD) [MIM:619000]: An autosomal dominant neurodevelopmental disorder characterized by mild to profound intellectual development impairment, speech and language delay, and seizures. Autism and anxiety are common features. Facial dysmorphism, tapering fingers, and pigmentary skin changes may also be observed. {ECO:0000269|PubMed:29322246, ECO:0000269|PubMed:31110234, ECO:0000269|PubMed:31440728, ECO:0000269|PubMed:31685013, ECO:0000269|PubMed:32546566}. Note=The disease is caused by variants affecting the gene represented in this entry.",CHEMBL4105837;
SETD1A,P55209,Nucleosome assembly protein 1-like 1 (NAP-1-related protein) (hNRP),NRP,"FUNCTION: Histone chaperone that plays a role in the nuclear import of H2A-H2B and nucleosome assembly (PubMed:20002496, PubMed:21211722, PubMed:26841755). Participates also in several important DNA repair mechanisms: greatly enhances ERCC6-mediated chromatin remodeling which is essential for transcription-coupled nucleotide excision DNA repair (PubMed:28369616). Stimulates also homologous recombination (HR) by RAD51 and RAD54 which is essential in mitotic DNA double strand break (DSB) repair (PubMed:24798879). Plays a key role in the regulation of embryonic neurogenesis (By similarity). Promotes the proliferation of neural progenitors and inhibits neuronal differentiation during cortical development (By similarity). Regulates neurogenesis via the modulation of RASSF10; regulates RASSF10 expression by promoting SETD1A-mediated H3K4 methylation at the RASSF10 promoter (By similarity). {ECO:0000250|UniProtKB:P28656, ECO:0000269|PubMed:20002496, ECO:0000269|PubMed:21211722, ECO:0000269|PubMed:24798879, ECO:0000269|PubMed:26841755, ECO:0000269|PubMed:28369616}.; FUNCTION: (Microbial infection) Positively regulates Epstein-Barr virus reactivation in epithelial cells through the induction of viral BZLF1 expression. {ECO:0000269|PubMed:23691099}.; FUNCTION: (Microbial infection) Together with human herpesvirus 8 protein LANA1, assists the proper assembly of the nucleosome on the replicated viral DNA. {ECO:0000269|PubMed:27599637}.",,,chromatin binding [GO:0003682]; histone binding [GO:0042393]; histone chaperone activity [GO:0140713]; RNA binding [GO:0003723],,
SETD1A,Q7KZ85,Transcription elongation factor SPT6 (hSPT6) (Histone chaperone suppressor of Ty6) (Tat-cotransactivator 2 protein) (Tat-CT2 protein),KIAA0162 SPT6H,"FUNCTION: Transcription elongation factor which binds histone H3 and plays a key role in the regulation of transcription elongation and mRNA processing. Enhances the transcription elongation by RNA polymerase II (RNAPII) and is also required for the efficient activation of transcriptional elongation by the HIV-1 nuclear transcriptional activator, Tat. Besides chaperoning histones in transcription, acts to transport and splice mRNA by forming a complex with IWS1 and the C-terminal domain (CTD) of the RNAPII subunit RPB1 (POLR2A). The SUPT6H:IWS1:CTD complex recruits mRNA export factors (ALYREF/THOC4, EXOSC10) as well as histone modifying enzymes (such as SETD2), to ensure proper mRNA splicing, efficient mRNA export and elongation-coupled H3K36 methylation, a signature chromatin mark of active transcription. SUPT6H via its association with SETD1A, regulates both class-switch recombination and somatic hypermutation through formation of H3K4me3 epigenetic marks on activation-induced cytidine deaminase (AICDA) target loci. Promotes the activation of the myogenic gene program by entailing erasure of the repressive H3K27me3 epigenetic mark through stabilization of the chromatin interaction of the H3K27 demethylase KDM6A. {ECO:0000269|PubMed:15060154, ECO:0000269|PubMed:17234882, ECO:0000269|PubMed:22316138, ECO:0000269|PubMed:23503590, ECO:0000269|PubMed:9514752}.",,,DNA binding [GO:0003677]; histone binding [GO:0042393]; nucleosome binding [GO:0031491]; RNA binding [GO:0003723],,
SETD1A,Q9C005,Protein dpy-30 homolog (Dpy-30-like protein) (Dpy-30L),,"FUNCTION: As part of the MLL1/MLL complex, involved in the methylation of histone H3 at 'Lys-4', particularly trimethylation. Histone H3 'Lys-4' methylation represents a specific tag for epigenetic transcriptional activation. May play some role in histone H3 acetylation. In a teratocarcinoma cell, plays a crucial role in retinoic acid-induced differentiation along the neural lineage, regulating gene induction and H3 'Lys-4' methylation at key developmental loci. May also play an indirect or direct role in endosomal transport. {ECO:0000269|PubMed:19556245, ECO:0000269|PubMed:19651892, ECO:0000269|PubMed:21335234}.",,,identical protein binding [GO:0042802]; protein homodimerization activity [GO:0042803],,
