ADR,SEQ,PT,HLT,HLGT,SOC_ABBREV,FATAL_YN
1,1,Melaena,Non-site specific gastrointestinal haemorrhages,Gastrointestinal haemorrhages NEC,Gastr,N
1,2,Occult blood positive,Faecal analyses NEC,Gastrointestinal investigations,Inv,N
2,1,Renal papillary necrosis,Renal vascular and ischaemic conditions,Renal disorders (excl nephropathies),Renal,Y
3,1,Oedema peripheral,Oedema NEC,General system disorders NEC,Genrl,N
3,2,Swelling of eyelid,"Lid, lash and lacrimal infections, irritations and inflammations","Ocular infections, irritations and inflammations",Eye,N
4,1,Oesophageal ulcer,Oesophageal ulcers and perforation,Gastrointestinal ulceration and perforation,Gastr,N
5,1,Renal failure,Renal failure and impairment,Renal disorders (excl nephropathies),Renal,Y
