ADR,SEQ,PT,HLT,HLGT,SOC_ABBREV,FATAL_YN
1,1,Abdominal discomfort,Gastrointestinal signs and symptoms NEC,Gastrointestinal signs and symptoms,Gastr,N
2,1,Asthenia,Asthenic conditions,General system disorders NEC,Genrl,N
2,2,Blood pressure abnormal,Vascular tests NEC (incl blood pressure),Cardiac and vascular investigations (excl enzyme tests),Inv,N
2,3,Dizziness,Neurological signs and symptoms NEC,Neurological disorders NEC,Nerv,N
2,4,Drug interaction,Interactions,Therapeutic and nontherapeutic effects (excl toxicity),Genrl,N
2,5,Headache,Headaches NEC,Headaches,Nerv,N
2,6,Heart rate abnormal,Heart rate and pulse investigations,Cardiac and vascular investigations (excl enzyme tests),Inv,N
2,7,Visual impairment,Visual impairment and blindness (excl colour blindness),Vision disorders,Eye,N
