ADR,SEQ,PT,HLT,HLGT,SOC_ABBREV,FATAL_YN
1,1,Pneumonia,Lower respiratory tract and lung infections,Infections - pathogen unspecified,Infec,Y
2,1,Cardiac failure,Heart failures NEC,Heart failures,Card,Y
3,1,Bradycardia,Rate and rhythm disorders NEC,Cardiac arrhythmias,Card,N
3,2,Hypotension,Vascular hypotensive disorders,Decreased and nonspecific blood pressure disorders and shock,Vasc,N
3,3,Myocardial ischaemia,Ischaemic coronary artery disorders,Coronary artery disorders,Card,N
4,1,Euphoric mood,Emotional and mood disturbances NEC,Mood disorders and disturbances NEC,Psych,N
5,1,Cardiac arrest,Ventricular arrhythmias and cardiac arrest,Cardiac arrhythmias,Card,N
