ADR,SEQ,PT,HLT,HLGT,SOC_ABBREV,FATAL_YN
1,1,Osteoarthritis,Osteoarthropathies,Joint disorders,Musc,N
1,2,Rash erythematous,"Rashes, eruptions and exanthems NEC",Epidermal and dermal conditions,Skin,N
2,1,Hepatic failure,Hepatic failure and associated disorders,Hepatic and hepatobiliary disorders,Hepat,N
2,2,Hypotension,Vascular hypotensive disorders,Decreased and nonspecific blood pressure disorders and shock,Vasc,N
2,3,Intestinal ischaemia,Gastrointestinal vascular occlusion and infarction,Gastrointestinal vascular conditions,Gastr,N
2,4,Nausea,Nausea and vomiting symptoms,Gastrointestinal signs and symptoms,Gastr,N
2,5,Ocular icterus,Cholestasis and jaundice,Hepatic and hepatobiliary disorders,Hepat,N
2,6,Sepsis,"Sepsis, bacteraemia, viraemia and fungaemia NEC",Infections - pathogen unspecified,Infec,Y
2,7,Yellow skin,Dermal and epidermal conditions NEC,Epidermal and dermal conditions,Skin,N
