ADR,SEQ,PT,HLT,HLGT,SOC_ABBREV,FATAL_YN
1,1,Abnormal behaviour,Abnormal behaviour NEC,Psychiatric and behavioural symptoms NEC,Psych,N
1,2,Aggression,Behaviour and socialisation disturbances,Personality disorders and disturbances in behaviour,Psych,N
1,3,Coprolalia,Speech articulation and rhythm disturbances,Communication disorders and disturbances,Psych,N
1,4,Drug ineffective,Therapeutic and nontherapeutic responses,Therapeutic and nontherapeutic effects (excl toxicity),Genrl,N
1,5,Epilepsy,Seizures and seizure disorders NEC,Seizures (incl subtypes),Nerv,N
1,6,"Hallucinations, mixed",Hallucinations (excl sleep-related),Disturbances in thinking and perception,Psych,N
1,7,Motor dysfunction,Dyskinesias and movement disorders NEC,Movement disorders (incl parkinsonism),Nerv,N
