ADR,SEQ,PT,HLT,HLGT,SOC_ABBREV,FATAL_YN
1,1,Dizziness,Neurological signs and symptoms NEC,Neurological disorders NEC,Nerv,N
1,2,Palpitations,Cardiac signs and symptoms NEC,"Cardiac disorders, signs and symptoms NEC",Card,N
1,3,Psychomotor hyperactivity,Dyskinesias and movement disorders NEC,Movement disorders (incl parkinsonism),Nerv,N
2,1,Angina pectoris,Ischaemic coronary artery disorders,Coronary artery disorders,Card,N
2,2,Arrhythmia,Rate and rhythm disorders NEC,Cardiac arrhythmias,Card,N
2,3,Dyspnoea,Breathing abnormalities,Respiratory disorders NEC,Resp,N
2,4,Presyncope,Neurological signs and symptoms NEC,Neurological disorders NEC,Nerv,N
