ADR,SEQ,PT,HLT,HLGT,SOC_ABBREV,FATAL_YN
1,1,Lip swelling,Oral soft tissue swelling and oedema,Oral soft tissue conditions,Gastr,N
1,2,Peripheral swelling,General signs and symptoms NEC,General system disorders NEC,Genrl,N
1,3,Urticaria,Urticarias,Angioedema and urticaria,Skin,N
2,1,Erythema,Erythemas,Epidermal and dermal conditions,Skin,N
2,2,Pruritus,Pruritus NEC,Epidermal and dermal conditions,Skin,N
2,3,Rash,"Rashes, eruptions and exanthems NEC",Epidermal and dermal conditions,Skin,N
2,4,Rash,"Rashes, eruptions and exanthems NEC",Epidermal and dermal conditions,Skin,N
