ADR,SEQ,PT,HLT,HLGT,SOC_ABBREV,FATAL_YN
1,1,Abdominal pain lower,Gastrointestinal and abdominal pains (excl oral and throat),Gastrointestinal signs and symptoms,Gastr,N
1,2,Decreased appetite,Appetite disorders,Appetite and general nutritional disorders,Metab,N
1,3,Diarrhoea,Diarrhoea (excl infective),Gastrointestinal motility and defaecation conditions,Gastr,N
1,4,Eye pain,Ocular disorders NEC,Eye disorders NEC,Eye,N
1,5,Genital burning sensation,Reproductive tract signs and symptoms NEC,Reproductive tract disorders NEC,Repro,N
1,6,Malaise,Asthenic conditions,General system disorders NEC,Genrl,N
