ADR,SEQ,PT,HLT,HLGT,SOC_ABBREV,FATAL_YN
1,1,Drug ineffective,Therapeutic and nontherapeutic responses,Therapeutic and nontherapeutic effects (excl toxicity),Genrl,N
1,2,Impaired healing,Healing abnormal NEC,Tissue disorders NEC,Genrl,N
1,3,Necrosis,Necrosis NEC,Tissue disorders NEC,Genrl,N
1,4,Pain of skin,Dermal and epidermal conditions NEC,Epidermal and dermal conditions,Skin,N
1,5,Product physical consistency issue,Product physical issues,"Product quality, supply, distribution, manufacturing and quality system issues",Prod,N
2,1,Drug dependence,Substance related and addictive disorders,Psychiatric disorders NEC,Psych,N
2,2,Product use issue,"Medication errors, product use errors and issues NEC",Medication errors and other product use errors and issues,Inj&P,N
3,1,Anal inflammation,Anal and rectal signs and symptoms,Anal and rectal conditions NEC,Gastr,N
