ADR,SEQ,PT,HLT,HLGT,SOC_ABBREV,FATAL_YN
1,1,Dermatitis contact,Dermatitis and eczema,Epidermal and dermal conditions,Skin,N
2,1,Cleft lip,"Musculoskeletal and connective tissue disorders of face, neck and jaw congenital",Musculoskeletal and connective tissue disorders congenital,Cong,N
2,2,Cleft palate,Palate disorders congenital,Gastrointestinal tract disorders congenital,Cong,N
3,1,Pollakiuria,Bladder and urethral symptoms,Urinary tract signs and symptoms,Renal,N
4,1,Vaginal infection,Female reproductive tract infections,Infections - pathogen unspecified,Infec,N
5,1,Unintended pregnancy,Unintended pregnancies,"Pregnancy, labour, delivery and postpartum conditions",Preg,N
6,1,Purpura,Purpura and related conditions,Skin vascular abnormalities,Skin,N
