ADR,SEQ,PT,HLT,HLGT,SOC_ABBREV,FATAL_YN
1,1,Cleft lip,"Musculoskeletal and connective tissue disorders of face, neck and jaw congenital",Musculoskeletal and connective tissue disorders congenital,Cong,N
1,2,Cleft palate,Palate disorders congenital,Gastrointestinal tract disorders congenital,Cong,N
2,1,Abdominal pain,Gastrointestinal and abdominal pains (excl oral and throat),Gastrointestinal signs and symptoms,Gastr,N
2,2,Diarrhoea,Diarrhoea (excl infective),Gastrointestinal motility and defaecation conditions,Gastr,N
3,1,Congenital multiplex arthrogryposis,Musculoskeletal disorders congenital NEC,Musculoskeletal and connective tissue disorders congenital,Cong,N
