ADR,SEQ,PT,HLT,HLGT,SOC_ABBREV,FATAL_YN
1,1,Abdominal pain,Gastrointestinal and abdominal pains (excl oral and throat),Gastrointestinal signs and symptoms,Gastr,N
1,2,Constipation,Gastrointestinal atonic and hypomotility disorders NEC,Gastrointestinal motility and defaecation conditions,Gastr,N
1,3,Vomiting,Nausea and vomiting symptoms,Gastrointestinal signs and symptoms,Gastr,N
2,1,Faeces hard,Faecal abnormalities NEC,Gastrointestinal signs and symptoms,Gastr,N
2,2,Intestinal obstruction,Gastrointestinal stenosis and obstruction NEC,Gastrointestinal stenosis and obstruction,Gastr,N
3,1,Blood phosphorus increased,Mineral and electrolyte analyses,"Water, electrolyte and mineral investigations",Inv,N
3,2,Rash erythematous,"Rashes, eruptions and exanthems NEC",Epidermal and dermal conditions,Skin,N
