ADR,SEQ,PT,HLT,HLGT,SOC_ABBREV,FATAL_YN
1,1,Depression,Depressive disorders,Depressed mood disorders and disturbances,Psych,N
2,1,Abdominal pain upper,Gastrointestinal and abdominal pains (excl oral and throat),Gastrointestinal signs and symptoms,Gastr,N
2,2,Drug-induced liver injury,Hepatocellular damage and hepatitis NEC,Hepatic and hepatobiliary disorders,Hepat,N
2,3,Jaundice,Cholestasis and jaundice,Hepatic and hepatobiliary disorders,Hepat,N
2,4,Nausea,Nausea and vomiting symptoms,Gastrointestinal signs and symptoms,Gastr,N
